rating,title,review
5,Perfect hotel!,Great location for conference needs at nearby convention center. Gold Floor has wonderful space and service...Jewel is excellent and listed activities in Austin for us. She is wonderful! Roger at the front desk was also amazing ! Cassie at Revue was sweet and had great food! Best hotel gym by far. Thank you Fairmont Austin. :)
5,Impeccable,A beautiful hotel with great service and amenities! I would highly recommend and will definitely stay again! Pool area is a must and I felt drink prices were very reasonable for the location. Plenty to keep you busy in and around the hotel.
5,Stellar Hotel,AC unit was acting weird and screwed with our sleep. But everything else was top notch. Especially the pool area. This hotel is in a hot spot of DT as well so easy to get around to the night spots and great restaurants.
5,Great!,Great hotel! A bit on the expensive side but the rooms are clean and the beds are comfortable. The restaurant and bar and excellent. The Sunday brunch was incredible. I would stay there again when I return to Austin.
5,THANK YOU FAIRMONT AND STAFF!!!!,Our entire stay at Fairmont was an amazing experience. Fairmont exceeded our expectations. Little thing as giving us a higher level room due to it being our anniversary to sending a happy anniversary dessert to our room. We will definitely make Fairmont our home when staying in Austin. Sixth street was two blocks away. Couldn’t have gotten any better. The pool was amazing; great environment.
5,Great Place to Stay,"The customer service at the Fairmont Austin is first class! We were there for a work conference and our flight arrived mid morning and the Fairmont was very accommodating in letting us check in early. Rooms were very nice and comfortable. The room was very clean. The bed was oh so comfortable but the pillows were too soft but I know that's a personal preference. There is no refrigerator or microwave in the rooms so we weren't able to bring any doggy bags home from the restaurants but overall the Fairmont is a very, very nice place to stay."
5,Great hotel,"The hotel itself was extremely comfortable and we loved the gold lounge food and service. They did an excellent job. Service at the pool could be better for beverages. We did not have service there but the pool was excellent. Room, pillows and bed was the best!"
5,Fabulous Fairmont!,"Amazing in every way. Most friendly, helpful staff, beautiful room. Lobby with live music every night was a perfect bonus. Location is perfect. Able to walk everywhere. I would stay again, and never look anywhere else."
5,Fairmont Austin Review,This is an excellent facility with modern accommodations and an attentive staff. The cafe and restaurante offerings were diverse and allowed for a wide selection of plates and beverages. The spa facilities were superb.
5,Excellent Hotel,"Beautiful and clean hotel. The facility was very classy, clean, and up-to-date. They have a magnifying mirror in the room as well as a Nespresso machine. Such an amazing place. The beds were very comfortable as well. I loved the layout of the rooms."
4,"Gorgeous hotel, but be prepared for a party crowd!","This hotel is stunning. The pool--one of its main attractions-- was way too crowded. And, while in theory ""family friendly,"" we were there with the old (grandparents) and babies. We did not find it to very ""family comfortable."" No shade at the pool . For the price tag, there should have been more.Also, be prepared for loads of bachelor/-ette type crowds. If you are looking for a party scene, this is a good choice; if with family, there are probably better options.I would still return. It is gorgeous!"
5,great hotel,Top notch service and great rooms make this a no brainer! Great pool ideal for kidsI would encourage management to have a focus on families with kids like other properties do esp given the demographics
5,Amazing weekend!,"Just spent the past three nights at the beautiful Fairmont Austin. My wife and I were lucky to stay in one of the Fairmont Gold rooms and had an amazing experience with the entire staff there.A few names I must mention are Sebastian, Brandon, Brandan, Jewell, Juan, Monica, Dave, Jose, and Mayank.Each and every staff member was extremely attentive, helpful, but most notably delivered authentic hospitality. We will return primarily because of the staff, location and brand were a bonus. Thank you all for such an amazing weekend."
5,Outstanding,"Great service, delicious food, nice room, beautiful lobby. Here for a conference and everything was handled well. Needed a larger ice bucket and a different blanket, which they delivered to the room. No complaints."
5,Excellent Property - one minor complaint,"Beautiful room, courteous and helpful staff, first-class accommodations, good location downtown. I have one minor complaint. The design of the very nice shower with the glass door resulted in a big puddle of water next to the shower every time I took a shower."
2,Missed the mark!,"This was a group business trip which had approximately 20 rooms paid by one account. Needless to say, we spent a lot of money here. Checkin went exceptionally well. After that, it all goes south! This is a beautiful property however it feels as though they don’t embrace their own customer service corporate culture.A word to the wise, do not accept an adjoining room! We were booked into a standard room and upgraded at checkin to a deluxe room. For that, I was very appreciative.After we checked-in, I decided to order room service. I ordered chicken that came with mashed potatoes. The chicken was hot however the potatoes were ice cold! I called room service to let them know and they offered new hot ones however I declined as I no longer wanted them. Even though I declined, nothing else was offered. If she had removed the room service delivery charge or SOMETHING, it would have been a nice jester...but nothing!Our room had an adjoining door and it wasn’t until the next morning I realized just how noisy this would be. First, it started with his alarm. When it went off I thought it was mine as we have the same alarm tone. I was privileged to hear 100% of his conversation with his wife since he was using his speakerphone. While he took his shower, I felt as if I was in his bathroom as I again heard it all!!! While he was showering, I believe I counted 9 text messages as they dinged upon arrival. I called downstairs to inquire about a new room and was told I would have to be inconvenienced if I wanted a new room. Ironically, when I told her she needed to get management involved; a room mysteriously became available and we did move later that day. I was appreciative of the managers efforts. The rooms are nice with large showers. The let down is the shower spray is more of a trickle than shower. Both rooms had the same low water volume coming from the shower head so it’s obviously a property issue.After we endured our neighbors’ conversations and shower, we ordered breakfast. Well guess what...my oatmeal was not even close to being warm. This time when I called to report the problem, I did accept a replacement. However, I reported it to the manager that gave us the new room and also explained about last nights room service problem. While she did state she would order “piping hot oatmeal” again, nothing was offered for the inconvenience; especially since it was now twice in a row! Oh and by the way, they failed to provide her request of “piping hot”. I believe “just barely warm” was a better way to describe the replacement oats. I gave up!!!We had a group dinner and the next morning the host of the dinner apologized to the group for “horrible” food and service. One of the menu items was fish that came out so dry and overcooked, it was barely edible. The short rib was ok but just...ok. It too was overcooked and dry. We asked if they would roll the portable bar into our dining room and they stated they couldn’t because it would, “make too much noise.” Yes, you read that right! Now, this was an open bar dinner and the servers, who lacked knowledge in attention to guests, guarded the bottles of wine as if it were the prohibition era and never provided additional drinks from the portable bar. Several times, guests had to get up and pour their own wine while the servers happily watched. If the servers did come by with wine is was because a dinner guest requested. They would quickly leave the table once that guests glass was poured without refilling others glass.I believe everyone in this hotel should take lessons from the downstairs bartenders. They exemplified a level of customer service I believe corporate wants. We went back to the bar on our second night and when they did not have the champagne my wife ordered, they poured Louis Roederer Cristal as a replacement but charged her for her original request!!! No THAT’s customer service!!! On our last night, we decided to go to the bar on the 7th floor. Once she took our order and learned we would be taking our drinks to the room, she quickly grabbed plastic cups. I’m sorry, I don’t drink quality scotch from a plastic cup! I asked why the downstairs bar allows the same glassware to go to the room yet this bar doesn’t and her response was as I expected, “Um...that’s a good question.” Needless to say, we left and went downstairs and got our drinks for the room.Overall, this is a great looking property but from the time the valet took the keys and waited for their tip in a VERY obvious manner, until checkout, we experienced too many inconsistencies to recommend this property. Did they take care of the room...yes. However, for what you pay at this property, you should not expect consistent poor service.I am a top tier member of Marriotts’ program and even in their lower budget properties, I don’t experience these levels of inconsistencies. There is a reason I have placed my loyalty with Marriott. I’m sorry Fairmont Austin, I can’t recommend you as a place to stay."
5,Wonderful modern hotel,"A large Confrence hotel well located , good bars , quality gym with peloton bikes (2) .rooms spacious and comfortable beds , the club lounge is very good and worth upgrading to . Swimming pool busy and spacious"
5,Best brunch....ever!,This was the most incredible experience at the Fairmont Austin! Their brunch and environment was like nothing I’ve experienced and food was delicious. Shout out to our bartender Michael! He was very accommodating and helped us along the entire brunch experience 😊 I’m definitely recommending to all friends who are in the Austin area!
5,ENFOS Meeting,"Hotel was very crisp and clean with a beautiful lobby and bar area. The catering facilities on the 7th floor outside deck were very nice. One comment though: we had many meals out there and there was virtually no shade. An easy fix would be to install ""sails"" above the open seating/grassy area that would allow air to move through, but would shade your customers."
5,Above and beyond excellence,"This was by far the best experience I have ever had. From excellent, tasty food at the Revue to customer service requests. Everyone was very nice and professional. Rooms very clean, beds comfortable. Can’t wait to come back here! Thank you to all at the Fairmont!!!"
5,Everything was great...except the shower,"Shower head in room 1128 was broken - couldn’t get a full stream of water from the shower head. Most of it came out through the faucet, so I couldn’t wash my hair properly and ended up being late to an event as a result. Everything else was great. Beautiful rooms, wonderful bed, excellent customer service from the staff."
5,fairmont summer,First time to Austin and the Fairmont couldn't of been better! The staff is amazing!!! The restaurant options are perfect for everyone! The club level was my favorite treat! The staff is so amazing! Made you feel so welcome!
1,9/23 to 9/25,"Check in long lines -- not staffed well enough to handle crowd. Got to the room and key did not work, back down rekeyed 3x before they got it right. Elevators were a joke, No express elevators to the higher floors resulted in stopping at each floor, elevator failed to work on two occasions and had to take stairs, check out long lines mixed with check ins and not enough staff. Construction all around the hotel = not a pleasant setting. Result = Terrible, I would not recommend to anyone."
4,Fairmont Austin,"Rooms are very clean, staff is very nice and helpful. The location is good but the construction around is a little annoying if you have to get out. Hopefully that will be done soon, otherwise I would definitely recommend this hotel."
5,WOW!,"Wow to the bed, pillows, shower, room decor, design, robe and OMG the views from your room. Had an incredible experience and all staff were professional and engaging. Have to start booking my hotel stays at Fairmont only lol"
5,Outstanding hotel with top service,"From the moment I entered the hotel property I was blown away by the kindness of the staff-from the valet, front desk, house keeping, to restaurant/bar and coffee shop staff, everyone I encountered was smiling! The hotel itself is beyond gorgeous. But what made it stand out from the rest was the top notch service. I forgot my toothbrush and asked where I could buy one in the hotel, they were knocking on my door within minutes to deliver one. Jess W went above and beyond to make sure my work stay was comfortable and seamless as this was my first time traveling this far by myself. Thank you!! I stayed in one of the Gold rooms which gave me access to the private lounge, I would highly recommend this! The food and snacks were great, and the private concierge was a total win.My view from the room was beautiful. The bed was one of the most comfortable I've slept in. Very neat layout of the pool, bar, and fitness center. Everything was spotless. This hotel exceeded my expectations and I was very happy with my stay. I will definitely be returning to Fairmont!"
5,Great property... hits all the check boxes,"Great property, centrally located in downtown Austin attached to the convention Center. Fantastic pool area on the 7th floor.A+ property... Also if you had enough bbq food during your visit the margherita pizza at the Fairmont is amazing."
5,Lovely Hotel,"Great Hotel, Great Location for the Convention CenterPerfect Room on 23rd Floor, Nice view of the pool.Loads of space, great staffdesperately trying to fill this review to use the required minimum 200 characters"
5,Amazing Service! Hope to come again!,Everything about this place is top notch! I lost my ID on the plane and they were still able to accommodate me. Staff were all unbelievably pleasant. The drinks are the best that I've had anywhere! The beds are very comfortable and the food is delicious. 100% recommend!
3,below expectations,the parking garage is more frustrating that anyone can imagine. i recommend the GM park there the same way a guest does and then try to get out in a timely manner with their room key. i self parked because last year it took 30 min for valet to get my car... this time it took 10 m even after i pulled up to the kiosk. for $34/ night are you kidding me? WIFI never worked properly for our group which was the STXFDAF- check it out.
5,RTX Experience,I had a wonderful stay at the Fairmont and I would definitely go back for my future trips whenever RTX rolls into Austin. The only minor hiccup that I have is that the incidental fee per night was not included in the total until you get the to front deask to check in. Adding that to the total via online registration would make it a lot easier in budgeting money for your stay.
5,Working stay,Very present staff. Entire hotel was very clean. Relaxing and comfortable. Food was great too. The floors were quite. Beds were comfortable with plenty of pillow. The restrooms in the conference area were always clean. Love that your hotel is pet friendly. I will be back for many reasons.
5,My Pleasure,"Every person that assisted in me in some way always said ""My pleasure"" and I really think they meant it. Your staff has excellent customer service skills. The food that was provided for the ONCO CLOUD reception was phenomenal."
5,The Best Customer Journey,"The people at the Fairmont are amazing. I had my two dogs with me and they treated us so well. Loving on the puppies and making them feel at home. We live in Austin, and yet, staying at The Fairmont made it feel like home even though we weren't in our own. Thank you for great service, amazing food, excellent help, and making our stay so enjoyable!"
5,Austin Hotels,The employees were great -- Jessie and Daly were great on the Gold floor. My only real complaint is that it takes forever to get people to answer the phone...they really need more phone lines and more people answering the phone.
5,Work Trip,"It has a nice pool and jacuzzi that opens at 6am. It is an easy commute to the Austin Convention Center, and the staff is very helpful. Walking distance to the bridge where you can see millions of bats fly around 8pm from May- October."
5,Very Nice Hotel,"The hotel is truly very beautiful, the decor inside the Lobby and in the rooms is excellent. Bathroom and amenities top notch. Kudos also for having Nespresso coffee makers and liquid creamer. Location is amazing in the middle of everything"
5,Conference trip,Beautiful hotel with beautiful interior! All the colors and details were fabulous! I enjoyed the entire stay! The bar and lobby were really pretty and the bar had good drinks! This venue was perfect for the conference I attended
5,Great Austin Hotel,"I went to the Fairmont for a business trip. The hotel staff was all very friendly and super helpful. The hotel lobby was beautifully well done. The hotel had a few restaurants and bars. The food was outstanding everywhere we ate. The hotel is also located within walking distance of several great restaurants. The rooms were a great size and very clean. I used the gym during my visit. Nice large space with several machines (including a Peloton), weights and a space to stretch. They had towels (dry and refrigerated) and water available. I would stay here again."
5,Great Hotel,I had an awesome stay at the Fairmont in Austin Tx. I was in town for a conference and the Fairmont made my trip very enjoyable. I will plan to stay at the Fairmont Austin the next time my travels lead me to Austin Texas.
5,Hello Austin!,"My husband and I were in town for a conference that was being held at the Fairmont. We loved every second of our stay. Every bit of luxury you would expect was available for us. We dined at 3 of the 4 restaurants and everything was amazing. We would highly suggest the Miso bowls at Revue and the Old Fashions at the Fulton.Order room service too!The rooms were impeccably clean, the beds were very comfortable the view was perfect.We will definitely stay there again if we make it back to Austin!"
5,Our favourite Hotel in Austin - Perfect Location,"I go to Austin a couple times a year for business and had a meeting at the Convention Center.I stayed on the top floor, view was outstanding.Very easy access to excellent restaurants in Central Austin and easy to get everywhere on foot or by car.Service was excellent and even when they knew I wasn't a Platinum member. The concierge went out of her way to find us a good vegetarian restaurant which can be a challenge in Austin(when you aren't local).Live music every nightHighly recommended."
5,Another fabulous Fairmont,"stunning first impression, beautiful decor throughout. restaurant Revue, delicious and creative. The banquet food was actually close to hot, unusual for a conference. everyone very friendly and helpful."
5,Best hotel in Austin!,"We have stayed at the Fairmont several times now and it's always a fantastic experience - everything from the room, the view, the pool, the spa, the food and the service have been outstanding. We have stayed at other hotels in Austin and they do not compare to the Fairmont - not even close. I highly recommend this beautiful hotel to anyone visiting Austin or enjoying a staycation - you will love every minute of it."
5,"Nice location, great pool.","Great conference location so close to entertainment and classic Austin food standards. Didn’t get to the pool until final afternoon, but it is the highlight of this hotel. Would definitely recommend for business travel."
5,Outstanding in every way!,"We have stayed at the fairmont Austin on more than one occasion. We have stayed in almost all the hotels in Austin. This hotel is head and shoulders above the rest. The service is exceptional, the amenities are amazing and the choice of food selection is never ending. You can have Mexican street food on the pool deck, raw oysters in one of the 4 restaurants downstairs or a upscale steak dinner in Garrison. Which by the way has an amazing whiskey offering. We often go for drinks in the “lobby” bar and listen to live music as it’s always different. The bartenders always come Up with something fun for us and the bar menu for food is delicious. Try their chicken nuggets!This past stay we went all out and went to the spa. WOW!!!! McKenzie was fantastic. I’m not a spa guy so he made me feel at home with a tour and had me setup for a massage and hot tub dip. The view is incredible from up there. I see why they were named Austin’s #1 new spa.But what really strikes us each time we go and why I feel so compelled to right this, is the consistency of service and quality. The rooms are amazing, clean and have everything you could think of. We all try those new hotspots and the time or two they do great and then over time the service and quality slip. Not the case here. They never disappoint and go above and beyond to make our stay special. Not only is but our whole community is thought of from UT home games to Austin Pride. Keep an eye on the top of the building and the big tower as they often light it up and do special designs to support the community.Thanks Fairmont Austin team!!!!"
5,Thank You Rene!,"First off I must say, this hotel is stunning. Absolutely perfect design aspects every where I looked. Its centrally located, with everything you need around. But what really made the experience was the help I got on the way out from Rene Valdez, who was working the bell desk. I had some EXTREMELY heavy equipment (and a lot of us) and he was so kind and helpful in getting everything where I needed it to do. I couldn't have done that without him."
5,Room with a View,"I was able to stay in a corner room on the 26th floor and the view was spectacular. The food was great and the staff is so, so helpful and friendly. I loved the hotel. It is a great location and very easy to get around."
5,Fairmont Austin TX,"We stayed at the Fairmont Austin for a business meeting. The hotel in in the heart of Austin and just a few blocks fro UT, the West End as well as the heart of the city on Congress street. Easy walking distance to many food options and entertainment.The staff is remarkable, over the top with service and making sure that each and every guest is attended to. Everyone was friendly, always at your service and willing to go the extra mile if needed. From the check process, to the rooms attendants to the personnel in the food outlets, you were always greeted with a smile and a friendly what can I do for you today.Our room was overlooking the pool area which was very active for this time of year. The pool is a is a rooftop pool located on the 7th floor of the hotel and is everything you would want in a pool and expect at a Fairmont property. Private cabanas, in pool lounge chairs, hot tub and patio bar and grill.What more could one ask for in an urban environment.Over all the Fairmont is a great property with great people and great amenities. Can't wait to go back."
5,Amazing,"I visited this hotel on a business trip and it was beautiful! It was very busy, the bartender said they were at full capacity. When I checked in they had the longest line, I was surprised they had someone walking around handing out water and the man who checked us in even came around the desk to greet us when it was out turn. I had a great stay and really enjoyed my entire time in Austin."
5,Every detail taken care of,Went for a Convention. We were excited to stay at the Fairmont based on the reviews. It lived up to our expectations. The staff is GREAT! Loved the downtown area. Used the FedEx business center several times while there. Their staff was great also.
5,"Beautiful, clean, comfortable - SUPER FRIENDLY","As far as 4-star hotels go, this one was as pretty, clean and comfortable as I would expect. However, the people who work there are SUPER FRIENDLY and really made me feel like family. Also, the location is great! You can walk to some of the more trendy areas of Austin for shops and eats. And, it's a 5-minute walk to the bridge where you can watch the bats at sunset."
5,Phenomenal Hotel!!!,"Service was exceptional! room was clean and nice, pool was awesome! The Garrison was well thought out and super convenient. All the food we had there was up to par with the upscale experience. I would stay here again without even thinking about it. =)"
5,Fairmont - Excellent hotel in the heart of Austin,This is an amazing property to stay in Austin for business or pleasure. Great location. excellent service.. I was in Austin for a convention. Fairmont is connected to the Convention centre. There are lot of good restaurants and bars around Fairmont. The hotel is really cool and new.
5,Help Friendly Clean,"Highly recommend the Fairmont in Austin Texas. The staff are friendly and go out of their way to make you feel comfortable and relaxed. The hotel is well maintained and has every amenity anyone would need. Good people, great time!!"
