rating,title,review
5,Best Hotel in Austin,"Nice location, great restaurants, nice pool, fantastic outside bar with stunning views- what’s not to like at a reasonable price. Easy walk to Rainey street bars. Harrison restaurant is one of the best in Austin but their regular restaurant has options for all kinds of items and at decent prices."
5,VERY NICE!,"Very nice hotel. Food is good, drinks/bar area is very nice. Rooms are comfortable, large, clean. Has everything you need. GREAT Nespresso coffee maker. Great wifi. All very nice.Very nice, helpful staff everywhere you went."
5,Lovely Venue,"The Fairmont Austin went beyond meeting our expectations. Beautiful art all around. Superb, friendly service. Creative and delicious cocktails in all the bars. Bed was extremely comfortable.The Revue was pricy, but the eggs, bacon, potatoes, and grilled cherry tomatoes well above average. The charcuterie and cheese plates exceptional. The Caesar salad was too lemony for my taste. The dessert shake was yummy.Garrison's was a superb fine dining venue. The 48 oz porterhouse with garlic bordelaise sauce was juicy, tender and delicious. For the price I thought it was a bargain. The branzino was perfectly cooked. The deserts were beautiful and delicious-Ile Flottante, and textures of carrot.service was spot-on.Highly Recommended!"
5,Moving in our Freshman to UT,We loved the location as we needed somewhere close to UT Austin as we were moving in our son to his dorm. The rooms were amazing and love the color scheme. Lobby is live and kicking. It did take a long time to check in but you do get individual attention which is great. At check out the Valet lost our key but the Valet manager booked us an Uber to do our brunch location and after locating our keys came personally to drop off our truck and bags. No complains. Highly recommend Fairmont Austin to all family and friends.
2,Average place to stay,Rooms are nice but the temperature is very cold. The food is very average. (bad breakfast with dry smoked salmon) The hotel allows outside people to use the swimming pool so it was full and we couldn't use it.
4,Nice business stay,I recently stayed in this hotel for two nights for a conference in the hotel. Room was spacious for a city hotel. WiFi worked well and room was very quiet. I had no problems while staying at this hotel.
5,Great hotel at a great location.,"Honestly, the hotel can only be described as amazing.It was super clean, had a luxurious appeal, and had excellent customer service. The concierge desk and the check in desk were extremely helpful and nice for first timers like us who did not know the area at all. House keeping was very respectful of your belongings and always courteous if they arrived and you were still in the room. Also, depending on which part of the hotel your room is placed in, you will have a beautiful view of downtown or Lady Bird Lake.The location of the hotel is great because downtown is within walking distance. To add to that the hotel provides a drop off service for you to be dropped off anywhere within a mile of the hotel if you just want to walk back from and not to your destination. Our only issue was that the hotel parking can get a little expensive if you're there for a longer stay. Since everything is so close, unless you are planning on traveling far, a rental might be necessary.Ultimately, the hotel definitely made it a well worth trip and we would definitely use the Fairmont Austin again."
5,Visit to Austin.,The Fairmont in downtown Austin is a beautiful hotel conveniently located to all the the best restaurants and nightlife. Hotel staff are very helpful and accommodating. Beautiful rooms. Modern and comfortable. Would definitely stay again. Highly recommend.
5,Amazing service,"This hotel was amazing. Rene Valdez, an employee, showed just how wonderful customer service could be when I needed something early in the morning. He spared no time making sure everything was taken care of. I highly recommend him and this hotel for your stay in downtown Austin."
5,I LOVE this hotel,"The Fairmont Austin is the best place to stay in the city. Their restaurants are fantastic, their staff are friendly and accommodating, their amenities are great, the pool is amazing! They also have a really great live music program at the hotel with local Austin artists. I highly Recommend staying here"
5,Beautiful property - definitely will stay again,The Fairmont Austin is an absolutely beautiful property. I was impressed with the overall design of the hotel from the lobby to the restaurants to the coffee shop. It really had everything we needed. We were able to have a lunch meeting at Rules and Regs and I was really impressed with the healthy menu and lovely setting.
2,Beautiful Disaster,"Don't get me wrong, the hotel is absolutely beautiful! The staff, very nice as well. It was a staycation for us, celebrating our anniversary. We thought we can relax in our room, enjoy the pool, maybe get a massage, order some movies and room service and get some decent rest. Well... the pool was bombarded with bros and bachelorettes, not a place to sit in sight. Once in, I didn't even want to look at the things floating around in the water. We were lucky enough to actually be sharing walls with a bachelorette party, always a good time.... wrong.... DON'T order the eggs benedict unless you want to INSTANTLY lose 5 pounds while on the toilet. The acai bowl was watery and the worst we've had. To top it off, we couldn't even order a movie in our room because the TV guide was out of order. Not worth the $500 we spent for one night ($355 for the room and the rest in room service). You're better off ordering from IHOP across the road... at least you know what you're getting. This would never happen at the Mariott or Hilton."
5,Fairmont rocks!,"This hotel has everything you need. Great customer service, restaurants, meeting rooms, FedEx, and the cutest little coffee shop! The live music during the afternoons and evenings help to set a mood. The bar was fully stocked at all times with a wide selection."
5,"Recent Stay at the Fairmont, Austin",The chair and ottoman in the room had stains. Perhaps housekeeping should note this and clean/shampoo when required. And please don't ask for 200 characters maximum before submitting this survey.Once the point is made one should be able to submit.
5,SImply Spectacular Hotel,"Just completed a tour of the Fairmont and words can not explain the many amenities of this hotel. Floor to ceiling windows in beautifully spacious rooms. The rooftop pool and sauna with lounge chairs in the pool. The Spa offers a relaxing atmosphere the moment you walk through the door.The Fairmont offers meeting/event room space to accommodate groups of every size. Michelle O.’s personable personality and presentation of The Fairmont Hotel was OUTSTANDING! If looking for a location to host your meeting, look no further than The Fairmont!Simply Spectacular!"
5,Great stay & service,"We recently stayed at this wonderful hotel and were treated to a superb stay. The hotel is beautifully appointed, very comfortable, and in a great location. Trendy & fun Rainey's St is just out the back door.The service was equally as wonderful but William Barlow, our bellman, was especially superb. He made sure we were comfortably situated in our beautiful room and explained all the features within. Then not only did he recommended a good restaurant but he actually went to get the Fairmont van and drive us there!Also, I use a c-pap machine and it uses distilled water. Having just flown in, we did not have any liquids due to the plane and needed the distilled water. After dropping us at the restaurant, William went to the store and bought, from his own money, distilled water which we found waiting for us back in our room. Now THAT is service! And if that were not enough, William & the bell staff left us a box of chocolates in our room.So THANK YOU William Barlow for going above and beyond."
5,They are getting there,"The hotel is magnificent, but attention to detail is lacking for a property like this. The new carpets in the room are tattered on the end where it meets the wood floor. The bathroom glass shower banged whenever it was closed (something the housekeeper had to know). The bathrobe in the closet was worn through. Some employees never make eye contact which was frustrating. Overall I'd stay there again, just tighten up your game."
5,Love the Fairmont!,"We had a girl’s trip to Austin and this was the perfect location and what a gorgeous atmosphere they have created! Fairmont offers complimentary drivers in a specified area, Chase and Adam helped us get to a few special places in the city. They were charming, engaging and helps us like the friendly locals that they are. Greg in the spa was another stellar employee! We highly recommend this location!"
5,Top hotel in Austin,Beautiful spacious rooms with amazing views. The pool area is wonderful and located on the 7th floor with views of the city. The food is excellent (both poolside and at the restaurant). 5 star service provided by all of the staff especially the concierge Ekta. Highly recommend this hotel for all.
5,Fantastic hotel and located near everything,Great hotel. The lobby bar with live music is great. Room was clean and comfortable. Pool had great atmoshpere. The gym was large and well equipped. Really enjoyed the ease of access to all of downtown Austin and parking garage and access to ride share was very easy. I would definitely stay here on my next trip to Austin.
3,Fairmont austin,"Key cards broke a few times and pool top isn’t as clean as it looks in the photo, but really good service and very comfy beds. For the price, I expected a little more, but staff was super accommodating. Whatever we needed, they brought right up to our room. The restaurant attached fills up quickly, so if you’re interested in Sunday brunch, make reservations ahead of time."
4,Weekend in Austin,"Hotel is clean, well run and one of the best I stayed while in Austin. The food options are plentiful albeit a bit pricey but that is expected at a hotel of this caliber. The pool however was overly crowded / too small for this size hotel."
5,7th stay,"The hotel is the best in Austin. Comfortable rooms, great amenities. This was our 7th stay and it just keeps up the high standards every time. The valet parking is challenging when buy but otherwise the hotel was perfect."
5,Great location and close to the city center. Clean rooms and very comfortable beds,The Fairmont Austin Is a little expensive but is well worth the money. Very clean rooms and comfortable beds and pillows. Room service was excellent plus breakfast was served on time and delicious. I will definitely come back.
5,Top notch all the way!,"We’ve been spoiled. Rarely have I ever had a hotel stay go so flawlessly.We were greeted at check in with a welcoming attitude and professional demeanor. It proceeded quickly and efficiently. We were only staying in Austin a day and a half, and upon asking were offered a map with custom directions and insider tips regarding restaurants and “things to do “ . Our room was clean and spacious and offered floor to ceiling views of the river, skyline and pool (we stayed on the 22nd floor). There was a well stocked bar and fridge , but we needed space for a few “brought along “ snacks. Within minute of contacting the front desk a polite employee was rolling in a mini fridge for us !Heading down to the bar next , the bartender, after learning that I was not imbibing, mixed up a delicious non-alcoholic cocktail. Onto food. ..we happened upon the in house restaurant Garrison but were concerned that it was set to close shortly, The hostess assured us that it wold not be a problem and it wasn’t. The service and treatment by the wait staff was impeccable as was the food. Note : we are foodies and from New Orleans , we know our way around fine dining and fine it was. There was no rushed feeling or attitude even though we lingered well past closing , even changing our minds and ordering coffee and desert. The next day we discover a coffee, etc place right off of the lobby called Good Things. Coffee, pastries and prepared salads and sandwiches were available.....and very good. Next stop, the pool. ...saltwater and perfect temperature with waiters bringing drinks and snacks as we cooled off. A waiter apparently forgot my order (once ) and when I walked up to the bar to check on it a manager type person spotted me and before I could even state the problem, addressed me by name , apologized and said the order would be out shortly and comped it. I’m rather embarrassed to say that we were having so much fun at the pool that it was our last stop of the night . Later when hunger kicked in , a call to room service(minutes before the regular menu turned into the “late night menu, we were allowed to order exactly what we wanted ....scallops, shrimp cocktail, hamburger and Brussel sprouts, yummy. Seeing how late it was , a quick call to the front desk and we were “ok’d” for a late checkout (1 pm). I wish I had names ..I don’t , so I’ll just say this ..it was everyone. Great job from start to finish."
5,Wow - just wow - Fairmont Gold,"If you are going to Austin and want to stay in a hotel, the Fairmont Gold is the way to go. The hotel, in general, is well-located (we were there Thurs - Sun and walked everywhere) and very nice. The food and beverage options are many and all good. But do yourself a favor and book a room on the Gold level. Great breakfast, all-day snacks, self-service honor bar, very ample hot and cold food spread from 5 -7...makes going to a store to buy room provisions for a multi-day stay completely unnecessary. The service is great, too - attentive and friendly. We have stayed at nice hotels all over the U.S., Latin America, the Caribbean, and Europe, and this hotel may be the best for overall quality and guest experience."
5,Echols Family meets in Austin,"The Fairmont Gold experience as wonderful. The friendly, accommodating staff went out of their way to enhance our stay. First class concierge service in longe. The restaurants (Sunday brunch and poolside) were terrific. Delightful rooms and amenities. Location cannot be beat!"
5,Great Hotel/Best Staff,"The Fairmont staff provided one of the best experiences I have ever had at a hotel. They were incredibly warm and friendly and addressed any questions or concerns within moments.The hotel itself was great. Large, clean, quiet rooms within walking distance to almost anything you could want. We were in and out quite a bit, so the self-park option was also great.I have stayed in many hotels in Austin from boutiques to larger chains and would recommend the Fairmont over any of them. I’ll be back in town in a month - had I not prepaid for my upcoming stay at another hotel, I would cancel and reserve at the Fairmont.Everything was great, but the staff were the highlight."
5,Amazing service and people,I went into revue one night expecting to just grab a bite and leave but was treated with so much more. I had the pleasure of being helped by Kyle and Liz. Kyle made incredible drinks and was very attentive. Liz was so helpful and made great recommendations on food since I have dietary restrictions and couldn’t eat everything on the menu! Both of them are fantastic and next time I’m in Austin I will definitely be back.
5,"Wonderful property, staff & location","Have had the opportunity to stay on two separate occasions. First impression was backed up by a repeat performance. The property is great for work or play. Service from the staff is always friendly. Location has you close to many restaurants and entertainment options.The one area where some may find fault is the dining venue. The concept is cool but can be misunderstood. Simply put there are multiple food types and sub areas all under one roof. You can order Italian, Korean, or even fresh oysters all off the same menu regardless of what area you are seated. Service will pick up at the different kitchens and being to you. This allows your group to each get what they want without having to bounce around or fight over what to eat. Pretty nice."
5,Fairmont-for-a-Cause--Wonderful,"We attended a fundraising gala for Big Brothers Brothers Big Sisters/Central Texas, and the event was everything it needed to be:ambiance, quality, heart-strings and memories. The entire tone was beautifully set from the start by Andrea at the front desk, who, for the tiniest dollars, provided a room upgrade with a smile. Krishnae capped it off with a checkout with grace. So now I'll tell clients, ""not only is it avbona fide 5-star hotel, but I've personally stayed there and it truly is top notch."""
5,Stay in Austin Fairmont,We went for gold experience with all day extras. It’s a bit pricier but we were staying with our two kids and it was worth it. Service was fantastic and even if the food options for kids weren’t good they ordered from downstairs resteraunts. The staff were really friendly and accommodating - with good suggestions for things to do for family. Thanks to all the staff on the gold experience on 35th floor.
4,Great hotel,Fantastic hotel. Great service. Great rooms. Great location. One thing to be aware of is on the weekend this place turns into something like spring break where locals book bedrooms to make use of the pool area not really my thing. Thank god I left as they were all arriving!
5,Awesome pool!,"This hotel is pretty new in the Austin area. Service is top notch. The pool is on the 7 th floor. Great place to have cocktail and overlook the city. The gym was great, too. It had a variety of machines, kettle bells, Tex. Everything was very clean. I would definitely stay here again!"
5,Amazing,"I really like everything about this hotel, really clean hotel, friendly staffs, the food is really good, i especially enjoined the breakfast’ the room was very clean, pool is awesome, the bar, the restaurant, even the lady restroom at the lobby is amazing, great location, i will recommend it 100% to anyone, and i would definitely come again❤️"
5,Awesome hotel with awesome view,"Hotel was close to everything. It was beautiful inside and out, and bed was comfortable. Great customer service throughout whole trip. The view was amazing (we were on the 37th floor) during the day and night!"
5,Austin Fairmont,"The room was clean, the staff was friendly and professional. Room service used was timely, food choices were excellent and delicious. We had a large group for lunch on the 7th floor and my bill was incorrect. They immediately corrected it without any incident. Would stay again"
5,Amazing Stay!,The accomodations and the staff were amazing! Highly recommend staying at this Hotel! The concierge and the front desk were always amazingly helpful with the area events and venues. The hotel shuttle service was a great option to get to locations close by. A great stay overall!
5,Stunning hotel!,"Fabulous new hotel in an awesome location, beautiful room, beautiful bar, stunning pool, great food, and with a busy Keller Williams real estate convention, check in was very quick and efficient, I would totally stay there again, location was stellar!"
5,Beautiful Hote,"I made a right-hand turn from a busy, city street and upon seeing the entryway, I was instantly in a completely different world. It wasn't like the city scene melted away, it was instantly vaporized. The lobby had a beautiful ceiling framed by large trees and everyone I encountered was pleasant and helpful. I walked into my room (a corner room on the 33rd floor) and I was greeted by a panoramic view of Austin at night! It was absolutely stunning!!! The bed was amazingly comfortable and the bathroom was beautiful and pristine. The negatives were minimal, but still worth mentioning. The shower door didn't close all of the way, but it was large enough that it didn't flood the floor in use and I kept forgetting to let them know because everything else was so nice! If you choose to self-park, the garage has a near sewage-like odor that doesn't fit the hotel in the least. I'm not sure what caused it, but it was a truly awful smell. Overall it was one of the best stays I've had in a hotel and I hope to experience it again soon (minus the garage odor)!"
5,Great experience!,The staff and leadership at the Fairmont are amazing. The facility is beautiful and has a fun vibe. Everyone we interacted with was warm and friendly. We felt like we were amoung family everywhere in the hotel. The wait staff at the outlets were warm and personable. Very engaging.
5,Fairmont,I enjoyed the hotel and all the amenities. I was on business and lounged in the pool in the afternoons and it was delightful. I ate at Garrisons twice because once wasn't enough. Will definetly come back next Keller Williams Mega Camp.
5,Best Location Downtown,"Comfortable and large rooms, excellent customer service and very nice staff. The tastiest Mexican hot chocolate ever at Good Things (the hotels's sundries and gift shop). Very conveniently located adjacent to the convention center and within walking distance to some great downtown restaurants."
5,Highly Recommend,I highly recommend the Fairmont. Not only are the rooms great with the large and very comfy beds but they are very clean. This property has several restaurants to choose from and a wonderful little shop that sells the best coffee. The staff are beyond friendly and are so helpful and go out of their way to make you feel welcome.
5,absolutely amazing.,"my husband and i stayed on the 25th floor and it had a gorgeous view. the bar on the 7th floor had great wine and it’s also walking distance to rainey and downtown if you want to venture out. the staff was so helpful and kind. overall, our experience here was very enjoyable."
5,First Time at the Fairmont,"My wife and I had an excellent experience at the Fairmont! From the staff, the spa, the walkway to the Convention Center and close to Ironworks BBQ, what more do you want?Thank you for a great time in Austin!"
5,Excellent,"Excellent room, excellent amenities. I loved the large TV screen as well and the cleanliness of the room. Great location too. Right next to Rainey Street and in the center of downtown Austin. Loved the numerous bars at the hotel as well."
2,Inconsistent,"I was visiting from London with my family, I have 2 small kids, our room was not ready. Normally I don’t mind things like this but we got NO explanation, no apology and our kids were tired and restless. Deciding to be positive I did not complain. A little bit later I asked for a late checkout as one of the staff members told us Sunday’s are less busy so more than likely we can get late checkout. When I asked the night MANAGER, told me that as they had so many people to check OUT, (not check in) that it wasn’t possible. When I asked to please explain as surely if less people were checking in it would be ok. I still got a no. Then I explained I was visiting from London and he agreed for one hour? The next morning my husband asked at the front desk (he has a British accent, I don’t), they said ok! ??? I was very disappointed... hotel was average, nothing grand...."
5,Surprisingly excellent,I was not expecting such a beautiful and comfortable hotel. The service was exemplary and the restaurant and coffee shop a plus. Not much else I can say without repeating myself. I would definitely choose the Fairmont hotel again and again.
5,Bad Ass!,"Kudos to Naivi in the spa for recommending the Garrison to eat, not only was the Spa top notch and AWESOME, Jordan (Chef) and Enrique (wait staff) at the Garrison are the most awesome and nicest people I've met. The food was BAD ASSSSSSS! Jordan is a beast in the Kitchen!"
5,Great Stay at the Fairmont Hotel in Austin!,"Accommodating Staff, Beautiful Clean Hotel with all the amenities! Great restaurants, incredible pool with amazing views. It was so convenient staying at this hotel with direct access to the convention center."
3,Short Staffed,"The property is lovely and well appointed but they seemed to be short staffed across all departments. Check-in took over 45 minutes at 10PM (only 2 people working the front desk), room service was on an hour delay, poolside service was 30-40 minutes for a drink, housekeeping was still servicing rooms at 4PM, I tried calling the concierge multiple times and gave up after the line rang for 2+ minutes. Having been open a year+ it seems they still don't have a staffing model that provided the level of service expected for the quality of property and price point."
5,New Favorite Hotel in Austin,"Wow, what a great hotel!Upon check-in, I was offered a reasonably priced upgrade to the Gold floor. That was definitely worth the money. The Gold Lounge was fantastic!Cooked to order omelette in the morning, snacks over the lunch hour and light fare for the dinner hour (as well as an honor bar with hard liquor, great wine selections and beer). They also have their own check-in/check-out and concierge! The room was great as well. Nicely appointed rooms and a large walk-in shower. I opted for views of Lady Bird Lake. The views were stunning.As for the hotel grounds, everything was laid out nicely. There are two bars (one by the pool, one near the lobby), a restaurant and a coffee shop. The pool was amazing! It feels more like a Vegas or resort pool.Honestly, I can’t say anything bad about my stay! I had one noise issue but management was great about that as well.I will definitely make this Fairmont my first choice when I return to Austin."
