rating,title,review
5,INTA Leadership Meeting,"I’ve stayed at a lot of conference hotels, and i’m usually disappointed at some point during my stay. I’m pleased to say that this stay has been one of the most enjoyable conference stays I’ve ever had. Bravo to the entire Fairmont Austin staff!"
5,Cleanest hotel room I have ever stayed in.,"I recently had occasion to stay at the Austin Fairmont Hotel for a professional meeting and was very favorably impressed by the quality and cleanliness of my standard room accomodations. Having stayed in hundreds of hotels over the years, my accomodations were distinctively excellent and remarkably clean. In addition to my room, my initial registration encounter with their registration host, Carter, was warm and consisted of a highly professional welcome and introduction to the hotel."
5,Makes even a work trip a pleasure,"The Fairmont is fairly new and everything seems fresh and pleasant. The rooms are pleasant with large windows, sufficient lighting (on dimmer switches), a Nespresso machine, a full length mirror in the closet, a bathroom with lighted mirror and magnified, lit make up mirror, and glassed-in spacious shower--i.e., all the basics that are all too frequently missing in many hotels. The staff was gracious in all my interactions. The highlight for me was definitely the spa and salon. I squeezed in an excellent massage with Sky and the best pedicure I have ever had with Ni. Seriously. My toenails looked so smooth and the surrounding great after all her trimming, filing, and buffing, I thought about skipping polish--but she had proposed such a pretty color, I went ahead, and it…"
5,First time Austin visitor,"Great property, location and F&B. Could dim the lighting at the main lobby bar somewhat. The Gold Club access was more than worth while, very convenient and again very good selection of F&B throughout the entire day."
5,Fantastic stay on Gold Level,The staff at the Gold level desk were attentive and welcoming. Sebastian Trudeau in particular was great. The chef making the omelettes made excellent omelettes and the breakfast service in general was just right.
5,First Rate Experience,The Fairmont Austin did not disappoint. The staff and service was outstanding. Would absolutetly recommend this hotel to tourists and business travelers. The hotel was conviently located in the downtown area and right across the street from the Convention Center. Easy access to wonderful restaurants and bars.
5,Fairmont Excellence!,"We were very pleasantly surprised with the degree of service and attention to detail throughout the hotel. We’ve stayed at our share of conference hotels around the world, and this was by far one of our top experiences ever. The club was nothing short of exceptional. The concierge at the club was extremely knowledgeable and gave good recommendations and direction. The entire hotel is aesthetically very pleasing."
5,Fairmont Austin always delivers,"This was our third time to stay here and this property always delivers. Property is beautiful and staff truly cares about customer service. Also appreciate how much sound-proofing the rooms have, as I'm a light sleeper. Upgrading to the Gold level is also totally worth it just for the breakfast buffet alone."
5,Service at best,"The hospitality and service in this hotel were very surprising to me, i did not see it for a very long time in the states. food is really good and rooms are big and clean. location is quite good as well."
4,fine conference hotel,"very nice, but the little things need work. My in room coffee machine did not work. I even asked to have it replaced. They claimed to fix it. The machine still did not work. The elevators are often jammed. They did not anticipate the number of people that will be using them."
4,Great stay!,"Hotel grounds, room and restaurants on property were great! Attended conference here only negative was not a lot of additional seating to do quick lobby meetings. Staff was very friendly and helpful. Ate several meals at hotel from breakfast and lunch all were top quality and tasty!"
5,Great property!,"right in the center of everything. Great service. The room was impeccable. The ""little"" touches were noticed easily! (the bar had very nice unique touches, the guest room also, the housekeepers did a great job of cleaning)."
5,Elegance and Excellence,The people and the property at the Fairmont Austin are superb! The accommodations are great - rooms well appointed. The restaurant choices are many and all of the restaurants have excellent options. Conveniently located in the heart of downtown Austin so easy to get to various hot spots and just a stones throw from Rainey Street as well.
5,"Impeccable Service, excellent staff.","The Fairmont is definitely a 5 Star hotel. From the accommodations to the amenities to the excellent staff, everything was flawless. It was our 18th anniversary and everyone we encountered comped us something or brought a gift. I have to highlight a few individuals, even though they were all great. Our bellhop Collin Johnston was fantastic. He was so sweet w/ an infectious smile. He brought up a mini fridge for our beer and champagne and then he came back w/ a hand written card to congratulate us on 18 yrs, definitely above and beyond. Paul Remy at the front desk took great care of us and I didn’t get his name, but the assistant manager when we called also gave us impeccable service. We had a great staycation and really appreciate the staff."
5,A comfortable stay in Austin,"I liked the bed in my room. It was so comfortable even if the weather outside was not that great. The only thing that was not included in my room was an alarm clock and a radio; other than that, my room was alright with its BLUE motif design that suits me very well. The hotel is new from its inner and outer facade with a style that suits me well. I like the paintings on the 7th floor level and the color motif the entire hotel has chosen happens to be my favourite color, BLUE."
5,Lovely staycation!,Everything about our stay was perfect. The concierge Ryan A went out of his way to ensure we had a fabulous stay. All staff was incredible and it was quiet and cozy. Will definitely return in the future!
5,FABULOUS!!,"This was a fantastic hotel on all fronts. Service, accommodations, food, friendliness of staff all earned 5 stars. I will definitely stay here again when visiting my daughter at the University of Texas in Austin!"
5,Memorable Stay- BEAUTIFUL HOTEL AND AMMENITIES,"I don’t even know where to start... my experience from the moment I walked through the doors to check-in, from the moment I was checking out- was AMAZING My family and I did not want to leave!!! The quality and service is above and beyond from the bedding, service, Baby Bliss hair dryer, etc..The pool is so beautiful, you just feel luxury- they had a standup spray sunscreen machine 😁Although the most memorable experience was went we had dinner at the restaurant- we were greeted by Alif Hornsby. He was well versed on the menu and was able to give recommendations. We ordered off the Happy Hour menu and was able to try just about everything off the menu and it was all flavorful. Alif is the type of server that leaves an impression- Fairmont Austin is so lucky to have someone like him represent this establishment, he exudes the type of top notch service. Went so far as to give us recommendations for, Things to do in Austin! Because of him.... we will not hesitate to come back when in town and even recommend this hotel!!I was impressed with a server from the coffee shop by the name of Ashley who took time out and takes to me about my line of work and share her story as well!! I love the interaction and the extra mile she took😉.If you are a gym fanatic- the gym is everything you would ever wish for. The equipment is quality and plenty of space.I left this hotel with a smile and was quite pleased- see ya’all soon!!"
5,"Beautiful property, great staff","I stayed recently for a conference. The property is beautiful and the staff is great. Really impressed with the food as well. Proximity to the trail along the river is a bonus for a morning run. If it's in your budget, I'd recommend the Fairmont."
5,Fairmont Austin Lives and Breaths Accor Culture: SERVICE FROM THE HEART!,"I had an enjoyable experience at Fairmont Austin as follows:Check-In - Dallas was so accommodating and pleasant, fast, and efficient.Bellman - Collin was a fantastic listener, surprising for a young man that youthful (There is HOPE for his generation). He had some additional items sent up to him that I mentioned in our discussion.Bartender for Brunch - Michael Tucci: Was welcoming and able to multi-task well considering how busy it was. I was so hungry when I arrived, and the service did not disappoint me.The GEM of my trip by fare at The Fairmont Austin was none other than Mr. Mitch Cohen; this gentleman indeed was one of the most gracious professionals that I had the pleasure of meeting. I came into the Bar for brunch, and I had a hot chocolate, but by the time I was getting ready to drink, it had gotten cold. Mitch made it a point to say hello to the guests in the restaurant, and then he made his way over to me with a new cup of ""HOT"" hot chocolate. That made my day! Honestly, throughout my entire stay, I felt like I somehow regularly saw him because he was checking and making sure I was doing ok. I truly appreciate that level of service.Thank you also to Effy, Ashley, and the Good Thing Team! LOL loved that!"
5,Great Location and Beautiful,"amazing service, Love the location, Rooms very comfortable,and bed, very clean. Great coffee at the coffee shop. The Pool its great, with an amazing view. will stay again and again. Congrats to the Management!"
5,Love the vibe!,What an awesome hotel in the heart of Austin! I was there for business and notice the hotel is very busy with conventions and social celebrations. The Bar area is such a great place to relax. The Revue is a great concept to explore different kinds of cuisine. I had a great view of the pool area. Rules and Regs is also a fun place to hang out as it overlooks the city skyline.
5,FICP,"The hotel is stunning and the staff went above and beyond in every aspect of my stay. For out meeting the attention to detail, creativity, and food and beverage was over the top. This hotel is 5 star all the way"
5,Fabulous hotel!,We stayed at the Fairmont for a wedding weekend and could not have been more pleased. The hotel was immaculate. The service was great from check in to check out. Hotel bar was nice and the bartenders were very attentive. The attached “food court” was really cool and the food we had was amazing. The little coffee shop was great for a quick bite and drink in the morning. Nespresso machine in the room was a great perk. Great location with walking distance to all that downtown Austin has to offer. Live music in the lobby and complimentary cocoa and chocolates was really nice. Overall- exceptional stay! We can’t wait to go back!
5,Fairmont Gold,"By far the best hotel in Austin in regards to service and spa. I always stay in a Fairmont Gold room which not only gives you access to the lounge but allows you to check in at the Gold Lounge desk which allows you to bypass the lines downstairs. A major selling point in my opinion especially after a long trip. Check-in is always easy and I stay there so frequently that the staff there remembers me and makes it a truly personal experience. The rooms are beautiful, the beds are more comfortable, and the breakfast and canapés in the evening I think make it quite a deal."
5,Fairmont is Fairly Awesome,Spent a night at the Fairmont on business. It is new. It is nice. The service is great. The lobby bar is pretty cool. It is a short ride or a nice walk to good restaurants. Would definitely stay there again.
5,A weekend in Austin,"A weekend in Austin Texas. And what better place to be than the Fairmont a stone’s throw from Rainey St where it certainly does all happen! When you have eaten and drunk to your heart’s content, and listened to the sounds on show, the short stroll back to the comfort of the Fairmont is a great end to a fun-filled day."
5,Amazing staff,"Very impressed by the staff throughout my stay. They far exceeded my lofty expectations. The hotel is beautiful, the rooms and common areas were immaculate. Did experience some delays and congestion when using the elevators at peak times but it didn’t take away from an excellent stay."
5,Great Hotel,The staff were some of the nicest people. They really are in touch with the fairmont brand and look to make your stay exceptionally unique. The hotel is gorgeous in a great location. Would definitely stay here again
5,Great Stay,"Went with family , had a great stay. Execellent service from staff. On the down side I feel restaruant and room service prices are overpriced. Rooms are execellent, Staff is friendly and helpful.Enjoyed our stay!"
5,Always welcomed!,From the moment we drive up till we drive away we were welcomed. Met friends there for our 40th birthdays and the hotel and area did not disappoint! Spa was great. Everything was clean and smelled wonderful. Housekeeping was stellar. Breakfast was quite the experience!! Like no other I’ve ever been to! Bar tenders were friendly along with restaurant staff.
5,Lovely Hotel,"great service, friendly & veery helpful staff, beautiful rooms and lobby, great breakfast and snacks. Only complaint the beds are too high and the sinks are also high., but great shower. The location was good and concierges were ever so helpful. I would definitely suggest the hotel as a must in Austin"
5,Great hotel!,"I stayed for the weekend with my girlfriends and had the best time at the Fairmont. Excellent spa experience with massages, incredible meal at Garrison, friendly and accommodating staff, and beautiful rooms. It was so easy to get around Austin from there too. All and all a perfect stay!"
5,Beautiful Fairmont Just Off The Beaten Path!,"Flew into Austin for a Saturday UT Longhorn football game. The hotel is beautiful, staff terrific, and view from my corner room spectacular. However, the best thing about the hotel is its location! It is very convenient to take a short walk just down the street to all of the nightlife on Rainey Street. Easy walk to the live music on 6th Street and restaurants on Congress. We took a Lyft to the game and picked up a couple of Bird scooters to head back to the Fairmont. Super fun weekend and wonderful Fairmont Hotel!"
5,Great property in downtown Austin,"Recently stayed here for a conference and thought everything was top notch. Hotel staff was lovely, food was great, and the rooms were clean and comfortable. Gorgeous pool with view over downtown. Walking distance to many restaurants."
5,Great stay!!,I stayed here for a conference. Hotel was beautiful!- incredible F&B outlets- staff paid extra attention to detail- bedroom was very spacious- close to great bars- great check in and check out experience- felt very valuedShout out to Alessandro (Victor). He has the hospitality gene. Great attention to detail! He remembered my beverage and served it with personality. Also - great detail to have linen cocktial napkins. Very coolThanks Alessandro and Chris for making my evenings extra special.
5,First trip to Austin,"Traveled to Austin for my 50th Birthday. Our overall impression/stay at this Fairmont was excellent! Upon our arrival (for a reasonable fee) we were able to upgrade to a suite. The rooms were very spacious, clean and comfortable... with wonderful views of the river and city.All encounters with staff (check-in, concierges, housekeeping etc) were friendly, helpful and accommodating. My husband I both had massages which (for the price) were not the best we’ve had but still were enjoyable and relaxing. We enjoyed time at the bar and coffee shop and would definitely recommend this hotel."
5,Endodontics meeting,"I usually stay at the JW Marriott when in Austin, but my meeting was at the new Fairmont and I wanted to check it out...despite being a loyal Marriott / SPG member. I have converted to the Fairmont brand! At least Austin’s. I loved the overall feel of this hotel as well as their bar options, restaurants, and Spa (the best I’ve experienced in Austin...typically I havnt found an Austin Spa that includes steam, sauna, AND hot tub...this is me doe. The solarium over-looking the skyline and lake is a plus. Staff was friendly. It’s the first bed I actually preferred to my own. Bonus is Rainey Street is right across as well as a walkway to convention center and rest of downtown. I’ll be back with my wife/family!"
5,Director of group sales,"Very good overall. Staff was friendly. Felt welcome all the time. My favorite thing in the hotel was the f&b. The food was great. The last time night of the event, was just great. My kudos to the entire team and the executive chef"
5,Amazing!,"Beautiful property with all the perks of a luxury hotel—good restaurants, spa and excellent service. I felt very well taken care of during my stay. Highly recommend for business or pleasure. Will definitely return."
5,Beautiful option in downtown,"Recently stayed at the Fairmont for a large conference. The hotel and service could not have been any better. Staff that couldn’t do enough to make sure you were comfortable and enjoying your stay. Beautiful rooms and excellent food & beverage. One criticism is that there were no outlets on the desk to plug in laptop but other than that, couldn’t find one thing wrong. Loved it."
5,Exceptional Staff,"This newer property in Austin made me feel pampered from the moment I arrived. The staff is warm, welcoming, and care about their guests. The rooms are well appointed and upscale. And the banquet meals are far from ordinary. Thank you Fairmont for a memorable stay!"
5,Great hotel,"Went to Austin on a quick turn visit for business. The Fairmount hotel was perfect for the purpose. Clean, fast, and upscale. It was an excellent value. The bed slept well and the bathroom was large, spotless, and well thought out. I’ll be back many times."
5,"Friendly, helpful staff; spacious, well-appointed rooms; excellent amenities","Fairmont Austin is centrally located and ideal for the business traveller who values convenience, top notch service, comfortable rooms, and a terrific choice of dining and lounge areas - all at a reasonable price."
5,An excellent Fairmont experience,"If you're in Austin for business or pleasure, the Fairmont is a great hotel for your stay. I was in town for a quick business trip and my company arranged my stay for me. Having stayed at other Fairmont hotels, I was glad to see that hotel name on my itinerary! The Fairmont Austin lived up to my Fairmont expectations for service, cleanliness, and overall comfort. I enjoyed dining at one of their restaurants for breakfast, too. The location seemed convenient if you're attending an event at the Convention Center, and it was just a short walk to where I needed to be downtown. It might be a little out of the way compared to other hotels right in the heart of the city, but I enjoyed my stay and would stay there again."
5,Fabulous Place To Stay In Austin,The Fairmont is a gorgeous hotel - conveniently located - with a staff that goes out of their way to help! Highly recommend! Their restaurants are fabulous too! Don't miss the 7th floor bar - the view is amazing. And the coffee shop in the lobby has cute gifts & quick bites that are delicious.
5,Best and most bang for your buck,"Stay at Fairmont for less than $250 a night, don’t spend the $400 a night and more at four seasons and have a wonderful stay!! Great views at 30th floor and higher, beautiful restaurant and bar. Wonderful rooms and great showers. Staff are super nice and accommodating. Also connectedTo Austin convention center by walkway which was great when it was raining."
2,Poor Choice for Business Travelers,"Poor value for the money. As a business traveler, I wouldn't stay there again. Did not provide an invoice for quick check out in morning and front desk was grossly understaffed. Still trying to get an invoice - they literally did not answer the phone today, when I called, rang and rang. Fairmount reservations, when they finally answered, couldn't provide an invoice either, said to call back to hotel (that didn't answer phone!). Pretty amazing for a allegedly premium hotel. Upcharged for internet, also kind of shameless for a $340/night room. Cheap (knock off) Keurig-like machine merely crushed the pods, no coffee. Good Lord, I've had much, much better business service at modest motels! You'd think they could stick an invoice under your door, like pretty much any motel chain has figured out how to do."
5,Excellent!,"Hands down one of the best hotel experiences I've ever had. I attended a work conference at the Fairmont Austin and was impressed from the moment I arrived to the moment I checked out. Comfortable beds, impeccable cleanliness, and first-rate service! I'll definitely be back"
5,Exquisite!,"Their newest property and definitely a GREAT property! Everyone and everything from day one until the final day, everyone was absolutely perfect. Two highlights, the bartenders went out of their way to make a cocktail that was not on the menu without hesitation. Then there was Effi(sp) in the coffee/gift shop, who was just as warm & inviting on day one as on day 4!! Cannot thank them all enough."
5,Great Location and Friendly Staff,Wonderful Hotel! The Staff was great and the overall experience from start to finish was delightful. I would definitely recommend this hotel chain to everyone. I really enjoyed my time away from home as they made my stay comfortable and entertaining.
5,Fabulous Hotel ... Wish I Could Have Had Their Robe,"First time staying at this hotel. Magnificent property. Tremendous views of the city. Excellent food. Outstanding customer service. Cool decor. Comfortable beds. A very nice place to stay. Only two negatives: 1) The hallways & conference room were very cold. Part of it was the outside temperature being very frigid but they never got warm. 2) I really wanted one of the Fairmont white bath robes that were in the room. None of the shops or spa had one available. Otherwise, tremendous stay."
5,Fantastic location and service!,"I love staying at the Fairmont when I’m in Austin. It’s got a great location with lots of restaurants within walking or quick ride distance. The gym is fantastic and I have bet tried the pool myself but my friends had an awesome day so I trust their experience also. This visit, I made a small request when I checked in and Roger at reception was able to accommodate, which really added to my stay! I’ll be back in a month and am so looking forward to the serenity of my room (and a drink at the awesome bar!)"
5,"Great hotel, terrific customer service!","Great hotel, clean comfortable rooms (loved the shower), service was excellent. Location is convenient to all Austin has to offer. Short ride to the airport (always a plus). Would return next time I’m in Austin."
5,Beautiful property downtown Austin,"Beautiful property, very convenient. Check in was convenient and quick. Room spacious, well appointed and very clean. Modern furniture, great bedding. Beautiful downtown view with extra large window. The bar a little loud but otherwise very nice and lively. Did not use the restaurant. Self parking very convenient within the building (of course, Valet also available)."
5,favorite hotel in Austin,"Another great stay at the Austin Fairmont. This is a lovely hotel with friendly, well-trained staff. I will look forward to my next trip to the Austin Fairmont. This hotel is a great addition to downtown Austin."
4,Beautiful Leisure Hotel,"I visited Austin, TX on business to inspect several hotels. I stayed at the Fairmont Austin. The hotel was just a 15-minute taxi ride from the airport. Outside doormen were very helpful. The registration line was long with only 2 clerks working. The registration foyer is rather small so there was a build'up of people with luggage on top of each other waiting to check-in. The actual check-in process was smooth and the hotel is clean."
5,Here for a conference but love it,I had a very nice experience at the Fairmount Austin. I was here for a conference. The food was delicious. It was a large group but the hotel’s staff was very efficient and accommodating. AV was on point. The room was conducive for a good night’s sleep. Would highly recommend the Fairmont while in Austin
4,NOVEMBER 2019 ( My Bday Celebration),"First of all we want to acknowledge Candice from the reservations department, she outdid herself as she helped us to book the BEST rate and optimize of our Accor points.We went to Austin to celebrate my 40th Bday, and we couldn´t have chosen a better place to stay. The hotel has a GREAT location! with over a 1000 rooms, yo never feel it is crowded ( just the bars, as they should bel!).At check in Jess, give us a floor upgrade to the 37th floor, with great views of the river and Rainey street. ( thanks Jess!!!)Great room overall (3731), nice size bathroom, closet, room space.On the not so great side: the room need more drawers. We made a comment on the water pressure to a staff member in the elevator and half an our later it was fixed!On my bday we received a chocolate chip cookie platter.Andrea ant Checkout was also patient and kind.We definitely recommend The Fairmont for your next stay in Austin. Great attention to detail, as they make an effort to get you to feel at home."
