rating,title,review
5,Exceptional service from the bartender,"5 out of 5 must stop by especially for the service, I was at the Revue bar sunday meeting with a friend and the bartender working that night was amazing. His name is kyle he was very knowledgeable about different cocktails and had impeccable timing and different ways to make drinks using the type of vodka I truly enjoy. If you stay at the Fairmont you really must go to the bar for an amazing time and great drinks."
4,Family wedding in Austin,The hotel is very nice. Great location. I would like a bar or area can sit without noisy surrounding so can talk. Both bars had live music and it was too cold to go outside and sit. Maybe this was just the tie we were visiting.
5,Convention hotel,"We booked this hotel for a major convention. The Hilton is on the opposite ends of the Austin - Convention location. The walk was significantly longer compared to the Hilton however the overall experience at the Fairmont made it worthwhile. Also, Many of the top execs stayed at the Fairmont which is very important. Overall, top shelf concierge experience you expect from a Fairmont brand."
5,In town for a conference,"The room and the hotel altogether were fantastic, very thoughtful touches like an umbrella appearing in my closet for a rainy day. I would like to thank William from the bell desk for outstanding service, my friend had a medical crisis with her back and he showed up with a wheelchair and a luggage rack and was HUGELY helpful!! We were very grateful for his timely and kind assistance. Would love to come back."
5,Amazing service,"I travel a lot, especially for business; Fairmont Austin impressed me with their service. From the moment I entered the hotel everyone was welcoming and helpful. Hotel is clean, modern, the rooms have super comfy beds and bedsheets. The Concierge desk was particularly helpful with whatever the needs were during our stay. Robert was able to get us into a very hot restaurant last minute, where we had one of our best meals in a long time. Overall a great experience."
4,A very nice place in Austin!,"The hotel is conveniently situated for the convention center. The rooms are well appointed and the lobby bar personnel are most gracious, however the acoustics could be largely improved... bring ear plugs!The front desk and the doorman folks are very on top of what the guests needs are and much appreciated. Thanks all."
3,Farimont Austin,"I was staying at this hotel in connection with a conference. While the hotel was nice I did experience a very odd and off putting issue with service. First our bank of elevators were down with no management presence to re-direct guest to the service elevators. Next I was awoken by cleaning staff at midnight as a card was slipped under my door by mistake. I was then awoken two more times at 12:30 a.m. and 1:00 a.m. respectively, once with a ruler and wire hanger under my door trying to retrieve the card then again by the housekeeping manager to apologize. Lastly when I finally had to get up at 5:30 a.m. to catch my flight I turned on the shower and there was no hot water. I later found out that there was no hot water on the entire 25th floor. I did report all of this activity to the manager at check out and called the front desk both about the midnight wake up and the hot water. This was not what I would have expected at a Fairmont property - I was just appalled and will seriously reconsider staying at another property,."
5,ALTA convention,"Hotel staff were very nice and amenities were good. Did not particularly care for the food served during the convention. Did like the Revue Restaurant, but did not care for the nicer restaurant (can't remember name). Bar service was good. Overall, the hotel was very nice."
5,wonderful hotel,The location is excellent. My husband and I stayed for a weekend getaway in our own town! We spent the weekend walking around the area enjoying walking along the lake and exploring food and cocktails of local bars and restaurants. The hotel is itself is very clean and modern and then staff was excellent. Enjoyed lounging by the pool overlooking the city and watching the world series with other guests in the hotel bar in the evening. Also enjoyed the spa and the facilities there. Very relaxing and enjoyable. Great stay at the Fairmont!
5,Great Stay!,"Excellent customer service. Rooms are very clean and comfortable. Even though there was a huge convention going on there, our rooms were very well insulated and our floor was quiet. Rates are compatible with other hotels in same range. Will continue to stay here."
5,Comfortable stay in a good location!,"Walkable you’re Rainey St and downtown restaurants. Beautifully decorated hotel, well appointed fitness center, and clean updated guest rooms. Friendly and accommodating staff. We would stay here again."
5,Fulton Bar at The Fairmont,This huge open-air Bar with Gorgeous decor and very comfortable seating creates a very inviting atmosphere. They always have live music and make absolutely amazing cocktails. The service is impeccable and it is always a great place to relax and meet friends. You can always have dinner and one of the many restaurants in the hotel that are the very best that Austin has to offer. Located in the heart of downtown in the Fairmont Hotel The Fulton bar is one of my all-time favorites.
5,Di's,"The hotel was really nice - the gym was great, not crowded and very clean. - i just couldn't the ice machine - but then I didn't look very hard. We had several great meals/ the breakfast was yummy. The hotel was close to everything."
5,Beautiful hotel,"Great location within walking distance of numerous great restaurants and terrific running path along the Colorado River. Beautiful hotel with outstanding views of the city, lovely rooms, coffee shop in hotel, and great service!"
4,Modern Upscale Downtown Hotel,"The Fairmont was fantastic and we had a great stay. It is a beautiful hotel with very friendly and efficient staff. We chose it however because it was the location of a conference and also connected to the convention center for another conference. My only complaints are that I booked online requesting a fridge and it was not in the room when we arrived. This was resolved very quickly though with a call to the front desk. My second complaint is how overpriced their breakfast menu was. $21 for a 2 egg breakfast! I mean, IHOP is across the street and it’s less than $8. The atmosphere is not enough of a draw for the extra $13. I mean it’s kind of hard to screw up eggs. If you are looking for a big breakfast then their brunch is a nice option, but for all the business people looking for something quick before conferences and meetings, it would be nice if there was another option. My last complaint is that the maid somehow forgot to empty our trash 2 days in a row and once left her cleaning cloth on the desk. It was as if she was interrupted mid-cleaning or something.One other nice thing about this hotel was they do have a hotel limo/ car service which will take you within 1/2 mile of the hotel (drop off only), first come first serve availability. This was a nice feature. Overall the Fairmont is a great choice."
5,Excellent Experience,The hotel is beautiful and rooms are outstanding. The spa was the highlight! Audra in the nail salon was not only amazing but was by far one of the most professional and friendly people. She knows great customer service!! Kevin who did my massage was also outstanding. Professional and very accommodating. Would highly recommend!!
5,Beautiful Hotel,"What a gorgeous hotel! This hotel is elegant and beautifully appointed. The lobby, rooms, and restaurants are all top notch and the rooftop pool is beautiful (although it was crowded on the weekend). Be sure to check out the exercise room and take advantage of the driver who will drop you off anywhere within a mile of the hotel (we did tip him). The service was also fabulous. I highly recommend this hotel!"
3,"Beautiful property, great food, lacking on service","We moved to the Fairmont after the original hotel we had booked for the weekend lost all hot water. We booked a suite as we were celebrating our anniversary. The hotel itself is really beautiful - the public areas and the rooms. Probably one of the nicest rooms I've ever stayed in. The food was excellent - we had brunch, room service dinner and breakfast and all three were wonderful.The staff just was a little off - a few examples. The elevators stopped working for a period of time late in the afternoon, and there was a lot of confusion for much longer than there should have been. It took a good 20 minutes for them to get an employee out by the elevator banks to redirect, explain, etc. Once they got a handle on it, they routed us through the service elevators (long lines) and offered complimentary bottles of water, but it was pandemonium until that point, and a lot of people needed to get ready to go out for the evening so it was particularly poorly timed. I don't fault the hotel for the elevators breaking - but how they managed it could have used improvement.There were other odds and ends that were just sloppy - we requested extra pillows, and realized 4 hours later that those pillows had never been delivered. We ordered room service, and no steak knife arrived with the steak, and they missed a drink order.My husband finally called the manager because we were irritated and the manager was actually a bit condescending, and could have handled it better. They did give us a $100 credit, but it wasn't really about the money as much as an acknowledgement."
5,Fantastic hotel!,"The hotel was wonderful-- just flawless service and nothing was amiss. The employees were friendly and professional from when we arrived to a greeting and a door opened to checkout and storing bags. The only thing I would like is regular drip coffee set-up in the lobby for hotel guests... waiting in the coffee shop with the attached convention center was painful, especially if you just wanted regular coffee."
5,Amazing Austin,"This is a top notch hotel! Their friendly staff helped me to have the best stay I have had in months. Not only is it beautiful, comfortable and clean, it is also decently priced. I spent 6 days in Austin, 3 for business and 3 for pleasure and each time I came into this hotel, it felt like home."
5,Lovely!,"The property is beautiful and provides great location to whatever you need. We had quick access by walking, Lyft, or scooter within minutes.Enjoyed the food at the pool, Garrisons, Revue, and room service. Surprisingly enough, good options to choose from and food was good!Austin is great, you won't be disappointed."
5,Incredible Spa!,"Words cannot express how phenomenal my spa experience was at the Fairmont Austin! The moment I walked in I felt relaxed. The coordinators were very friendly and welcoming, and made sure my experience was perfect. The spa amenities are extremely impressive. The jacuzzi overlooking the skyline is a nice way to relax before and after a service. I highly recommend the fairmont signature massage. Shana Lee was absolutely incredible! She was professional, super friendly and truly delivered a masterful experience. Thank you so much Shana you’re the best!!!If you want a true luxury experience, visit the Fairmont Austin Spa!"
5,Loved the Fairmont Austin,"The Fairmont Austin is truly a luxury hotel for those who need to decompress in a beautiful environment. I loved my view of the gorgeous pool and loved, loved, loved the gym. I've never seen such a variety of machines, nice space for exercising, and the fresh fruit, water, towels and ear buds were a lovely perk."
3,Not all but some,Not all but some of the front desk staff made it seem as if they couldn’t be bothered with the guests. When I checked in the gentleman who helped was pretty rude and didn’t seem like he wanted to be at work. It could have been a better experience for my first time staying at the Fairmont.
5,ALTA,"My first trip staying at the Fairmont in Austin, and it was everything I expected of a Fairmont. The Texas charm was present at every aspect of my stay. The first night on the 32nd floor facing South with incredible views of the lake. A few nights later we’re back, and on the 27th floor. This time facing Northwest and the illuminated Texas State Capital. The Austin Fairmont is perfect!"
5,Great Experience,"The Fairmont reflects luxury comfort. Well appointed room. Room Service, perfect.Location is central to most activities to see and do in the area. . Staff is knowledgeable. The shuttle service with Adam, Chase and Duncan as drivers is so pleasant. That service is great to get you to a little farther away than a walk. Overall, our stay has been absolutely fabulous. Thank you."
5,"Very warm hospitality, great stay","Great service at the Fairmont Austin. Julie at reception deserves a special mention for friendly and efficient service.My room was very clean, quiet and comfortable. A great stay overall. Would definitely recommend it"
5,Customer service you deserve,"Whether it is for business or pleasure, this new hotel is the place to stay. Centrally located with knowledgeable staff. From when they open the door for you to the time you retire you’re surrounded by friendly and accommodating staff everywhere in the hotel."
5,Fabulous,"A beautiful, well maintained hotel, with a very acommodating staff. The restaurant has an unusual men and the food was exceptional. The lobby bar also had good drinks and good service. I would recomend a stay at this property ."
4,Beautiful New Hotel,"The Fairmont is a spacious, bright and airy addition to Downtown Austin.All of the employees are friendly and welcoming, the decor is well done and vibrant, the rooms are comfortable with huge windows and good amenities.What's a little strange is that some of the brightly painted walls and doors are already showing signs of wear and tear where they've been hit by luggage carts.The main bar is open plan and again feels spacious although when there's a convention it is jam packed. There's an enclosed walkway to the convention center.There is a food hall-type dining area that provides for a wide variety of food and drinks.If you feel the need to venture out, Rainey St. is just across Cesar Chavez!"
5,Fairmont October 2019,"The hotel clean and the staff was friendly. The downtown location was very convenient to the convention center that i went to each day on my business trip. I would recommend putting a fridge in each room,"
5,Wonderful stay,"Fairmont knows how to do it right and make it an experience to remember. From the rooms, to the amenities, to the pool area to the numerous areas to talk or relax. And the staff are awesome. Every single interaction from check in, to concierge to bell hop to wait staff to security (lost our phone) was exemplary. Well done fairmont."
5,An EXCELLENT Rooftop Pool,"We booked a stay-cation at the Fairmont in Austin, and loved our night here. One of our favorite parts was the rooftop pool. Excellent drinks and a great view of Austin. In the evening, we enjoyed the hot tub on the roof. Very relaxing. One of our favorite parts of the day was the buffet breakfast in the restaurant. This was possibly one of the best buffets I've ever had. They had everything--including a make-your-own crepe stand! Top notch hotel!"
5,Great stay!,"Love this hotel! Quick and efficient service with a smile! From the moment we walked to the front desk to check in, till the day we checked out, the service was exceptional. Will definitely come back next time we are in Austin."
5,Beautiful hotel,"Location was perfect for Convention Center. Good food, bar & music. All amenities. Nice workout/ spa area. My only complaint would be that the mini fridge was so full there is no room for personal items."
5,One of the best cities Austin,"From the moment we arrived till check out i would give the hotel 5 stars. The first night we arrived around 7;30 pm and walked over to Rainey Street we were surprised how close it was to the hotel a 5 minute walk. The buffet the next morning was fantastic . The pool at the hotel after our U of Texas tour was thriving and had great energy. The spa and steam were top notch. The next evening we ventured to Dirty 6th street and it was such a nice night out we walked home to the hotel my sons used the bird/ lime scooters and ventured out on there own. All in all great location , lots of action at the hotel , great service and concierge would highly recommend this hotel"
5,Total Wow!,The Fairmont Austin is one of the nicest hotels I have stayed in! Just a huge wow from the minute you enter the hotel. The restaurants/bars are all very nicely done and the food is wonderful. The Spa and fitness facilities are first rate. Meeting space well appointed. Wonderful outdoor space at the pool and 7th floor bar. Highly recommend!
5,Business Stay Convention,Staff was very polite and helpful. Very prompt on any request I had for room or services I needed.Great location and great bathroom!!! Room Cleaning crew were awesome!!!I would definitely recommend this hotel for anyone that ask me where the should stay when visiting downtown Austin!
5,Great Weekend,Attended a business function at the Fairmont Austin and stayed for the weekend to attend the Austin City Limits Music Festival. This hotel is wonderful and very relaxing. We enjoyed the on-site spa as well and were very much impressed with the facilities. Only complaint is that as a result of a large amount of music festival clientele there was an instance where somebody vomited by the elevator on our floor and it wasn't cleaned up for about 12 hours. Thankfully somebody at least covered with napkins until housekeeping could attend to it.
5,Amazing customer service and food,"I did not stay in a room but met up with a friend staying there for our conference. The staff there were very friendly and helpful, the lobby and public areas are beautiful, and the food was wonderful. Our server Miescha was super friendly, helpful and patient, managing our food preferences and sensitivities with kindness and respect. Would definitely recommended and want to give a HUGE thanks to Miescha!"
3,Expected much more,"When I booked this hotel, based on previous reviews, I was expecting everything to be excellent. Some things were, somethings were not. We only stayed for one night and were planning to enjoy it as much as we could. Check-in: Very slow. We had to wait because one desk was busy and two other employees were taking to each other. Spa: the spa is amazing, this is one of the strongest points. We did not have any service done but just paid for the day pass and relaxed a couple of hours. The spa staff was super nice. Room service: we ordered some very basic things and they were mostly a fail. I ordered ceasar salad with chicken and the chicken was undercooked. The guacamole was meh. Wings were OK. The prices were too high for what it was. Checkout: NIGHTMARE. I tried calling before I left to make sure the accounted for what we took from the mini bar. (We had selected express checkout the nigh before so supposedly they just email you the bill) NO ONE ANSWERED. We had to leave and of course I receive the email with the bill and it is ALL WRONG (I am calling later today to verify). They added charges of things we did not even tough. Anyway, that can be fixed I guess, I will call today. PARKING: $36 / night as a guest. WOW. like the price of the room is not enough to guarantee safe, free parking? Pretty disappointed with the experience overall, it could have been super pleasant but the CONS mentioned in this review had me worrying during and after the stay instead of just enjoying it."
4,"Comfortable and new, great pool","We stayed at the fairmont for a weekend getaway. Rooms are very comfortable and clean. The pool is great, only complaint is that it was very busy the weekend we stayed and there weren't enough chairs at the pool and service was slow. Overall I would recommend this hotel."
5,ALTA One,"Mixed visit, vacation with conference for spouse's work. Amazing hotel with good rates, fine dining and great bars for adult beverages. Entertainment in the 6th Street District is walking distance, about four blocks and Rainey Street to the South is three blocks.The Revue Bar at the Fairmont features upscale drinks and entertaining mixologists, like Kyle, below on the left. Live entertainment in the main bar nightly is smooth and welcome background."
5,Wonderful stay excellent service by staff during breakfast,"The staff was absolutely amazing. Our room was clean and spacious.The only thing that could have been improved was the bf Buffett’s food could have been hotter. Very nice selection of food but some ie eggs, oatmeal and meats were luck warm."
4,Friendly staff,"Clean, spacious rooms with natural light. The staff were super courteous and friendly. Only issue was that the door in between the adjoining room I was staying at was not adequately sound-proofed. My neighbor was watching tv or had it turned on very late at night and early in the morning. The management should try to solve this problem realizing that once in a while they will have people who would not consider others around them and would watch with full volume."
5,Can't wait to return!,"Lovely hotel; spacious, beautiful, great staff. For people like us (in their 50's plus), I would highly recommend spending you at this Fairmont - as the location is central to action - but not in the middle of crazy. We were on the 15th floor and and could hear a little noise from Rainey Street fun - only a bit on Saturday night. We stayed 4 nights and I look forward to a return visit - a wonderful place to visit Austin and the Fairmont helped make that happen."
5,Ourtrageously Cool Austin Experience,"Honestly, it's rare that I'll take time to write a review for a hotel. But, The Fairmont Hotel in Austin gave me the greatest Austin experience, that I have no choice BUT to write one! The hotel itself is situated in a perfect spot in the city. Right next to the river and steps from all the action of Congress Avenue. The vibe is totally cool and fun, also. Great mix of hipsters, jocks, and business types. Lots of eye-candy. Pool and restaurants were a blast. BUT, the real kicker was the Southern hospitality from the employees....especially one concierge who deserves calling out. Robert was not only personable, very knowledgeable and helpful...but incredibly friendly and professional, as well. Gave us great tips for lots to do in this fun town. He is PERFECT as a concierge and would definitely be someone I'd call for a beer any day of the week. Thank you Robert M!!! I'll definitely be back and will now plan to stay at other Fairmont properties because of this great experience. Much appreciated."
5,Perfect!,Carlos was amazing! He made sure to double check with the chefs about a food allergy and had the best recommendations and speed of service! Thank you for making this experience so special at the Fairmont!
5,Revue,Carlos provided the best service and food recommendations at this restaurant. The drinks were fenomenal on their own and the food was high quality with great flavor. The atmosphere was fun and innovative. Highly recommend.
5,Great wedding block experience,"We had our wedding in Austin and reserved a block at the Fairmont. It was the perfect place -- very central, brand new hotel, great service, and the pool is amazing. It was easy to set up the block, and the events staff went out of their way to help us. We recommend it!"
5,Went for a conference ....stayed for the Spa,"Went with my husband to his conference, since I was solo lost of the day i was able to check out the services the hotel had to offer. Got a facial and mani/pedi at the Spa. They were wonderful but very expensive. Cost was pretty similar to other swanky hotel spas. Staff was very nice and helpful. Rooms were spacious and beds were very comfortable. Would def stay here again. Valet was very efficient and courteous."
5,New Clean Stylish Property with Attentive Service,"This hotel is conveniently located in the heart of downtown Austin near Rainier Street and within walking distance to 6th Street. Upon arrival I was greeted by a friendly smiling agent at the front desk for check-in who was thorough in outlining the hotel amenities. He noticed I was carrying a pack of beverages and promptly arranged to have a separate mini-fridge delivered to my room. I received a text upon checking into my room to see how everything was, and was once again asked for feedback when I initially logged on to the Internet. There I commented that it would be nice to have a couple of small bottles of water for the in-room Nespresso machine, which was delivered with a thank you card to my room the next day. The room was spacious, stylish, and nicely appointed. I was sent an Express Checkout email link which expired before my checkout, as the line was quite long at departure I just called the hotel to email me a copy of the folio after.My company also held a meeting at the property so in terms of the Conference Facilities the Wi-Fi Internet service was spotty, they were too quick to remove the coffee in between our all-day sessions and the snacks always run out. While the catering was good in general they seem to enjoy serving what appears to be leftovers from dinner the night before for lunch the next day.Overall I really enjoyed my stay and would definitely recommend this property for those travelling to Austin!"
