rating,title,review
4,JW Marriott Austin Review of Stay for Bb World 2019,"Overall, my stay at the JW was very pleasant. The staff was efficient, courteous, professional, and friendly. My interaction was limited as I spent most of my time at the conference. However, the interactions I did have with staff was positive. I really appreciated that.The location was good in relation to the conference center. The weather was great and that helped a lot as I was walking back and forth. There were also plenty of places within walking distance to visit.My room was on the 24th floor and had a nice view of the river. That was lovely. The room was nice, clean. I did have two minor issues...the plug in the bathroom kept tripping. At first I was able to reset the outlet, but towards the end of the week, it would not stay set. I have no idea why it kept tripping. I did not have more than one item plugged in at a time. I had to use a plug in the room itself on the last morning to dry my hair as I could not get the outlet to work.The other minor issue was that the toilet seemed to ""run"" every 5 or 7 minutes. It was like the tank was maybe losing some water and it had to refill it a bit. Not sure if that is what it was supposed to do or not. It was not a problem, just something that I noticed."
4,BbWorld 2019,"Very clean, nice hotel. I just had a few issues/comments:I didn't like that I was unable to watch Netflix on the television.The TV remote would not turn the TV on and off. It would only work to adjust volume, change channels, etc. I even stood right in front of the TV to try and troubleshoot and nothing would work.On the last morning of my stay, I could not get the shower to turn on. The lever would not budge. I normally would have called to have someone fix it but I was short on time so I didn't."
5,a relaxing mid week away,"From check in to check out the staff at this property was top notch. I only wish that there were better beer options for the pool deck, or be allowed to bring other beers from different establishments on property. Tried all the restaurants, great food and thank you Chef for plating the beef carpacio on a regular plate not the togo cardboard. You should be very pleased with your entire team. We had a great experience, and will be back."
5,A great place to stay,"This is one of the best property to stay. I am a Marriott Titanium member, and I use many different properties around the world. This hotel offers comfort from the service to room amenities to location. I will return next time when I visit Austin."
5,Austin in Summer,"Great hotel with exceptional service and attention from the hotel staff. Perfectly prepared room; clean, well-lighted, good desk to work from. Food in the hotel restaurants was excellent and not expensive considering it's Austin. They even made me a pizza in the afternoon which was NOT on the menu! Loved the place."
5,The Best Marriott Experience,The absolute best Marriott experience I have ever had! The level of professionalism from EVERY employee was amazing. If I am ever in the area again I look forward to staying here! The gym is the absolute best too!
5,Austin,"Wonderful Hotel- great service, great food, wonderful staff and stylish rooms and property. As a business travel this is a place you will appreciate. Feels like home away from home. The club is top notch."
4,"Comfortable, attentive, benefits","Stayed 5 nights for Meetings at the convention center. The management & staff were very friendly and attentive. The lounge for Marriott Rewards members is wonderful. Nice breakfast selection, evening appetizers and beverage snack during the day. The staff did a good job with our room, however if you want to make sure your room is cleaned between certain hours, it's good to schedule this. Marriott offers this service, I would most definitely stay here again."
3,Not so impressed,The facility was nice but I found the overall experience a bit pretentious. The staff was helpful. The room was clean and spacious. The bed was not the most comfortable. I don't know what else to say but I need to have 200 characters.
5,Most wonderful service ever,"In my 30 plus years of trveling I have to say this was the best. I was greeted at the front door by Desk manager, Joshua, I had a meeting that lasted 4 days. I spoke with the general manager, Mr. Blalook and thanked him for hiring a superb staff to care for me as guest. I also would be remiss if I didn't point out the excellent cleaning room attendant, Erika. Her kindness and detail to my room needs was extremly appreciated. My overall advice to those who visit Austin, is to stay at this the Marriot JW and experience the stellar service. A special thanks to Josh and Erika!!"
5,Wonderful Experience,"Staff were very courteous and eager to help with anything. They were very attentive and engaged. Housekeeping staff were courteous and provided any needed amenities, with a smile. The staff that worked the conference area was great also."
5,"Beautiful hotel, comfy bed","I stayed at the JW Marriott while attending a conference there in Austin. The staff was always helpful and I was impressed with both the guest rooms and conference side of the hotel. The best part, though was the comfy bed after a long day of lectures and networking."
5,Really enjoyed this hotel,Very well run hotel. Stayed for 5 days during a recent conference. Rooms were nicely laid out and quiet. Exercise room was very nice -- really encouraging use of facilities. Conference rooms worked out well for the conference. Most staff were very helpful.Very happy with the hotel.
5,Feels like home,The JW Austin is top notch and so comfortable. The staff are friendly and accommodating in every department. Thanks again for a great home away from home! I always look forward to my twice yearly stays at the JW Austin!
4,Thank you for correcting the parking fees!,"We came to town for a convention and when I found out that I would have to pay to park I was not happy. I called and Jenna the manager helped me with a solution, I was not upset about the parking only that I did not know of the cost prior to booking the reservation. Since it was a conference I assumed that there was plenty of parking for free. So Jenna offered a $40 comp in food to cover one of the day stays which was reasonable.When we arrived the self parking was closed and I confirmed on the phone and in person that valet was my only option for the weekend and was assured that I would get charged that self parking day rate. When I checked out that was not the case and I was charged the full valet rate. I talked to Mateo at the front desk and he waived the charges completely, which I was grateful for.My only suggestion is to work out a paid rate that is included in the room rate for the convention folks regardless of any parking contract or not.Chris Walker512 923 5112"
5,Weekend Getaway,"We had some shopping to do in Austin and decided to just stay over Saturday and Sunday to take in the city. This hotel is in the heart of downtown Austin with great shopping and restaurants all within walking distance. We enjoyed a nice dinner at OP with great service and the food was excellent. Hotel accommodations were outstanding, and the room was very clean. We had a nice view of the lake which added to the romantic weekend we enjoyed at the JW Marriott Austin."
5,"Excellent overall, just a minor issue with communication","The hotel is beautiful, in a great location & well run. When I checked in, I asked if I could have a checkout time later than 11am since my flight wasn't until 5:45pm. They said they could give me until noon. But the morning of my departure when I called the front desk to confirm my noon checkout -- I was told it was not possible. Just wish someone from the hotel would have initiated a call to me to let me know."
5,"Beautiful hotel, wonderful staff.","I was at this hotel for a work conference and can not say enough about how awesome it was. Clean, well appointed and comfortable. Great downtown location. Loved The Corner outdoor bar - food was great enjoyed the casual outdoor seating. Julie at the concierge was especially helpful."
4,Sunday Dinner,"We had dinner at JW Marriott, and it was delicious. We were able to get a seat quickly, and our food and drinks were delivered quickly too. Our server was Emma T, and she was delightful!!! Would definitely go again."
2,Two strikes,"Their on property store is such a rip off it floored me when I received my bill. For instance, Haribo gummies were $6. You have to be kidding me. The TV in our room was so dim, I could barely see it with the black out shades drawn. They sent a person up to assess who then told me they needed to send another person with a remote up. Just bring the remote. This cannot be a unique issue with me."
5,Awesome Family Friendly Hotel,"We attended a conference of the International Obsessive Compulsive Disorder Foundation. A family friendly reunion that brings together researchers, clinicians & OCD sufferers. This hotel was the perfect location with family friendly features like the outdoor pool, restaurants that satisfied everyone's palate & were reasonably priced and quick to get in and out of. We've attended 4 of these conferences and this was by far the best venue."
5,Summer stay in Austin,"Our four day stay in Austin was phenomenal! Loved the friendliness and helpfulness of the staff. We were able to check-in before noon. All of our needs were met. The convention space was spectacular. The food was very, very good, though some selections were on the pricey side. We would definitely stay there again. We felt safe and extremely well taken care of!"
5,Great Experience,"Rooms are comfortable and well appointed. Staff is extremely friendly and professional. Overall a great experience and a great place to stay. Central to the Austin Convention Center, as well as dining, shopping and nightlife."
5,Great Stay,"I was at your hotel for a conference but it felt like a holiday. My room was spacious and modern with every amenity possible. I asked for ice without calling and then told the room maid that I would call as I recalled it said on card to do so-I came back to find ice in my bucket which meant the maid went above and beyond her duties to make me feel comfortable. I enjoyed each of the restaurants and found the employees to be welcoming and making sure my every need was met.However, not centrally located towards a shopping district though plenty of restaurants abounded."
5,Great time at JW Marriott,"We had an excellent stay. My wife and I often find the cost is not commiserate with the service. For the service we got, it felt like the cost was a bargain. The wait staff at the pool, especially Teresa were wonderful!"
5,A Great Venue for a Conference,"The room was roomy; the bed was very comfortable; the walk-in shower was fantastic; and the food in the restaurant, Corner Star, was amazing! (I’d like to get the recipe for the chicken chili.) The only drawback: room service was a bit pricey."
4,Business Stay,I was greeted by the front desk very friendly and professionally. I was quickly checked in to my 24th floor room. The bathroom was beautiful and the bed very comfy. Everything was very clean. I didn't get a chance to eat or drink in the hotel but it looked very good.
5,Excellent Place to Stay,"I came to town for a conference located in the hotel and was very impressed with the hotel and the excellent service of the staff. They were quick to attend to any needs - really a step ahead of needs and were very friendly. The room was clean, nice views, well laid out. The hotel is in walking distance to many eating options. Highly recommend."
3,JW Marriott Austin review,No mini fridge or microwave. Issues with bathroom sink extremely slow drain and shower door or closing properly leading to water all over the floor after a shower Location was excellent. Cost was on the high side for quality of room
5,Better Inside Than Out,"This is a very nice and clean hotel. It is convenient to lots of things in Austin. When you venture outside the hotel, be prepared to be accosted by somewhat aggressive panhandlers. But inside the hotel has just about everything you need."
2,Bad Executive Lounge Breakfast,"While this location is great, the breakfast in the Executive Lounge was terrible. Powdered eggs and cold sausage at at JW? Come on, you can do better. At the regular Marriott in Metairie, LA they have real eggs. Why not at this supposedly high end hotel."
3,Nice Hotel With Many Mishaps,"It started at check-in. I requested a king and was taken to a room with two queen beds. They moved me to a nice room. I was given a voucher for my trouble. That evening I ordered nachos by room service. I waited over an hour and fell asleep. I woke up two hours later and called to inquire. They forgot my order. I was given another voucher to use in one of the restaurants. I used one of the vouchers to order nachos again for room service. They came within 90 minutes. I gave the young lady the $20 voucher plus a $5 dollar bill. The next morning I go to restaurant for breakfast to use my second voucher. My order is wrong. They take it back. The second one comes out wrong again. I give them the voucher and leave. I go to check out and the room service is on my bill. The young lady at the desk had to call two people to get it cleared up.Seems to me, if your service were better, you wouldn't have to give out so many vouchers."
5,Great location and staff,I really enjoyed the staff and location durning my short stay. I was able to walk to the convention center and state capital. The staff was very helpful with recommendations. The hotel was modern and impressed those that were with me.
5,Excellent Downtown Hotel,The JW Marriott Austin is a modern luxury property in the heart of downtown. Excellent service and 1st class restaurants and rooms made our stay memorable. Highly recommended for business travelers and families.
5,Favorite Austin Hotel,"Accompanied my husband. He had business, I visited family. Have stayed there several times and enjoy the friendly staff, clean, stylish rooms, comfortable lobby, and especially enjoy the executive lounge."
4,Good for an extremely large hotel,"Great staff. Nice pool but small. Good restaurants. Bed was comfortable. Staff responsive to requests. Not sure it's worth the money.... it was VERY expensive. For the same money I could have stayed at the W, and next time I will"
5,Terrific place to stay in downtown Austin,"My wife and I were in Austin for a convention and stayed at this hotel. It was an outstanding experience. From the moment we checked in to when we got in our cab for the airport to go home, the staff did everything they could to make use feel special and welcome. The only negative we had was that the convention center is a few blocks away. This was only an issue in the afternoon as walking in the July heat was a bit tough...but when we arrived back at the hotel the space was cool and the beer at the bar was ice cold. We will stay at this hotel anytime we are back in Austin."
3,Quick Trip to Austin,"We decided to take a couple of day trip to Austin having not been there in quite some time. We decided to use Marriott Reward points. The JW Marriott was well located (near Congress and near the Congress St Bridge--bat zone). Room was nice--one chair, no couch. TV was a nice size. Difficult to hook up my Roku, but the tech came and helped. Room was really dark with lights off. The concierge room was less than expected--food choices weak for night and morning, cold temp, and no coke products. Valet parking was high--$50 a day. So with a 'comp-d' room our bill was still over a $100."
4,Lively Bar,"Lovely bar scene in the lobby. Friendly greeting upon checkin. The executive lounge was just ok, they serviced fried food and hunks of cheese which this Californian isn’t in to. Gym is well equipped. The rooms are good and as expected for a JW Marriott."
5,Always enjoy my stay at this wonderful hotel,Perfect location with walking distance from restaurants and music. The hotel ambiance is very inviting. The staff service from check-in to every interface is awesome. Enjoy a drink in lobby bar! the service in lobby bar is very friendly.You will truly enjoy the experience here!
5,Best hotel stay,"Going to a convention can be challenging as far as location, food,service, etc. Not at this hotel! Even the Starbucks was great! Hotel employees polite,accommodating and excellent. Banquet food was pretty good too."
5,Austin Marriott,Very nice facility. Conference area and rooms were ideal for my group's function. Staff was very focused on customer service even after check out. Location in downtown Austin is ideal for events in the area.
5,Terrific Time In Austin,"This hotel provides an all around experience of excellence. Can’t imagine a more perfect vacation stay. Walking distance to most of the popular sights, and only a short cab ride to the rest! Kudos to Jon, who greeted us as we entered the hotel, walked us to the desk, and checked us in. Jon helped familiarize us with the area, suggested music venues, restaurants, and was genuinely interested in our satisfaction. Marriott is fortunate to have such a fine goodwill ambassador."
5,Great hotel in a perfect Downtown Location!,"Spent two excellent nights at this JW located right in the heart of Austin! Staff across the board was phenomenal and helpful! You will walking distance to all Austin has to offer but you really don’t need to leave the property if it’s too hot out for ya! Nice pool area with a great staff or bartenders and servers to help keep ya cool! Multiple restaurants on main level both a high quality food at the gastropub(ish) Corner restaurant or hit up the delicious Italian offerings at the OP restaurant! One of the nicest Executive Lounges with some of the best offerings I have seen in a long time.. not your traditional fried options for appetizers and well stocked refreshments. Very nice sized fitness center and what appears to be a popular spa! Highly recommend, well done JW Marriott Austin!"
5,"Great accommodations, excellent service, very nice facilities.","The hotel service was excellent, very clean and modern, great location, and the amenities were very nice (pool, fitness, outdoor patio, etc.). Hotel staff was incredibly responsive and kind. My only (and very small) issues were that the keycard had trouble working in the elevator sensors (hotel door worked fine) and no fridge in room (dietary restrictions make that useful)."
5,"Outstanding service, vibe and decor!","First I was greeted by the front desk staff with a smile and escorted to the desk for checkin! Wow! I enjoyed the look and feel of the decor - not too modern just enough! My front desk receptionist also walked me with my bag to the elevator. Wow! Getting to the elevator can be confusing so that was very helpful. Finally I was thrilled by the sound of good music and lots people gathered in the open bar area! Not a big drinker but it was nice to see people enjoying the company of their friends or colleagues in the hotel! Staff were very helpful, responsive and respectful!"
5,Enjoying 4 days in Austin,"Everyone who works at the JW was friendly and helpful. Jon checked us in and became a friend to us. He helped us with reservations, and gave us great advice about music venues. He really made our vacation special! Our room was clean and quiet. The restaurants in the hotel were great, good food and drinks. Special thanks to Jon, we see a great future for you at the JW, you deserve it."
4,Nice conference location,"Good location in downtown Austin. Walkable to most key locations in the entertainment district, however, Austin has a large homeless challenge that must be addressed to sustain itself as a destination location."
5,Enjoyed my stay,In town for a work conference that was located in the JW Marriott. It was very convenient and honestly i never left the hotel until i departed. We were served catered breakfast lunch and dinner by JW Marriott and everything was delicious. All the staff i encountered were very helpful. Hotel and rooms were very nice and room was very comfortable.
5,Please move the conference chairs apart a few inches!!!,"From front desk service, food, housekeeping to internet connection...everything was great. The only suggestion that I will make is PLEASE space the chairs a few inches apart in the conference area. I am not a large person and felt totally squished in those seats. Many people opted to sit on the floor rather than squeeze between two other people in a seat. Some people even sat on two seats together. It was totally claustrophobic. I have never experienced that at a conference location before."
5,It was great!,"I highly recommend this property! It is everything we expected and more. The entire staff went out of their way to make us feel welcome and we will surely choose this hotel when we return to Austin! The restaurants on site were great too. Again, the wait staff was friendly and the food was delicious. Try the ""three dips and chips"" starter....."
4,Nice stay with one minor annoyance,"Beautiful hotel and rooms. Staff was super friendly and helpful. And the location was prime; within walking distance of everywhere we wanted to see and the convention hall.Only reason we give 4 stars is because you can hear the rooftop club music late into the night. Just hard to relax in your room after a long night when you hear drunk people singing along to music outside your room. We get it, they were enjoying themselves too. But we were jet lagged and hot and just wanted to rest before the next days activities.Aside from that, it was a perfectly delightful trip! Would stay again but would ask ti be as far away from the club as possible. 😄😁"
4,Conference Stay in Austin,"Pros: Great location, easily accessible to all that Austin has to offer. Very friendly staff, especially the bell hops! Plenty of restaurant options for business trips that have short lunch breaks.Cons: I was assigned a handicap accessible room and the shower was a mess every time I used it. The floor did not drain properly, causing water and suds to end up every where. The hotel's website says overnight self-parking is $30, however I was charged $39 and they did not honor the discrepancy, but gave me a conference rate instead. The room cards allow access to the floors from the elevator, but didn't consistently work, so I always hoped someone else with a working card was on the elevator. The parking garage smelled like trash and pot, which made the cost and walk rather unpleasant."
5,3 Nights in Austin,"We were in town to assist our son in his move to another city. The JW NEVER disappoints. From Valet to check out was perfect. The hotel was quiet at night and very comfortable. Housekeeping was excellent and took care of all our needs. When we arrived we were greeted, and walked to the elevator. The hotel is immaculate. This is the place to stay while in Austin."
2,Took 20 hours and 5 phone calls to get someone to unclog the toilet.,"The hotel was nice. The staff was friendly, but for some reason when I called to get the toilet unclogged, they kept saying ""I was in the system and someone was coming"". No one came.I called again, same response.I called the next morning (12 hours later). Same. I let them know it had been 12 hours. I went to my conference, and came back. Still clogged.The room was clean, but toilet was clogged. I called again, and let them know it had almost been 24 hours, which is crazy. Someone came 30 minutes later. So for 20 hours I had no toilet in my room. That's horrible service."
5,Elegant hotel,"The hotel location is perfect few minutes walk from several attractions and restaurants.Front desk staff are very professional and pleasant. They managed the overwhelming clients attending the PAA and checking in a very short time.The room was missing a fridge but when I asked, it was delivered to my room in a timely manner.The restaurant where breakfast is served is very elegant and staff are very friendly."
5,David is awesome!,"This Austin hotel has never let us down. It was, once again, an amazing stay. I was honored to meet David and talk to him every day. He made himself available to every guest and took care of us as if we were family. Amazing customer service!!"
4,Great visit for RTX 2019,"Larger Fridge would be beneficial vs small ""college mini fridge"" - cheaper parking garage rate with room booking would be great as well where as I already pay 200 a night. Outside that, service was great from all the staff."
5,As Always...Simply Amazing,"Centrally located, the JW Marriott is the perfect hub for exploring downtown Austin. Just a simple stroll in any direction will give you an amazing amount of sites, activities, restaurants and interesting people watching. My wife and I love to stay here and walk around Lady Bird Lake, then spend the rest of the day trying new eateries and bars. The Marriott always provide an amazing place to stay with many great options available without having to even leave the property."
5,Stephanie,"JW Marriott Austin was amazing after we met Josh Brown who made us feel so welcomed after having a terrible time in the city .You found the kindest , most genuine man to represent your brand when you hired Josh . His smile can light the entire room . Every time we walked by he was smiling and welcoming each and every guest . We were sad when we had to fly back home .We will return to Austin just to visit the JW Marriott again and be welcomed so kindly . Josh is 5 star plus plus .I don’t usually write reviews but He deserves acknowledgment and to be recognized because people like him are so few and far between . Great job Marriott finding an amazing role model ."
