rating,title,review
5,Best hotel in Austin,"Very quiet hotel in the center of downtown with amazing staff who are courteous and will do anything to make your stay better. Views from rooms are great and the rooms are clean, spacious and have all the touches you would want."
5,CJ's Marriott Review,"This is a wonderful property with great improvements in both structure and service since I was here about 4 years ago. Special Kudos to the friendly staff especially Jon from concierge for his great customer service, his friendly demeanor and positive attitude and also Oscar and his team for being so accommodating. The food was also better from what I remembered. So good job over all."
5,"Comfortable, with high end feel","Nothing bad to say. Service was exceptional. Room was modern but comfortable, and in great shape.Many options for after work cocktails in the lobby.Checkout Cooper's BBQ around the corner. Delicious"
5,Amazing Staff - Excellent Customer Service,I travel frequently and the level of customer service at this hotel was the best I have ever experienced. The Staff welcome every guest as they step into the hotel from rushing to help them with their luggage or shopping packages as they enter the lobby or walking them to the correct elevator after checking in. I've really never seen anything quite like it.
4,First visit,Overall great experience and enjoyable. Restaurants were convenient and table with electrical outlets for laptops and phone charging a plus.Check in and out was very good for staff took time to assist when requesting additional information. They were outstanding
5,My Stay at the Austn JW,Always available to answer questions and to address your needs (ice delivery). Very friendly and helpful staff. The total experience was great from check in to check out. The only negative that I have is that I have is that I was given directions that took me through the Corner restaurant (door) and was given a very unfriendly look from the girl at the hostest desk.
5,Excellent establishment. We loved our room.,"We loved our stay, specially because the hotel is walking distance to most places to visit. We loved it. Loved the pool and bar near the pool. Great area to just relax. Also, great to have a Starbucks in the hotel."
4,Nice Hotel but I Expected a Little More,"This is a hard review to write. The hotel, staff, and location were all very good but there was nothing that made the experience special. It's really hard to put your finger on it but if I were to return to Austin, I'd probably try another downtown hotel.The hotel seems pretty new and the lobby, rooms, pool, and other areas are all very nice. Staff were friendly. I ate at the Italian restaurant one night and I would not recommend it.Location is good but if you're going to the convention center you should know there are many hotels closer. The Marriott is about two blocks away.The doormen/valet guys didn't seem very knowledgeable about the area. On my first morning I asked with direction to the Convention Center and he didn't know! Another time I asked if taxis were generally available around 4am and he wasn't sure. I found that odd.Bottom line--I can't think of any reason not to stay but I probably wouldn't again."
4,"Great Personnel, Well Run, Minor issues","Was greeted warmly and received my key promptly. Room was clean and quiet for the city. The bars and restaurants are good quality and reasonably priced. I paid less than my local pub price for a common beer in the lobby. The only bad items are fitness equipment. The lone cycle was damaged and not usable. The pool was very warm, maybe high 80's, not refreshing on a 101 deg day after a run. Also, there are not full-size ironing boards to be had. Which is odd as the room ironing boards are just over two feet long and you cannot iron a sleeve let alone a whold shirt."
4,Overall stay experience.,"The staff are courteous and readily willing to provide assistance. However, the room cleaning team needs to follow their policies and procedure. For the 5-day stay, bedsheets we’re not for once changed despite the policy of changing it every three day or by special request. I was charged for WIFI despite having registered for membership. Overall, I still rate the hotel as very good."
5,"Conveniently located, well appointed hotel","I stayed at the JW Marriott in Austin while attending a national conference held at the Austin Convention Center. The hotel's location was very convenient to the center as well as the conference's main social event (@ Austin City Limits). Close to public transit stops (low cost option while visiting!).This hotel has all you would need, a business center, spa, fitness center (plenty of cardio & weight machines) and a pool.I would recommend and return to this property!"
5,Annual meeting - Business visit,"Excellent stay as always, at this property. Staff was friendly and attentive and I like the idea of posting someone outside of club lounge, to verify access, and minimize access to those individuals who did not meet requirements to gain access"
5,Gorgeous JW Marriott in heart of Austin,"This JW Marriott is a gorgeous hotel in the heart of Austin. It is a 2 block walk to Convention Center and around bars and great restaurants. Good restaurants on property and a Starbucks! The only compliant I have which is why I docked the Service is I have called twice now requesting a receipt to be emailed and I requested at checkout and have yet to receive it and it's been 3 days! Also, even with status you do not get late checkout."
5,Great Stay!,"Was here for a conference. Great location - close to all the spots we wanted to visit in Austin. From the very beginning. the front desk was quick, courteous, and helpful with check-in. Clean rooms and comfortable beds. The shower... spacious with the perfect water pressure! It always felt amazing. The rooftop pool was very nice. Beautiful view, and I really enjoyed their playlist! Hotel lobby bar was very energetic. Conference area was great with tasty food and snacks in between.My only gripe was that the valet took a very long time with the car the first time we had to pick it up (about 40 minutes). However, after that, they suggested to call in for pickup instead of texting the number, which was much smoother. Overall great stay."
5,Recent Stay During NIGP Conference,"Everything about this visit was perfect. Expert staff ensured that every part of visit was above par, room was clean, quiet, and bed was perfect. Nicest amenites I've experinced - I don't want to stay anywhere else when visiting Austin!"
5,ASCRS / ASOA meeting,Great accommodations and the staff was wonderful. Couldn't have been better.I really enjoyed the breakfast on the 5th floor. Everybody was extremely friendly and helpful throughout the facility. I had a wonderful time
4,JW Marriott Austin,"As always the JW never ceases to impress. Their customer services, amenities and room quality are bar none. Just wish Marriott would of not changed their rewards methods. At least hold their members last status category in order to keep those perks."
5,Great Experience!,"The service, amenities, staff and overall hotel experience was amazing! The banquet facilities and service were top notch as well. The location is perfect. I will definitely stay here every time I visit Austin."
5,Beautiful property!,"Stayed here once a year for several years. It was a business trip where my spouse joined me. The location is perfect for seeing the city, and also perfect business space. Love this property. Rooms are comfortable, food is great, location is convenient. Pool is fun."
5,Great stay,"We decided to come to Austin for a long weekend. The hotel was comfortable and convenient to restaurants, riverfront and downtown. The service was outstanding. We enjoyed breakfasts at the wonderful executive lounge. Dinner one night at Cornerstone was also very hood. Pool area was small but beautifully appointed."
5,Excellent Property,"What a great JW Marriott in a great location. I had dinner at the Italian OP and it was excellent. The field green salad was pure and plain with a great dressing. I had the shrimp pasta and again, it was spectacular. The pool was vibrant and exciting. My room was comfortable and modern."
5,"Great location, excellent service",Stayed at the property for a conference. It's ideally located in a central downtown location. Rooms are clean and well appointed. Only issue was a strange whirring sound as my room was near storage and an elevator. Staff provided excellent service - very friendly and helpful.
5,Incredible Downtown Views,"Absolutely loved this property!! Central to everything and incredible views from our high floor corner room!! The only issue was the deafening noise level in the lobby (both Friday and Saturday evenings) and in the Burger Bar Restaurant on Friday. You had to yell to be heard, conversation wasn't possible, not pleasant at all due to several groups holding meetings at the property and too many drunk bridal parties. Take time to enjoy to pool and gym, you won't regret it."
5,Austin for a conference,I was very pleased with my stay at the JW Marriott in Austin. The room was very comfortable with plenty of space. The bed was comfy and the bathroom has plenty of counter space. The best was the water pressure in the shower....awe! It's convenient to all of the downtown attractions. I rented one of the scooters out front and scootered to the Capital and that was a hoot. Easy access to the bat bridge and the waterfront boat tours. Great stay in Austin.
5,COS Convention,"The hotel, staff, and facilities were top notch. I have visited this hotel several times over the last five years and it has never disappointed. The staff welcomed us at the door and quickly checked us in early since rooms were available. They thanked me for being a Lifetime Titanium Member and upgraded my room. Any questions we had during our stay were answered in detail and with a very positive attitude. We were able to utilize both of the restaurants, the gym, and the lobby bar. The quality of the food was exceptional and helped make our trip even that much more enjoyable. The hotel is located in perfectly within the city and allowed us to explore the sights without having to travel too far throughout the day. These are the reasons I am a loyal customer to Marriott and will continue to be in the future. My compliments to your staff and the way they engage with their customers, even when it is extremely busy. We felt like we were welcomed from the very beginning of our trip."
5,Pareto Conference,We were greeted personally by someone waiting outside the check in desk. Everyone was very friendly and the customer service was on point. Event rooms were set up perfectly. Food for event was amazing.
5,Great hotel,"The staff was friendly, and the check-in process was so easy and efficient. The app helps a lot. The room was very nice and spacious. I stayed at this location due to a business conference being held here. The facilities were excellent, and the food was wonderful."
4,Austin conference hotel,"I stayed again at the JW Marriott in Austin and had another great experience. The room had a nice view of the river. The bathroom, unfortunately didn't have a tub (I know I'm an exception on liking tubs) and the lighting isn't great. But clean. The location is great in Austin."
5,APG 08/22-08/25/2019,"Great stay! The hotel staff were phenomenal, very polite and quick to respond to any issue or request. I had a minor issue with the TV remote, but the staff responded as if were a major item and had the issue resolved in no time. The room was clean, the food excellent, and the atmosphere awesome!"
5,Business Trip,Excellent hotel! Clean and friendly staff! Everyone I came in contact during my stay always spoke and asked how I was....even the maid service. I would recommend this hotel. Restaurants are easily accessible and several to chose from.
3,Junior varsity,When you go to a JW Marriott the expectation is superior service. We got treated like we were at the Days Inn while at the Austin JW Marriott. Twice there was no follow up on commitments. And no refrigerator in our room? Seriously? When we asked for one they brought one that looked like it had been through 10 years at a University of Texas freshman dorm room.
5,Excellent stay!,"Wonderful hotel! Will definitely go back! Room clean and spacious, service great. Great place for meeting. Great restaurants in hotel. Loved everything about it. Pool was super fun along with rooftop bar."
5,Everything You'd Expect plus a Bonus!,"I was in town just for a day and I was so happy they let me check in early on the app. The room and bathrooms were renovated and updated; I'm so glad someone figured out that not all of us need a bath - a great shower is better! - and thank you for the water. The starbucks on the 2nd floor is also a great addition to the hotel - definitely a plus. Lastly, the hotel is right in the middle of everything!"
5,Lovely stay in downtown Austin,"We had a corner room on a high floor and it was lovely. Quiet and relaxing is what we were looking for and the Marriott delivered. Pool area is similar to others in Austin, more of a lounge than a true pool. Not really kid friendly nor could a kid really have fun and swim. Luckily I didn’t have my kiddo on the trip, but know that is what some families would be looking for. Gym was fantastic, one of the better ones I’ve been in. Great job and we’ll definitely be coming back!"
2,Tough stay at Jw Marriott Austin,"I spent two nights at this hotel on business this week. I was not able to rest the first night because there was a loud, intermittent sound coming from the plumbing in the bathroom. I reported this to the the manager and he was polite and apologetic. He assure me this would be resolved for the second night. He also sent me a coupon for a few coffee. However, we had the same problem the second night. I didn’t call down after the second night thinking there was nothing different I could do from the previous night, and frankly, it was no longer my problem. As I was leaving my room in the morning, I received a $50 voucher for the hotel restaurant, which I was not able to use because I had a flight to catch. I know this could have happened at any hotel, but when you pay JW prices you expect better. I really wished this would have been handled differently."
5,Staff was totally attentive and service flawless,"I stayed at the JW Marriot in Austin for five nights, made use of in-room dining and the restaurants, valet service, meeting rooms, pool and fitness center. I requested a room convenient to the fitness center in advance and received a great location enabling easy access. Food was uniformly well prepared and flavorful. The staff could not have been more helpful. My experience here made me think twice about being hotel brand agnostic and explore Marriott's loyalty program."
5,Awesome property,Great stay We were here three nights for a business conference. From checking in to checking out pure pleasure .Perfect downtown location with an amazing view from the rooftop pool area The pool was such a pleasure.Next time in Austin this will definitely be our home away from home.
5,The excellent JW Marriott,"Rooms are clean, comfortable & the very best showers! Evening turn-down service is appreciated, as well as the in-room complimentary water bottles. Starbucks on the second floor has reasonable prices! We will keep going back!"
5,Beautiful property and great location!,The JW Marriott in downtown Austin is the perfect hotel! It is located within walking distance of many restaurants and the ACL Moody Theater. The staff is welcoming and service is fantastic. Our room was comfortable and well-appointed. We will be back!
5,Excellent facility and staff,"From the front desk staff to the cleaning crew to the facilities themselves, the JW Marriott Austin created an excellent guest experience. I went on business but would go back for fun. Apparently I need to type a few more words before my answer is long enough to be accepted by the bots. So there. I hope now that we've all been subjected to a meaningless forced extension of vocabulary that we can get on with our day and the robot overlords will accept my meager submission. The cheerful and courteous staff of the JW Marriott Austin wouldn't have done this to me. They would have respected my time and given me a complimentary bottle of water so that I didn't get dehydrated in the heat of Austin's glorious summertime. People > Robots."
5,ESTO Convention,"I had an excellent stay, the rooms were very nice and clean, loved the hair products. The staff at the check-in were very professional and friendly. Overall stay was very nice. Meeting rooms were excellent."
4,Cool Hotel at 104 degrees!,Great Facility Staff attentive and helpful. I wonder about the practice of having the pool open to the public as it was overcrowded on Sat/Sun with more than just hotel guests.Other than that great Bar staff at pool!
5,Perfect retreat in Austin,"While there are several good lodging options in Austin, the JW Marriott ranks supreme. Perfect location, great, attentive team, excellent dining options, wonderful and spacious lobby - and VERY comfortable rooms. What more could you want out of a hotel stay? Nothing!"
5,What an awesome staff and beautiful facility,"It started from the moment Goktug checked me in - efficient, friendly, fast, accommodating - I can't remember having a better and more impressive check in experience following a very trying travel day. Every person on the JW team followed suit, from bell desk to front drive valet - these folks were on their GAME and it was noted. I also absolutely loved my large guest room and the beautiful walk-in shower and bath products. The geodes over the light fixtures on the bathroom sink wall gave the room a true sense of artistry and the buckle details on the leather headboard of the bed were also extraordinarily beautiful - reminding me that I wasn't at a random Marriott - I was at a JW. Fast elevators (I recommend getting a room on 25th floor or higher to take advantage of that elevator bank) and the meeting rooms were large, modern and very comfortable. Awesome catering staff and beautiful food for our convention. I would strongly recommend that meeting planners look to this hotel for its flexibillity, beauty and the quality of its staff and its culinary excellence. I would look forward to planning a meeting here in the future. The Burger Bar on the street level is really fun and the Starbucks on level 2 is very convenient and well run. There is a lounge on level 5 that is beautiful and well-staffed. There is a very aggressive homeless population located on the Congress Street side of the hotel and this played a role in my daily comfort (lack thereof), but I do not hold JW responsible for this deplorable state of affairs. It is just a warning to future guests to not be careless around this aggressive panhandling scene - it is unlike any I have seen in America (or worldwide for that matter). Good restaurants are located nearby but you will not be able to walk a single block without being accosted. It is always a relief to be back in the hotel (great air conditioning as well in the room and public spaces)."
5,Exceptional,A true 5* star experience in the heart of downtown Austin. All the staff we dealt with were attentive and friendly. Our stay was exceptional and it appears this hotel is very well managed because everything was so efficient. This is a true gem in Austin.
5,Work Trip,"It was my first trip to Austin for a work conference and my stay at the JW Marriott was wonderful! The staff was more than pleasant and, while at the bar and restaurants, I was also so pleased with the service and food! Thanks for the wonderful experience!"
5,Excellent Stay!,"John was the most amazing front desk staff person I’ve ever met! From that moment on, everything was just wonderful. The beds are super comfortable and the shower pressure is perfect. The property has great dining with a good happy hour. Location is great. I cannot find one complaint about this place."
5,"Fabulous hotel, fabulous service and fabulous food!","Thanks you, JW Marriott Austin, for the fantastic hospitality. I broke my leg several months ago and my leg was swelling with all of the meetings and heat, etc. You brought me a huge container of ice to help my leg. And - all of my food was delivered well before the given timeframe and all of it was delicious. And special shout out to Harold in the Italian restaurant where I got dinner to go two nights in a row. He was so friendly and engaging. Smart young man! Thanks for all of the servers at the ESTO conference too - they were amazing. Great staff and help!"
5,Great experience,"The JW Marriott in Austin is a wonderful hotelwith great service, caring associates,excellent food, and spacious, clean rooms.It has a comfortable lounge in the lobby.I recommend it to anyone who wants tostay in am upscale hotel."
5,Not 5 Stars -- 10 Stars!!!,"The Austin JW Marriott sis outstanding. Staff was always available to provide assistance. Tips are pooled together and shared. Conference food was delicious & service was professional, polite & cordial.Definitely TEN STARS."
5,Great first trip to Austin,Had a conference in Austin. Added a day at both ends with spouse. Hotel was full with our group but amazing service from the minute we walked in the door. Personal service and attention to detail. Superb.
4,Great Location,"Disappointed there was no microwave or refrigerator in the room since the hotel was upscale. Staff was attentive and courteous. Within walking distance to the “bat” bridge, Congress Street, and music venues."
5,Amazing service,This hotel exceeds expectations!! From point of arrival to all interactions with all staff every one here is extremely helpful and attentive providing above and beyond what initial requests were ... love it!!
5,Great stay,I was in Austin for a work conference. The hotel was a great place to stay and a great place for the conference. The downtown location made it easy to explore town - we walked everywhere. The staff was over the top friendly and gave us great recommendations for attractions and food. I would definitely recommend this hotel!
4,"Good service, central location","We stayed for two nights to explore downtown Austin. The hotel is very clean and the service checking in was great and the valet service was quick as well. The bathroom was large as was the room as a whole. We stayed on a weekend when a travel convention was in town. I wished that we had gotten a room with a full view of the lake, but I'm sure they were all given to those from the industry. The room rate was a bit high, but I guess that is to be expected for this brand. Definitely consider this hotel to explore the Austin sights as it is very centrally located."
5,As advertised,Great job from the welcome at the front desk to the great customer service during the stay. I was there for 5 days and found the experience seamless. Ratings for the property proved out. I would recommend this property and loved the quiet time guidelines.
5,Great visit,Wonderful stay. Enjoyed the pool and fitness center. Location was perfect. Close to restaurants and shopping. Staff was welcoming and knowledgeable. Will definitely stay at the JW on my next visit to Austin.
5,Great place and great people,"Very clean, unique and best of all the customer service was outstanding. Is in the heart of downtown Austin, so everything is easily accessible. Dinning in the restaurant was a little pricey but food was good."
5,Exceptional,"I was here only one night for business, but in that short stay, I needed deodorant, a printer, FedEx pick-up and concierge assistance. Every need was met, saving me from panic, and making my short stay a success!"
5,Ron’s Alec review,The staff was outstanding and the service was excellent. I would recommend this Hotel to all. I asked for distilled water and a box fan and it was delivered within 30 minutes. The room was one of the best I have ever been in and it was quiet.
5,Heartland,"It was a fun filled trip! Thank you all the staff for making my stay an amazing experience. The rooms were amazing, the food was very well prepared. I hope to stay with you again in the future.😄😄😄😄😄😄😄😄😄😄😄😄😄😄"
4,Great service,"Your services are very good. The people are friendly and helpful. What I am always disappointed in, not just in your hotels, is the lack of adequate lighting in the bathrooms. Most women can't put makeup on in a dimly lit room."
5,Excellent Facility,Received excellent service Staff went out of their way to be helpful. Staff were knowledgeable about events. Facilities were very clean and audio visual worked well. Helpful staff. Love the Starbucks in the hotel.
4,KW Conference,"The price for the room was expensive and no breakfast included. Room was clean, spacious and nice.Location and proximity to the convention center was good. One big negative is that there is no shuttle from the airport. You have to factor in another $70 for 2 way travel from and to airport."
5,Great stay in Austin,"The JW served up some good Texas hospitality. Room was perfect and the concierge lounge was top notch! I was there for a conference and the meeting spaces were very nice as well as the food, which is unusual for a big conference hotel."
5,Lots to love,"Each staff person I encountered from the valet, to bell hop, to registration, the spa & even on the phone was so helpful & friendly. The rooms are uniquely decorated specific to Austin, with high design elements as well. LOVE the wall sconces in the bathrooms! The rooftop pool is also lovely - go early, when it’s shaded before the sun bakes you. Excellent dining options - too many to choose from. Would definitely stay here again!"
