rating,title,review
5,Phenomenal hotel with amazing staff,"JW Marriotts continue to set the bar for exceptional service and this location is no different. Felt welcomed from the moment we arrived till we left, we enjoyed every aspect of this hotel. The pool was crowded but great and offered a wonderful view of the city. Our room was spotless, spacious, and extremely comfortable. As I mentioned, the staff was great and was there any time we needed anything. I would gladly stay at this hotel again as it was one of the best overall experiences I have had travelling to date."
5,5* all the way,"This is a very very nice hotel. The rooms are clean and very nice. The beds and pillows are awesome and very comfortable. My room on 29th floor was great and quiet and had a great view. The bars and restaurants have very good food and staff is great. Some servers tend to not be very attentive during the evening but late night staff is right on!. Hotel is in a great spot, close to everything you want to see and do. one complaint was the food at the banquet rooms, but thats a small minus. The biggest plus is the staff at the front desk. They come out to greet you and will do anything to ensure you are happy. Really great hotel. Great stay. highly recommend it."
5,"Excellent Hotel, but Pricey","I had a very enjoyable two night stay at the JW Marriott Austin. This was my first trip to Austin and the hotel was well situated to visit many of the city's sights (Capital Building, 6th Street, South Congress, etc). My room was on the 30th floor with an amazing view of Lady Bird Lake and the city. The shower was spacious and thankfully the controls were situated on the opposite wall from the showerhead!The JW's facilities are fantastic, including pool and gym. I have never seen a hotel gym equipped with a full squat rack before and made sure to use it. However, It's somewhat annoying to access the pool on weekends. I was asked for my room key, room number, and wristband on a Saturday. Apparently many people try to sneak-in off the street, so I suppose these measures are necessary. On Sunday, no wristbands were needed, The pool is a decent size, but due to the crowds, it's more for standing around with a drink, than actually swimming.The only downside is that the JW is pretty pricey. Rates seemed comparable to a hotel in Midtown Manhattan. Breakfast in the Corner restaurant was quite good. All the staff I encountered were kind and helpful. I would definitely return!"
5,Beautiful Hotel with Lovely Staff,"I can’t say enough good things about my stay. I was there from 9/29-10/2 for a local conference. The hotel is beautiful! The location is great to walk to local restaurant and shops. The hotel has a beautiful rooftop pool and bar. There is a spa, fitness facility and two great restaurants to choose from.I truly have not met a nicer staff next to staying at Disney World. Everyone was so proactive and greeted guests upon arrival. Every interaction felt personal, from the front desk, waitstaff and housekeeping. If you are planning a trip to Austin, I highly recommend this hotel."
5,Fantastic hotel with exceptional customer service,I was so impressed with this hotel during my recent stay for a business conference. The lobby was gorgeous and my room was luxurious. I can’t say enough about how nice my room was. I thought it must be new construction because everything looked so fresh. The pool is gorgeous and I had a lovely time speaking with the bartender. I hope to be able to stay here again on a vacation.
5,austin,I did not know why I did not get any points in my stay I gave my card number and It happen all the time .I think is unfare that I go in a business meeting and do no get points . This is not the first time .I am a member of Marriott . The point is that I am staying i just get the points
5,"Great hotel, ok service","Check in experience was not great. No mention of my platinum elite status, did not ask whether I wanted points or other welcome gift, no mention of room upgrade and would not look into my request of using my company rate.Room was great. Large bathroom with luxury stand up showerHad to call and complain twice about the room next to me for noise around noon. I acknowledge the hotel compensated me for this.Low floor, definitely not worth the money spent. Will choose a different hotel for my next Austin visit"
4,Nice location!,"This hotel was in a great location for us. It is very clean, has nice decor and very comfortable beds & pillows. The roof top area has a great pool and bar,My big con was that we requested a rollaway bed and when we arrived at 3:00am due to flight delays thats when they told me. The front desk offered no solution other than i'm sorry you weren't told. You don't ask for a rollaway unless you need one and it can make for some uncomfortable accommodations without it. The lack of communication and ability to rectify the situation is a problem for me."
5,"Huge, nice location and views","Stayed here for 3 nights for business. The hotel was big and full of amenities. So many restaurants, bars, and a spa. Only thing is that the Starbucks on the 2nd level was understaffed around 8am weekdays. There was a convention and even though the meetings provided coffee and breakfast, the line for Starbucks was extremely long. Only one person was working at the time. 3 or 4 people could have easily managed the crowd.My 2 queen corner room was very comfortable and clean. The bathroom was luxurious with the shower and roomy countertops. Finally a real bathroom rug, not a towel. Massive windows on two walls gave me fantastic views over the rooftop pool, lake, downtown etc. There was loud music in the evenings that I could hear on the 18th floor, but it stopped at a reasonable time.I would return for sure."
5,"Beautiful hotel, excellent location!","Walking distance to great restaurants, bars & shopping! Located right near the river which has a wonderful path which is great for a nice walk or run! The pool area is also very wonderful and relaxing with great views. Had a great lunch while enjoying the beautiful weather poolside."
5,Love JW,"I absolutely love JW hotels, always in great locations and with the best staff.If you're planning for a stress free vacations or a work trip environment you should consider JW as your best option for the trip"
5,Great Hotel and Staff,"I came to the JW for a conference and the hotel was a great location and the staff were great! JW has great options for restaurants, it's very spacious and the rooms were clean. Definitely will visit again for business or personal!"
4,Great location in Austin!,"Stayed here for some personal time and some business, 5 nights. Unfortunately the King Room I reserved was not available, so they game me a 2 Queen room. Staff is friendly, food is good, plenty of dining choices, nice pool area with Cabana rentals. Facilities are clean and well maintained. Only CON: I stayed on the 6th floor. 24/7, there was a mechanical clanking/grinding noise coming from under my room(the 5th floor). I told the front desk staff about it twice, never resolved. That's rough when your trying to catch up on sleep from a 2 time zone change! Overall, a very nice property."
5,Premier Customer Service! 🤩,I traveled to Austin for a conference and the JW Marriott was exceptional! I had great service from the moment I checked in until I left. Would most definitely recommend for a casual stay or Conference venue.
5,If I Could Give Ten out of Five Stars I Would,"I stayed here with a friend overnight for my birthday and then for a conference. They brought up a microwave and fridge for no extra charge, brought me a nice birthday surprise and even a Starbucks gift certificate when our coffee pot went on the blink. They were very attentive at check in and anytime we had a question and there was barely a moment before we were attended to at the front desk even though there were multiple conferences going. I love the Marriott brand to begin with, but their service was second to none.The rooftop pool on floor five was also very relaxing and a great place to stay after the conference for a couple of hours while I waited for my plane to leave.All in all, a great trip staying in the heart of downtown just a few blocks from 6th street."
5,"Clean, Friendly, Perfect Location","This was a great hotel. The JW Marriott Austin supplied everything I needed to rate a hotel 5 star - they had WONDERFUL customer service, clean rooms, clean facilities and fabulous food. The rooftop bar and pool is a great place to relax, when you aren't in a business meeting or exploring the awesome city around. I highly recommend!! I felt like I was in my ""apartment"" rather than a hotel."
3,Good hotel great staff,This hotel is in a great location. We had some hiccups with our room which the staff tried to accommodate. The service is quick.Restaurants are okay - over priced for the quality of food. I suggest eating off campus.
4,Not ADA,"Bonvoy member attending conference. Upon check-in a 2:00A, was assigned an accessible room, that was not requested. After notifying front desk, they immediately assigned a different room. Why wasn’t this my original assignment? Why wasn’t I told in the lobby, so that changes were made before moving upstairs."
3,Bad experience with mobile app on otherwise good stay,"The location and rooms were fine, but the mobile app was frustrating. I used the mobile check-in feature on the Marriott app and was informed that I would receive notification when my room was ready and would be delivered a mobile key. After arriving at the hotel, and waiting in the lobby for over 2 hours while waiting for my mobile update, I noticed that it appeared that everyone going to the desk was being issued room keys. I then waited in the line to ask an agent directly when I might be receiving my notification and electronic key from the app. The agent told me that rooms were available, and that they did not yet offer electronic keys! The app being inaccurate caused me a lost 2 hours and it would have been more had I not become impatient enough to go to the desk. More frustrating was that the person at the service desk blew it off like it was no big deal. I suggested that she report the issue so others don't have to go through the same frustration, but from her body language and the fact that she took no notes I'd be surprised if any additional action was taken."
5,Austin Weekend Conference,"Bustling hotel in the heart of downtown Austin close enough to walk to many of Austin's great reataurants, bars and entertainment. Clean, comofortable room and surprinsigly quite and restful sleep. Can be a bit pricey depending on the time of the year but a good place to stay for luxurious comfort and convenient location."
5,Game Day stay,"Very clean, updated property. Great place to stay on football game day. Location was perfect to walk to tons of bars and restaurants. I ate dinner at the Star restaurant, which was fabulous, and I had drinks at the bar, which were great as well. I would definitely stay here again."
4,Excellent stay,"The Marriot is in the center of town, on Congress Avenue just a couple of blocks from the river. The room was spotless although I was surprised it did not have a refrigerator. Lots of towels and amenities. I arrived after a night flight, got to the hotel about 9 am and they were able to give me my room right away as well as an upgrade. My only complaint is that in the restaurants and some other areas they play music and it is much too loud. It's especially bad on the pool deck; the music is so loud it's difficult to relax and converse. At the pool I asked whether the music could be turned down but was rebuffed. It's unnecessary noise pollution and turns what should be a nice peaceful afternoon outdoors into a blaring disco. In spite of all that I would return."
4,wonderful trip,"nice, clean modern hotel with great amenities. wonderful, friendly staff at front desk check in. great gym. very clean, comfortable rooms. easy check in. hotel has great, central location near stores and restaurants."
2,"No rest, no sleep, no good coffee","This hotel was a real let down. First of all it’s a nice property, if you like or don’t mind convention hotels. My main issues came once I was in the room #2628. I heard what I thought was a dog barking but later realized that it was pipe noises or some sort of mechanical noise that sounded like a dog barking. I finally got to sleep but was awakened again at 7:00 am to loud banging and what sounds like noises in the pipes next to that room. The next morning it was the same thing- early morning awakening due to these “mechanical” types of sounds that were very loud and prevented any sleep or relaxation. As if that wasn’t enough, the coffee machine is archaic and the coffee tastes like dishwater. If you want a decent cup of coffee you have to go all the way down to the lower floor and walk a mile and wait in line to pay $4.00 for a cup of coffee. I will never stay at this property again. At the Fairmont you have a Nespresso machine in each room with fresh coffee pods for a great morning coffee experience. The noise alone in this room was so awful that the terrible coffee was insult to injury. I invite the manager of this property to sleep in room 2628 and try to get any rest at all. I returned to Houston completely exhausted."
5,"First visit to Austin, will definitely return for another!","I came to Austin for a work conference at the JW Marriott Austin. I was surprised at the number of dining options in and around the hotel. Overall great stay and I look forward to coming back to such a great city and hotel, but next time - no work, just for fun!"
5,Great visit,"The service was great, the room was clean, the bed was very comfortable and we loved the sky line view. Great location for walking to shops, restaurants, Sixth street venues, etc. Would definitely stay here again the next time we are in Austin."
4,Great location!,Location is fantastic! They have great bars and restaurants inside the hotel. I recommend walking over to the Elephant Room for live jazz. It was pretty noisy even though we were on the 23rd floor. We heard a lot of sirens. But the room was comfortable and very clean.
5,"Awesome location, beautiful decor, nice conference space","I stayed with the JW for a work conference which was held on the 2nd level. The event staff was so gracious & hospitable, the food was surprisingly delicious and prepared artfully for it being banquet food (you've taught me not to judge hotel food so harshly!) The steak food for the Texas themed banquet dinner was perfect & loved the sauce.The front desk staff, I wish I could remember her name but she was from Poland I believe was informative, warm, and truly made me feel welcomed.The room view was nice, the bathroom was my favorite. I thought the room decor itself was a bit boring and plain, but the lobby, restaurants, and event space was very well done.Appreciate the late checkout and granted request for a high floor.Excited to come visit again and will definitely consider staying with your hotel!Oh one note, the bottle water you provide guests tastes like you're drinking flowers. I know this is weird but its just a weird taste and I can only compare to a floral scent."
5,Highly recommend!!!,What a treat to stay here! Beautiful rooms and incredibly helpful staff. The JW team helped our conference rub so smoothly and I would highly recommend the ATX Marriott to anyone visiting Austin for business and/or pleasure.
4,Excellent overall experience,"The hotel was excellent. The bed was extremely comfortable. The room service was excellent. The hotel is extremely clean, and the service was generally top notch. Only gripe I have is that Marriott requires you to sign up for their rewards program to get free WiFi in your room. That means I have to get all of Marriott's rewards emails, which I would prefer not to get. For the cost of the room, free WiFi should be included, without having to sign up for the rewards program. Oh well..."
5,AMAZING!,"This hotel was not only beautiful inside and out, but it also had amazing staff, was super clean, and the pool deck was awesome. The hotel's location was perfect for getting around. I had a great time and I will be back!"
3,JW Austin Vegas comes to Austin,"Well the positives are this is a nice modern clean JW, rooms are spacious, furniture and bathrooms are good and staff are friendly. The negatives are this is a CONVENTION HOTEL first and foremost. They try to book as many as possible and the hotel is packed to the gills, good luck getting into an elevator that doesn't make MULTIPLE stops. The Lobby is literally a circus, the bar and restaurant are designed to have as much foot traffic as possible and this runs into the lobby. It is very loud, very crowded and a total scene. If a JW and a W decided to have a child, it would be this hotel. If you are in the mood for a ""Vegas"" like scene with a crowded lobby, loud bar scene and endless waits for an elevator then this is the perfect hotel for you...."
4,Not very accommodating,"We have 3 small children so us usually book 2 rooms to be more comfortable. We asked that they make a note upon booking that we would need connecting rooms. Called the week before to remind them about connecting rooms, call the morning of to request the connecting rooms. Nope, they said they could do nothing until we checked in and if they there available they would give them to us. Unfortunately for us, we work for a living so we did not arrive at hotel until a little after 5 which meant that they no longer had connecting rooms available. I called concierge the next morning requesting connecting rooms again and the concierge said she was busy with guests and that she'd get back to me. She never did and we spent our 4 day weekend in 2 separate bedrooms down the hall."
5,Amazing stay - wonderful property,JW's are usually great - the one in Austin has been amazing delivering excellent service and a great vibe. this was a combined family weekend followed by a business trip. Location was perfect and food/bars were great.
4,NAPEO,"I thought that the directions throughout the convention center were confusing with signage and how to get to conference rooms. Elevators seemed to be themed with wrong levels, too, in the conference area getting to higher levels."
5,Austin: great Family Time with grownup kids!,"Outstanding staff to guest ratio and relations. Besides great accommodations, I simply asked where I could buy a last minute birthday card and voila up came a bottle of champagne and beautiful tray of chocolate dipped strawberries!Really a great weekend filled with UT Longhorns, fantastic food and music along with great family and birthday celebrations!THANKYOU"
5,Conference Stay,The hotel was excellent. The location perfect. The staff amazing. Would recommend to anyone wanting a great vacation spot or looking for a location for a conference. Everything is a short distance away and honestly the restaurants are some of the best.
4,I used the spa and all I could hear during my treatment was banging dishes . Not very relaxing. It also appeared at time,"I used the spa and there was constant noise during the treatment , banging plates etc . The hotel was extremely cold and the elevators only seemed to have one working at a time, we waited 5 minutes or more to use them"
3,Do you like a party?!,"I wanted to absolutely love this hotel- great location, beautiful room, amazing views of Town Lake, aka Lady Bird Lake. I don’t know if I’ve ever had such a noisy room at such an expensive hotel. I was giving a presentation and was rudely awoken and kept awake for 2 hours by the raucous party in the room above me."
5,Stylish place with a warm feel,"This is the second time I have stayed at this Marriott location. They never seem to disappoint. They are courteous, professional, and helpful. Their rooms are always comfortable, the fitness area is spacious, and the property is well maintained."
4,terrible spa,The spa is worth skipping. Prices are OUTRAGEOUS for below then average service. So disappointing. Pool is cool. Hotel is general is beautiful. Rooms are nice. Does this stand out? Not really other then the high price. Front desk service was excellent.
5,Excellent,Everything was great. People were wonderful. The only thing I have to say is that you should leave the breakfast tag to order and leave on the door for pick up should be put in the room each day if it has been used. I used it the first day & never had another one to complete.
5,Great place to stay in Austin,Stayed at the JW for a conference. Hotel has a lot of dining choices and is walking distance to a ton of restaurants nearby. Multiple bars for entertaining and the staff and bartenders are top notch. Highly recommend this hotel next time you visit Austin.
4,In Austin for a Convention,"Visited this property as it was hosting a convention that i was attending.The facilities and room are very nice. It is a new property and kept in great shape. The pool was nice although small for the size of the hotel. The Gym was one of the nicest hotel Gyms that I have seen. The room was spacious and modern. The shower head in the room was amazing. I wanted to steal it and take it home.The convention facilities were very nice.The executive lounge was great for breakfast and hordeuvres. They had various snacks and beverages thru out the day. Very nice to have access to this.Now why only 4 stars?1. The room service meal that I had was terrible. Got the fried chicken sandwich and you would think in Texas it would be nice and crispy. It was borderline soggy. The shrimp cocktail came with Salsa? I get Tex Mex but that was just wrong.2. While the bed was very comfortable. The pillows felt cheap and offered NO support. Once your head went on it, the pillow was completely flat. Not what you expect of a 5 star facility. I was not able to sleep well for 3 days.3. The Towels and sheets smelled funny. I think they do not use bleach, it had a strange odor to all the linens and sheets.4. The towels felt thin and scratchy.5. Final straw was leaving in the self parking garage at around 4am. The gate was closed and i could not exit the facility. I get security, but at least have a drive up sensor to open the door. I thought maybe Austin was a quiet town with no early morning flights. I went to the airport and it was mobbed. I had to call to have them open the gate. The lady that answered the phone initially hung up on me and I had to call back. Not exactly the challenge that I wanted at 4am."
5,A great trip to Austin,Impressive hotel! The staff was unbelievably great. Very helpful and friendly. Everything was perfect.The workout facility was also immaculate and equipped with anything you could possibly need.No detail was left out.
5,Wonderful hotel and people!,"Everything about this hotel is wonderful, from the staff to the facilities. I have to give kudos to Aneka at the front desk who went out of her way to make me feel welcome. The entire staff on the property from restaurants to catering staff, housekeeping -- they were all extremely pleasant and focused on guest satisfaction."
4,My Stay,Service was outstanding. My only disappointment were the towels in the room? They felt work and rough. I woud be expecting a more luxurious towel ? And ice only on the 5th floor. I know they would deliver - but small annoyance. I lived with the ice - but nicer towels a biggee.
5,Bachelor Party Done Right!,"Having stayed at the property before on business, it was the first place I thought of when planning a bachelor party for 12 guys in their later 30’s. It is really hard to beat the location to both Rainey and 6th and to have the amazing outdoor pool on the 5th floor.They accommodated our desire to have our rooms on one wing of a floor, provided mini fridges on request and have frozen bags of ice ready for guests to use for whatever purposes in the Austin heat.They also extended my platinum status to the rooms I booked and we were all able to use the concierge lounge.I would stay there a 3rd time in a heartbeat!"
4,Good hotel,"Nice hotel and the customer service was good, but everything we asked for took over an hour to get. We asked for a refrigerator and a cable. The refrigerator took an hour and a half and the cable took two hours. Our coffee maker wasn’t working and we didn’t want to wait another hour for someone to bring one so we just didn’t have coffee."
5,Excellence,"Really high quality full service hotel. A big property at over 1,000 rooms, but very well managed. Never any lines for elevator, front desk or bar. Clean and well located. Professional and well-informed staff."
5,Beautiful Hotel,"This hotel is beautiful. Public spaces are modern, clean and filled with nice and friendly staff. The rooms are nicely appointed with all the amenities you could ask for. Awesome shower! I have to say that even the housekeepers were very friendly, saying hello whenever I encountered one in the hallways. Very nice.The price for the room was crazy high, but I've paid that much elsewhere and not been nearly as satisfied."
5,Friendly and helpful Staff,"We had our convention in this hotel. Completely professional staff. Clean meeting and sleeping rooms. Hotel is beautiful and felt very secure. We never had a need that was not met. We asked for help with recommendations on local vendors. They had great recommendations. I would recommend this hotel for anyone looking for a weekend away or a convention meeting space. Personal or business trip this is convenient to downtown, the river, Rainey street and 6th street. We rode scooters almost everywhere. Such a fun city to visit!"
