rating,title,review
5,Fantastic !!!,We stayed 2 nights in this amazing hotel. Adam on the front desk was so helpful when we needed advice on where to go in the evening. The breakfasts were so enjoyable and the staff in the restaurant 1st class. Happy hour drinks was a real positive and the live music brilliant .. thank you for making our stay so wonderful.
5,Can I give 10 stars?,"From arrival to departure, bar and restaurant time, speaking with the bellmen — every touch point was top-notch. Zeriah checked me in and, upon seeing that it was my birthday, upgraded me to one of the most beautiful suites I've seen. After weeks of long work and time on the road, it was such a treat. She checked in with me multiple times to ensure I was having a good trip and offer to provide further services, and she and Sophia were both very accommodating. The staff at Geraldine's were awesome, the bellmen were always super courteous and helpful — everyone was great. Wouldn't change a single thing. [Except maybe that I had to work and miss wine hour.]Zeriah, thank you for making the end of my long journey as good as it possibly could have been — you knocked it out of the park!"
1,A very hip cool nice hotel,This staff is so friendly and so wanting to please. I enjoyed my view from suite Grace. I highly recommend it. The bathroom is amazing!! the Coffee is really great too. I only drink soy and luckily they had it. The food in all restaurants is well done.
5,Reviewing first impressions only. Complete review to follow.,"Just checked in for a one night stay. Chek-in is posted to be 4pm but we had no problems and no questions asked about checking in at 2. Check in took approximately 2 minutes. Choice of free bottle water or can of beer at check in was a nice surprise. Free happy hour from 5-6pm (might be weeknights only) including beer, wine and margaritas. Sorta makes up for the ridiculous $42/day parking fee. Friendly staff all around. Cleam rooms amd beautiful lobby. So far so good!"
5,Fantastic Experience,"Wonderful Austin experience! Close to many fun restaurants. Even has good entertainment at the hotel. Convenient for coffee and breakfast without having to leave hotel in the rain. The lobby and happy hour with beer, wine and margaritas was a plus."
5,Great new hotel,"Good looking and very comfortable hotel. Excellent bed and pillows. Very clean and good amount of space. Close to the Convention Center and night spots, but quiet in room. Close drive to South Congress and downtown areas."
5,"Location, Location, Location!","Location is superb as well as everything else about this hotel! Felt like a boutique hotel.The decor is very chic! The meal experience at Geraldine's was fabulous! The pool was very inviting, but it wasn't quite warm enough on this particular visit! Loved our visit!"
4,Really cool!!,"Love the location and this hotel! Rooms are spacious and functional (wish there was a bathtub) we had a deluxe queen -beds are very comfortable!All the staff was very friendly , efficient and helpful , with the exception of the bartenders in Geraldine, I am going to mention that to management. However the pool area and restaurant were beautiful!!If you are here on Sunday walk down Rainey street such fun great brunches all around !!"
5,Five stars are not enough!,"I planned a trip to Austin to celebrate my husband's birthday. Our stay at Hotel Van Zandt made the trip truly perfect! Our room was comfortable and well-appointed, with birthday treats to surprise him upon our arrival. We were on the 11th floor, facing Rainey Street, but aside from a faint musical beat, this was a quiet location. The staff could not have been more amiable, helpful, and accommodating. We loved social hour, with wine and different little bites each evening.The hotel's location is terrific. Numerous restaurants and bars are only a few minutes' walk away, and access to the river path is an easy walk, as well. We strolled downtown, too, which took perhaps 15 minutes.We capped off two evenings with drinks at the hotel's restaurant, Geraldine's. We also sampled a few of their small plates, which were delicious. We wish we'd had the chance to enjoy a full meal there.I cannot recommend Hotel Van Zandt enough! Thank you to everyone who made my husband's birthday so special and memorable."
5,Back again - it is now completed and is THE place to stay!,"I wrote a previous review of this hotel when it first opened to say how great it was despite the construction going on - which gave it 4 out of 5. I'm so please to be able to give it 5/5 after my recent stays here!The staff are wonderful, incredibly helpful and down to earth. The rooms were great and the food and drink in Geraldines was excellent. We really enjoyed wine hour as well!I love the decor and design which is clean, modern and unpretentious. It's good value and in a great location both for the highway and for downtown. There is also a lot of storage space!Will always stay here whenever I am in Austin - wouldn't even consider another hotel."
4,Trendy Experience,"Stayed for business. Had a Spa Suite so the room was spacious and nice. The halls and the hotel are average but the rooms have nice finishes. The location and view were nice for the short period of time I was there. Staff couldn't be nicer, received regular text messages to make sure my stay was going well. I normally would stay in a better known luxury hotel but wanted to try something a little different. This was definitely a more casual trendy feel. Not bad, just different then what I am accustom to."
3,Just a room,"Our first stay. Was nicely decorated. Bathrobes were trendy but not soft or comfy. The hostel is in a trendy location for the younger set, or those who like night life so the rates are fairly high for average rooms. We got the room greatly discounted, and would not have felt there to be any exceptional value to justify the $400 night regular charge.We’ve stayed at a lot of fine, high end hotels, but our guest room here was just average.Did not have a chance to see the rest of the facility as we were in and out. Must valet park car.Giant sized bottles of shampoo, body wash and conditioner are shared by all the guests before you, and that isn’t my cup of tea. I’d have no idea if someone tampered with them or not."
5,Second Visit - Great!,"After a wedding weekend in San Antonio we booked a night here to decompress before flying home. This was our second stay, and just as great as the first time. Staff is great, pool deck and bar area are excellent. The restaurant is quite good as well. It’s right on Rainey Street for access to nightlife, and not far from South Congress. My wife and I have stayed at several Kimpton properties, and this one is by far our favorite!"
5,Great Service especially for pet owners!,Staff definitely goes above and beyond.We stayed at the Hotel Van Zandt for a mini vacation to Austin with our new 1 yr old dog. We left our dog in his kennel while we went out for dinner. I guess he got a little excited every time he could hear people walk past the room. We got a text from the hotel that our furry friend was making a little noise and could they take him for a walk. They entertained him at the front desk and in the back office until we got back from dinner. We were so impressed with how sweet and understanding they were with our immature pup.We have always enjoyed Kimpton hotels but we are definitely staying at the Van Zandt from here on out.
4,A fun week in downtown Austin,"Beautiful hotel. Extremely friendly & helpful staff! Hotel is several blocks from 6th street which because it was cold, made walking to clubs/events not possible. Overnight parking is an additional $45 which seemed a high considering rooms are almost $300/night. First night we had a very noisy room, I reported it & the staff immediately upgraded our stay to a suite which was much quieter."
2,Disappoint from expectations,"I was not happy with value versus the price. There were very few amenities. Asking for slippers took two phone calls and 1.5 hours to get. There was only warm water, no hot. No desk chair. Geared only to millennials for street scene."
5,Loved It!!,"Great location, comfy bed, quiet and clean room. Dogs were welcome, pool looked very nice ( it was too cold to swim). Nice coffee bar in the morning and a happy hour in the evening. It was very nice to have a drink at the hotel, then head to Rainey street, loaded with fun bars and food trucks, delicious! They even had bikes to borrow, from the front desk and there is a path in the back of the hotel that goes for miles. Overall, everyone was very welcoming and it was such a nice hotel!"
5,Fantastic food,"We stayed at the hotel for two night's comfortable big beds, nice interior (I liked the bathroom door) extremely friendly people and the food in Geraldine's was out of this world:) I also liked the idea with the 5$ cupon that you get if you don't get the daly cleaning, more hotels should do that. Free internet."
5,Anniversary at Kimpton Hotel Van Zandt,"Incredible, wonderful place. We had a room on the 11th floor with views of downtown Austin from two different ""view windowns"". Had never visited Rainey St and found the convenience of good restaurants within walking distance a bonus feature. Only thing I will do different next time is demand a room on the other side of hotel that does not face Rainey St.....too much base and too loud for folks that do not stay up past 11.....getting old sucks. This is a great hotel and we will revisit in the spring."
5,My favorite Kimpton property yet,"The vibe of the hotel is effortlessly cool with great local touches that really fit the feel of the city. It's located right near the convention center and it was very easy to get all around the city from the hotel.The room was spotless and bed was really comfortable as always. There was a bluetooth speaker in the room as well which was a nice touch.Great service throughout the stay. I received occasional texts throughout my stay from the hotel asking how the stay was going and if I needed anything. They would respond very quickly if I texted back with a request. The concierge suggested a great restaurant and made a reservation before I'd arrived.The restaurant at the hotel, Geraldines was delicious (although the portions were on the smaller side). The Goat Tartare, Gnocchi with Oxtail, and BBQ Shortrib were all fantastic. This restaurant was busy during my entire stay and clearly a spot that locals hung out at as well.My stay was in the winter, but the pool deck and outdoor bar adjacent to Geraldine's looked like it would be a cool, relaxed (not pretentious) scene in warmer weather."
5,Trendy Austin hotel,"We just got back from staying at the Van Zandt in Austin. It was absolutely wonderful. From check-in, to the Social Hour, to brunch/drinks at Geraldines, it was unique, trendy, and absolutely delightful. We had drinks both nights and listened to awesome bands, and the ""vinyl brunch"" at Geraldine's was fab. We had one minor blip with our shower and it was fixed immediately and the service recovery was awesome. We will definitely be back to the Van Zandt our next trip to Austin. Great location (near Rainey St) and great hotel!!"
3,Second night regrets,First room was not furnished adequately. Second room was next to the service elevator so it was loud moving up and down all hours of the day. Second night and into depart day there was no water in the room and the hotel did not notify us there was a problem.
5,KIMPTON JUST GETS IT RIGHT EVERY TIME,"We have several international businesses and travel extensively. We probably live in hotel rooms over 300 days a year. We stay in all levels of hotels from 1-5 stars and you do get what you pay for, but even some upper echelon places just miss the mark here and there. And then there are some that exceed expectations no matter what level. Kimpton has always been in that category for me. I have my expectations and then they seem to kick it up one notch.The Van Zandt was just a one-night stay-over in our first visit to Austin and it simply was not long enough. And once again, there were just so many little things that I just didn't expect put a grin on my face.Special shout outs to the staff cannot go unmentioned. All the staff at the reception desk were incredible and Zion (""No we weren't making a delivery for the wedding!"") and Sergio could not have been more helpful or professional.We'll surely be back and stay longer! Thanks for the great stay.P.S. Extra points for being pet friendly too!"
5,Perfect Stay,"In a vibrant part of town - but away from the noise of 6th street. It was a truly lovely hotel that embraces the theme of local music. Everything in terms of hospitality, comfort, service was nothing less than you'd expect at a Kimpton hotel. Its now a favorite and we definitely will go back when in Austin. We chose this hotel as a place to overnight when seeing a concert downtown at the Frank Erwin Center downtown. They really kicked off the stay nicely when they offered us a local beer on checkin. It was a quick uber to the concert, and close enough that we walked and pedicabed it back after stopping for some late night street food and drinks."
5,A very special place!,"The Hotel Van Zandt is all about the experience! If you're looking for a special place to celebrate a birthday, anniversary or really anything, you should book this hotel today. The corner king room is the way to go! You'll have views in two directions. It's spacious and impeccably decorated! Also, we didn't eat at Geraldine's but did go there for music and drinks after dinner and the atmosphere is amazing! The hotel is perfectly located for Town Lake activities or for hanging out on Rainey Street (cool bars and restaurants.) Check it out, you won't regret it!"
5,Weekend Staycation,"As Austin locals we are picky about where we choose for staycations. My husband and I were extremely happy we stayed here! The hotel decor was really cool, drinks and food were fabulous and the location couldn't be beat. We will be back for sure!"
4,A hotel that makes things right,"This is actually a follow up review. My family and I stayed at Hotel Van Zandt in November and had an issue with one of our rooms. Long story short, the inconvenience we experienced during our stay was made up for by Joe, HVZ's manager. It's a nice hotel in a great location with a great management team. We'd stay there again."
5,Great venue for company meeting,"Stayed at the Van Zandt for a three day company meeting for approximately 50 people. From check-in, to the individual rooms, to all the services they provided us during our meeting the hotel was outstanding. When we arrived there were a few people in line to check in. It wasn't a long wait at all but we were offered beers and margaritas - which we all took advantage of after our long flight in. It made a great first impression. The rooms were nicely decorated; the only negative was that the hallways were all really dark. I'm sure that was intentional but I just didn't love the look. Our meeting rooms were well set up and the catering/banquet team was always nearby if we needed something. We also enjoyed the nightly happy hours.Everyone at the hotel was very friendly. The other added benefit was the location right by Rainey Street - it was easy to go out for the evening and know you were always within walking distance of the hotel. I would definitely stay there again on a future trip."
5,20th Anniversary,My wife and I chose Hotel Van Zandt for our overnight 20th anniversary celebration stay. All the staff knew of the event and did everything possible to accommodate a memorable time. There was even chilled champagne waiting as we walked into the room! We will most certainly be back.
5,"Great Property, Very well Managed","Lovely experience. I travel a lot for work and it’s rare to find such a great hotel. It was centrally located near a fun area of town, had hip decor and, most importantly, gracious service. I highly recommend staying at the Van Zandt!"
5,Business Trip but near Rainey Street,"Great hotel, I just like the Kimpton's style, and it's a block from Rainey Street, which is lined with cool restaurants and bars. Excellent restaurants on the 4th floor with a pool deck. Very good experience, would stay there again."
5,Get Away,"Great place. Great Happy hour. Great Staff. The room was very mod, and comfortable. Great view of Austin and Lady Bird Lake. Had a late dinner that was a bit spendy. Also had brunch the next morning. Best steak and eggs."
5,STAY HERE!!!!!!!!!!!!!!!!!!!!!!!!!!!!!!!!!!!!!!!!!!!!!!!!!!!!!,"The location is great, the rooms are terrific, Geraldines on the 4th floor has great music and reasonably priced drinks and the front staff (thanks ADAM, TRANG and AUTUMN) are some of the best and nicest of any hotel I've ever stayed in. HIGHLY RECOMMEND!!!"
1,Bad experience,Worst experience with a hotel I've ever had. Have a list of items that were way below par with the room and the service my boyfriend and I received. This was the second year my company had their holiday party in one of their banquet rooms and sadly I hope we don't have it there next year.
5,"Austin is FUN, this Hotel is phenomenal!","One of our favorite cities to visit & Hotel Van Zandt makes it all an overall fabulous experirence! Everything about the hotel is great including the location & access in & out of town! We enjoyed the amenities, attentive staff, and wonderful food, drink & live music too!!"
5,Exceptional Hotel in Austin!,"We decided to book a staycation in Austin. Having a new puppy, it was difficult to get away. Then, I discovered that Hotel Van Zandt is PET FRIENDLY! It worked out perfect! The rooms are very comfortable, the hotel staff is very friendly!"
4,Austin for Wedding,Travelled to Austin to attend wedding. Most of the out of town wedding guests stayed at Van Zandt. Very nice hotel with all the amenities. The bed was super comfy. Be prepared to pay $45 per night parking; no where to self park.
5,Van Zandt is Glorious,"We had been waiting for a Kimpton to come to Austin. Well they built a winner. This hotel is beautiful. We had a great time here. The Staff is super friendly and goes the extra mile. My wife forgot her iPad when we checked out, and the staff took care of mailing it to us!"
5,"Loved the quirky atmosphere, real nice place to stay","This was the overflow hotel for my business meeting and I'm glad it was and it had all the amenities as the meeting hotel but had a lot more atmosphere and fits well with the Austin vibe. I joined the loyalty program and you immediately get a $10 credit towards any of the cool items or food/drink you've got in your room, so a nice little perk."
5,Exceptional,"Kimpton's Hotel Van Zandt is a perfect example of why I and so many others love the ""Kimpton Brand""! Exceptional customer service from the front desk, restaurant and housekeeping staffs. Rainy first day here and staff bent over backwards to find extra umbrellas and forgotten toiletries.The hotel was clean, decorated with boutique Texan Restoration Hardware Furnishings. Awesome! Loved the holiday decor. Rooms clean, beds comfy, clean bathrooms.Hosted ""happy hour"" was a nice way to enjoy local craft beers, wine and homemade margaritas. I loved meeting Nik, Brian and Amanda one evening who were in charge of the evening festivities.Lastly, Rosia and her co worker (forgot name) really showed their pride keeping the first floor lobby and areas immaculate. Loved their smiles."
5,Best Hotel Stay Ever!!,"I had to be in Austin for an IBM event at the Sheraton. The Sheraton was totally sold out, as was many other hotels in the area. Searching the web, we found the Hotel Van Zandt, and boy am I glad we chose that hotel. At first, we chose it because it was close to the Sheraton. But I would choose it over and over again because of the way the hotel made us feel and took care of their customers. I loved my stay at this hotel, and will definitely seek out other Kimpton's wherever I may be traveling to...I was that impressed!!!From the décor to the amenities inside the room and within the lobby, they sure do know how to make you feel welcome and appreciated!!Highly recommend!!"
5,"Everything you would or could every want during a stay in Austin, Texas!","I'll start off by saying that I am a local, so I feel that I know Austin pretty well, take it from me when I say that the Hotel Van Zandt is everything wonderful about austin wrapped up in one perfect place. Everything from the music, to the lobby happy hour, and welcoming pets of every shape and size, Hotel Van Zandt really does it. The location could not be beat, you are steps away from Rainey Street or just an incredibly short walk away from the convention center and down town Austin. I staycationed here during the Thanksgiving weekend with my Mother and even she was incredibly surprised and thrilled with the service and stay. The staff is incredibly friendly, the beds are comfortable, the view from the pool is amazing, and the decor is definitely something to write home about. One of my favorite things about the hotel is their pet policy, I really think it's absolutely beyond great that they welcome pets of all shapes and sizes, I have two large dogs at home that are never able to travel with me because they are either two big or do not fit the ridiculous pet rules. During our stay we even say a couple staying with their pet pig. If that isn't Austin then I don't know what it. I can not say enough great things about Hotel Van Zandt and will for sure staycation there again!"
5,Built around music!,"Not only is the view from Geraldine's so beautiful, but you can hear music all the time! The chandeliers are even made of musical instruments! Also, I love Rainey Street!! I highly recommend the Van Zandt!"
2,Make sure your front desk team doesn't disrespect your guest.,"Gorgeous hotel but lacks communication to future hotel guest. I was not advised of Geraldine's which is the (only restaurant on the property) was going to be closed during the my stay. Super disappointing, honestly would of stayed somewhere else. My parents really wanted to have dinner there, if we were informed of this ahead of time we would of stayed elsewhere. To top it off the front desk lady that checked us in, was very disrespectful telling me things about my mother that were honestly very out of line. I couldn't believe what she said. Honestly, Location and the fact that it was just opened last year is basically the most attractive thing."
5,"Great hotel, very friendly employees","Stayed one night with our small puppy to attend a concert at the Erwin Center. They were extremely accommodating, especially to our dog. They do need a dedicated area for pets to relieve themselves, there was only a small grassy area across the street. Some issues with things not being credited at checkout (Kharma benefits), but it was easily fixed. Very tech savvy, I like being able to text for things instead of having to call. Lots of fun bars and food trucks in the area, but it can get very loud and crazy on Saturday nights.Nice big corner spa suite with good views."
1,Awful experience!,Restaurant not openLounge not openPool not openno coffee pot in roomRIDICULOUS to pay so much money for a hotel with NOTHING availableRoom not ready at GUARANTEED timeSoap smells awfulRoom was hot
5,Amazing quality,"Aside from a few hiccups such as the noisy hallways, which isn't always necessarily the hotels fault due to other guests, and the ridiculously expensive parking this place is as close to perfection as you can get. The customer service from top to bottom is amazing. The facilities and decor are unique and a good reflection of Austin. Food is worth every cent. I would recommend trying to book a room on the highest level as possible due to all the sounds coming from Rainey street but with that being said it's still a great location in Austin downtown."
5,Y'ALL WILL LOVE IT!,"If you are the stuffy type, do not stay here....this is a fun hotel that celebrates the culture of Austin with plenty of live music and a young crowd. The hotel is located near many bars and restaurants as well as the walk/biking/walking trail that runs along the lake (which I highly recommend) is a fantastic way to enjoy the city. You can also rent paddle boards, kayaks, etc nearby.The staff are A+ on service in every way....really going out of their way to make your stay as enjoyable as possible.Our room was fantastic with floor to ceiling windows that looked over the lake and city. I definitely recommend a room on a higher floor with a water view....it is worth the extra money. As always with Kimpton properties, the bed & linens were SO comfortable.One of the perks staying at a Kimpton property is the free happy hour each day from 5 to 6pm. It is a great way to mingle with other guests and relax before going out for the evening. The complimentary tea & coffee service (plus hot chocolate & fixings) is also really nice in the mornings.This is the first time I have stayed at this Kimpton and was very impressed....we can't wait to come back! Hopefully we will se y'all soon."
