rating,title,review
4,Modern Comfort & Southern Charm,"The whole room, including the bathroom, was very clean. The decor was tasteful and comfortable and should appeal to a wide audience. All of the staff I encountered were friendly and personable. The mini bar was jam packed with just about anything you could want, but the downside to that was there really wasn't room for the few small items I brought with me that I wanted to keep cold. My only real complaint was the amount of time I had to wait every time I needed the elevator. Despite 3 elevators for 16 floors, it appeared that only 2 were ever running, and I don't think I ever waited less than 5 minutes. Not terrible, but when you are trying to get to business meetings, it adds an unnecessary layer of stress. That said, I would go back to this hotel next time I have a trip to Austin. Especially a leisure trip."
4,"Great location, comfortable and fun","This hotel is well placed to walk around the music/bar district as well as downtown, convention center, along the river. It has a comfortable, roomy ambience and offers extras, like the use of bikes and a free cocktail hour."
4,"Perfectly appointed hip hotel, but a little loud","Hotel Van Zandt is super cool. The room was incredibly comfortable, clean and the aesthetic was hip but comfortable. I do think the hotel is a little crowded and really more for young-ish people without kids. Big party scene by the pool in the afternoon, but fun and the hotel security made sure to keep it fun, but not overly crazy. Food was good, the hamburger we got was AMAZING!! Drinks were also good and when we got one that wasn't, they switched it out no questions asked!! Staff super friendly and nice. I would just say that this hotel is suited for people who are looking for a fun and raucous weekend vs. mellow, family time. I was there for a girls weekend, so it suited us perfectly!! The HH is the best deal in town!! Free drinks from 5-6!!"
3,Too cool for school,This is a leisure hotel and not set up with the business traveller in mind. The Reception staff were helpful but haughty. The concierge staff failed to deliver on numerous occasions and had to be followed up continuously. Breakfast was suitable for those with plenty of time looking for a weekend brunch not for a busy business traveler in a hurry. The room service was hit and miss. The lifts took forever. Resting on its laurels with an arrogant attitude rather than a customer service focus.
2,Expected More - Crowded and Hot,"The hotel, overall, was nice but just wasn't able to justify the cost. The bike that were supposed to be in the lobby were always checked out so we never got to enjoy that amenity. The room never cooled down to a comfortable sleeping temperate (both my wife and I were sweating at night). You would think that this hotel knows what Texas summers are like and would invest in better in-room air conditioning.One of the most upsetting parts of the stay is how crowded and unavailable the pool is. We went stayed here mostly due to how nice the pool looked in pictures, and while beautiful, it was constantly crowded to the point where we were unable to get seats.For $270 per night, you would expect more from a hotel. If the hotel is able to straighten these issues out, we would definitely love to return. I am unsure if we stayed during an extremely busy time which would explain the lack of bikes and crowded pool. The AC unit may have been a fluke as well which I am inclined to believe due to the number of great reviews but it just definitely what we expected.Hopefully, we can give it another try and get to enjoy all the amenities."
4,Kids Away Allows Parents to Play,"We are Austinites but rarely get to enjoy our own city so we thought a 3 day staycation was in order to reconnect with our beloved city. HVZ is a great hotel for the price. By comparison, our neighbors joined in on the staycation fun; however, stayed at the Fairmont, which was the same price. If we wouldn't have spent time at the Fairmont, I would've given HVZ five stars. I can relate to some of the other reviews that felt like 40+ might find Fairmont more to their liking, while 40 and under might better enjoy HVZ. Dings on HVZ for me were the dark color tones, no coffee machine in the room and slower than expected turnaround on the request for extra pillows. To start, front door service and hotel staff were amazing at HVZ. A local beer was offered at checkin, which was a nice touch. The color tones of our room were darker, more muted than Fairmont, which are super bright blue and white. We did not have a coffee maker in our room which was disappointing but they have a great breakfast place downstairs. The pool is small at HVZ compared to Fairmont and a lot of chairs are still in the shade until noon-ish. The shampoo, conditioner and body wash are all amazing and smell great. My wife loves them pillows so she called the front desk to request a couple more. It took almost an hour to get the pillows, a bit longer than we expected. My wife said she slept great though. We spent most of the days and nights away from the hotel hitting the bars, museums and eateries. If you are reading this eat dinner at Emmer and Rye, a new favorite. Check out went as smooth as check in and the front house gang is amazing. Holding doors, flagging down rides, getting us loaded and situated for our 17 minute ride back home ;-). Great experience."
5,"Hip, friendly hotel in fabulous neighborhood","This hotel has it all. Friendly, helpful staff, wonderful, hip ambiance - near everything Austin has to offer. The rooms are spacious, clean and modern. The pool, bar and restaurant are welcoming and fun to hang out at. They have a social hour everyday from 5-6 that puts everyone in a great mood (free wine and specialty cocktail of the day). The lobby space is a great place to enjoy a drink, read a book, meet up with friends or enjoy great music. Cafe 605 is a great spot to enjoy coffee, breakfast or afternoon snacks. Love, love, love this hotel!"
5,One Night Stand,"I had a free hotel night I had to use or lose so, I chose to stay at the Van Zandt. The customer service was what I expected out of a hotel the class of Van Zandt. As others have stated it's a good location with Rainey St. and the lake right there."
5,Hip Hotel,"Drove up from Houston for a weekend get away with the family. Arrived in Austin early and called to see if we could check in early. Much to our surprise, not only was a room available but they upgraded us to a Studio Spa room. Thank you Autumn! The staff is very helpful and attentive. The pool had a good vibe and the food was flavorful. The room had two queen beds, a sleeper sofa and two televisions. The bathroom was large with a walk in shower and a large soaking tub. The Social Happy Hour was a great event where we met many hotel guest and their pets. Rainey street is bustling with food, drinks, music and people. The only downside is the overnight parking fee, but do not let that stop you from staying at this hip hotel. If you want to make up for the parking fee, take advantage of the social happy hour where drinks are free for one hour!!!!Cheers!!"
5,Lady Bird Views!,"We had a great stay at the Van Zandt for a short summer get away. Our room was amazing with beautiful views of Lady Bird Lake. We had a very large spa tub, which was fabulous!The pool gets very crowded since it is not very large. The gym is nice and has a lot of equipment. Room service food is just okay. This hotel is geared towards a younger crowd. Rainey street is right next to the hotel. We did get an amazing kids welcome gift and my daughter had a blast. Had nice walks to Lady Bird Lake. Customer service was superb! A+"
5,Excellent hotel in Austin,"Location is great; close enough to walk to food, entertainment, the lake. Great pool, but we learned we had to get there early to make sure we got a seat. Room was very comfortable and had everything we needed. Customer service was excellent. The 605 was convenient for coffee, breakfast, snacks. Loved the fruit-infused water available at the 605 and lobby. Great happy hour. Highly recommended."
5,True Austin style weekend getaway!,"Great Austin Texas style hotel. Beautiful pool area and outside bar Hotel staff is amazing and will go out of their way to make sure you are enjoying everything about your stay. Dog friendly and if you let them know in advance, they will have everything you need for your pet waiting for you in your room."
5,"the good, the loud and a suggestion",Overall this hotel is excellent. The vibe is definitely young and seems many young party groups come to this hotel since it is literally around the block from Rainey(sp?) and all the bars. We have a son that just moved to Austin and had a nice weekend visit. Our suite was furnished well. Nice fruit basket greeting The staff is exceptional. Everyone we came in contact with was professional and ready to help. When I received a text asking about how visit was going I expressed concern about noise the night before. Music from Rainey will last until 2am. They quickly offered to move us higher or give us a white noise machine. We used the machine. Suggestion: Why don't you have a noise machine in each lower floor room. The only complaints this hotel receives is the noise at night. We slept perfectly the second night ....Machine was great:) We used the cafe/ restaurant and gym....all excellent Bottom line : This hotel is really good.....just be prepared to deal with the noise and all will be perfect
5,"Beautiful hotel, welcoming and professional staff!","This was my second stay at this hotel and it has quickly become one of my favorites when in Austin. The staff is friendly, professional and very helpful. They are service oriented and made sure my stay was a great one! The rooms are clean and well laid out. Very accommodating for getting some work done, or simply relaxing. I look forward to my next visit."
4,"Beautiful, great location if under 40","The hotel was clean, beautiful and the staff were very helpful and well-mannered. We had brunch at Geraldine’s restaurant. It was excellent. However, the location a block of Rainey Street means this is a hotel that caters to a younger crowd. The food and social scene is focused on the under 30 crowd and those who still think they are. If you are over 60, it’s the difference between being a Phish fan instead of a Greatful Dead fan. Same idea, different generation. 5 Star if under 40, 4 Star if over 60."
5,First rate!,"We had an exceptional time. The hotel aims to be unique and it did not disappoint, from the bell person unis, to the cafe, the restaurant and the pool. The staff is well informed and very helpful.We would definitely return and highly recommend choosing this hotel. Great location as well."
5,Fantastic staff,My family stayed here for 4 nights during a family wedding nearby. The staff was amazing. From the doorman running over with cold water after returning from a scootering outing to the front staff sending me a margarita to my room because I just missed happy hour...the staff goes out of their way to make you feel like you are on vacation. The hotel is beautiful and modern. The hotel is steps away from all of the restaurants and bars on Rainey st. The hotel's restaurant serves delicious food and also has a great charming staff. My only complaint is that only free coffee/tea is available in the am...no food items. They do have a small cafe on property but when in a rush it would have been great just to grab a muffin and go and not have to wait on a line to buy something. We also had a minor issue with towels/housekeeping but the front desk took care of the issue quickly. All in all..a great experience.
5,Really nice,"We had a great time at this really nice hotel, we loved the hotel lobby, alive with energy and the free happy hour with a live dj and spinning vinyl records. Had fun at the pool which had a lot of fun people, this is a great location for people watching and walking to Rainey Street"
5,"Great Stay, everything you need","Pool was nice, although got very crowded and seats were taken quickly. The restaurant was great and live music at the bar. The location to Rainey street was perfect. Rooms were big and clean. Would stay again."
5,Amazing customer service!,"My 21 year old daughter and I just checked out after a 3 day stay. The hotel is very nice but I can’t say enough about the great customer service from valet out front, to waitresses and front desk staff. We will definitely stay again."
1,Inexcusable!,"I had a reservation to stay at the Van Zandt for one evening for work travel. When I arrived at about 10:30pm, the front desk manager told me that they were ""over sold"" and had no rooms available for me (despite my reservation! I know this is not his fault - it is an operations issue that someone at Kimpton needs to fix). I travel almost every week, and this has never happened to me. While accommodation was made for me to stay down the street at another hotel, this should never have happened. Why the hotel could not have notified me a few days in advance (or even a few hours!), I don't understand. For what it's worth, I had just started to add Kimpton to my rotation, but will no longer stay at their properties. Very stressful start to my trip."
5,Wonderful property. .great location,First class hotel with great amenities. Roof top pool bar with an amazing view of Austin. Don't miss the sunsets. Staff was very attentive. The hotel is located next to a trendy area full of small bars and restaurants. Many places are cigar friendly. The hotel has a coffee bar that makes a very nice cappuccino.
2,Horrible Reservation Management,"Beautiful property with terrible reservation management. The hotel sent me an email confirmation for 6/17/18 to 6/21/18. They kicked me out on 6/19/18 since their reservation had that checkout date. When I showed them the confirmation email which came from their email domain, they offered no apology, consolation or compensation. Instead, they just blamed the hotel that sent them the overflow reservation, billed my card and sent me on my way. At they very least, if they were using different resrvation information, they should have sent me an updated, corrected confirmation. Instead, I received a text message on 6/19/18 while working the trade show floor for my event indicating their surprise that my bags were still in their room. Well, imagine my surprise! At any rate, I won't be staying with them again. No matter how nice the hotel might be, if your reservation system can't be trusted, no thanks! Too many other things to deal with on business trips. Get it together!"
5,Trendy but great hotel,"While I didn't feel like I fit in with the ""vibe"" of the hotel (its a bit hipster), I enjoyed my stay. The staff (front desk, valet, others) were very helpful and friendly. The room was clean and comfortable. The pool was very small, more for sunning than swimming (again, hipster). THe hotel allows pets and we saw many dogs during our stay.We stayed in a regular king room and our shower didn't have a door (which is standard). My only request would be that they would put a shower door on as it can get drafty in the shower.I loved the text service. Rather than calling the front desk, I could text the hotel for any questions and get our car out of valet. Responses were always sent within a couple minutes.It was a little pricey for me (we were here for my sister's bachelorette party), but overall I really enjoyed my stay."
4,Van Zandt,"Very nice hotel. Service, cleanliness and appearance of hotel were very nice. A bit pricey, but overall I enjoyed my stay. The pool is very small but we didnt spend much time there. Geraldine's has some unique food and drink options."
5,Amazing view,"WE upgraded for a corner suite, but then decided that the view was not to our taste. We switched to the river view and couldn't have been happier. The room was amazing. Quiet, and comfortable. We prefer Kimpton Hotels just because it ads a little bit of a home feeling. You walk out of the hotel and you are in the middle of one of the best party destinations. Rainey St. This is a sleeping giant that comes awake at night. Only one bar was open. Bangers and it was packed. When the sun goes down, watch out...This place rocked!"
5,We will be back!!!,They offered us beer or water upon arrival and it only got better! The rooms were nice and they will bring you anything you might need or forgot! Robes in every room and great walk in showers! The social hour was nice and the music was a treat! They sent me a text to make sure everything was fine and the entire staff was eager to please. The gym was small but had good equipment— needs to have some sanitizer and towels to wipe things down but that was the only negative. Pool area was nice in the evening and the bar stayed open late! A pleasant experience from check in through check out!!
1,Terrible Customer Service,"My husband and I stayed at the Van Zandt recently. While it's a nice hotel, with friendly staff, we were alarmed to find that after check out we were charged $165 for a blue tooth speaker that they claimed had been removed from the room by us. We explained that we were unaware there was a speaker in the room and certainly didn't remove it from the room. The hotel staff told us that the matter would be referred to their housekeeping staff. We contacted the corporate office to voice our displeasure at being accused of stealing from the hotel and received a reply stating that the matter would be referred back to the hotel management.if you're going to stay at this hotel, do yourself a favor and insist on having a staff member sign off on each of the room amenities when checking in and again when checking out. Or better yet, stay somewhere else when visiting Austin TX!"
4,Neat Place!,"Decided to do a last minute trip to Austin for the weekend to celebrate my husbands bday 6/8 and mine 6/9. Overall, I give this hotel a 4.5.Pros:* Great location next to Rainey street which is filled with really neat bars and food trucks.* Comfortable Beds* Very dog friendly (even gave us a toy, poop bags and some treats upon check in)... and all the staff just love the pups!* Valet guys are super nice* Great breakfast tacos at the downstairs restaurant* Ordered room service one night and it was very good... especially the french fries.Cons:* Shower is odd.. the water goes everywhere* For $375 a night ... would think the room would have been nicer. Wouldn’t say it was at a 5 star level* They serve coffee for free everyone morning, which is great, but they were out of milk and creamer and I waited for over 20 min and he still didn’t bring it so I just went to the restaurant & bought it* We weren’t a fan of the hotel restaurant Geraldines.Here’s what won us over. When my husband booked the hotel, they told him we would have free breakfast however once we got there, they said that wasn’t true. Not a huge deal because we aren’t big breakfast people anyways, but still. We left for the day and when we came back to our room, there was fruit, juice and 2 breakfast bars with a very sweet note saying apologies for the miscommunication. That was SO SWEET and I love any hotel that goes the extra effort to apologize and shows that they truly care.I would definitely stay here again. Great job Kimpton Van Zandt!"
5,Incredible place and incredible service!,"Not only is the hotel itself fantastic - huge and stylish rooms, lovely entry, but the staff go above and beyond to cater to your every need. They have complimentary coffee in the mornings and happy hour in the evenings. Everyone is so friendly and helpful, the doormen will literally run to the doors to open them for you (even in 100 degree heat!), the concierge is always happy to help, and the bar tenders at the pool are great fun. Truly a fabulous hotel - cannot recommend it enough."
4,Solid property located near bike path and good food options,"We were able to pay a little extra to upgrade to a higher floor with a view to the lake, and enjoyed the pool and adjacent bar area one afternoon. The hotel has bikes available, and we used them to ride to the LBJ Library and to the nearby bike path along the lake."
5,Awesome,"This was the second time I stayed at the Hotel Van Zandt and everything about it was wonderful - the atmosphere, the food, the service and the location. I can't say enough about it - the walkability in the area to restaurants and musical venues is very appealing."
5,Mix of authentic Austin and downtown luxury,"One of the nicest hotels I've stayed in, especially for a business trip! Since I was in town for work, I needed some business amenities. My room was the perfect mix of business meets relaxation - the staff brought me everything I needed (including a coffee machine at 5 a.m. as the rooms do not come with them!).I slept great, had fast internet access and really enjoyed the room. LOVE the proximity to Rainey Street (literally a block away) where I could explore new bars and restaurants on my nights off. I also really enjoyed the pool (arrived on Sunday) - fantastic service from the food to the delicious Mezcal cocktails! My co-workers were pretty envious; will definitely stay here my next time in town!"
3,Poor customer service,"We stayed at the Van Zandt to celebrate a birthday over Memorial Day weekend. I have to say, the biggest disappointment was the poor customer service. It started at check-in and continued throughout our 3 day stay to check-out. There was a lack of communication, inconsistent communication, and no sense or urgency. All things you would not expect from such a beautiful and high end hotel. I have worked in the customer service industry for close to 20 years and that's the one thing alone that drives why I stay at certain hotels, eat at specific restaurants, and where I choose to spend my money. The choice was to stay at the Van Zandt or across the street at The Fairmont. The Fairmont has always been consistent in the level of service and quality of the property/amenities. I thought the Van Zandt would be comparable. It was not and caused a lot of unanticipated stress during our stay. I can't help to wonder how much better our first time visit to Austin would've been if we had a better experience with our hotel. Again, the property is beautiful, but their customer service is not to par. We thought we'd get for what we paid for, but we didn't. Almost every different person we spoke to at the front desk had a different answer to the same question and/issue. It was very frustrating and even more that it didn't even help to speak to a manager. I expect for a manger's role to be accommodating and help find resolutions. Not the case here."
5,Awesome Experience with the Pups,"My husband and I stayed for 2 nights with our 2 dogs over memorial weekend. We booked a standard King and when we arrived they were sold out of our room and upgraded us to a Lakeview Corner Suite on the 15th Floor. The room was plenty big and we had a view of Rainey Street on one side and a view of the Lake and South Congress bridge on the other. Our dogs were treated like queens. Upon arrival they gave us dog treats for the both of them. It was also social hour and we were offered a drink of our choice as well.A few things to note...customer service is exceptional. Thank you to all the hard working employees that made our stay great.We do wish we could have enjoyed the pool more during our stay but the hotel was at full capacity and people did that thing of placing a towel on lounge chairs early in the morning and then not arriving to the pool until after 2pm. So chairs sat empty for hours when we could have been using them. To me that’s unacceptable.The hotel is a very busy one, especially being close to Rainey. Just know that going in if you are bringing children or dogs that are not social.Overall fun experience and a good place to stay the night to experience Austin."
5,"No questions asked, best hotel to stay at! Location, customer service, hotel atmosphere, everything was wonderful!","During our one night stay, we were able to stop by the pool twice, which is very nice and had an awesome waitress named Morgan! She was super helpful w/ night-life suggestions and cool things to check out around town so make sure to ask for her!We were only staying one night before moving into an Airbnb for a bachelorette weekend and a gentlemen working at the front desk by the name of Adam, so graciously sent us a couple bottles of complimentary champagne, flowers and a sweet note. It made our day!! Overall, the experience was wonderful and I will definitely be back!"
