rating,title,review
5,The best all-around hotel in Austin. Period.,"Austin's seen a veritable explosion of new hotels over the past decade, including plenty of boutique properties -- this after having basically only one player in town, the Hotel San Jose (and its Saint Cecilia sister property), with the market essentially to itself for nearly 15 years. Since 2008, however, Austin's hotel boom has brought every major player in the field into its arena, ranging from ""boutique-style corporate"" (e.g. its first W Hotel) to a slew of indie offerings. To put it another way, the Hotel Van Zandt has a ton of competition -- and over the years I've stayed at nearly all of them -- but nonetheless lands at the top of the pack, in my view: it's the best all-around hotel in Austin.My most recent stay there only further reminded me how superior the Van Zandt is to its competition in nearly every tangible way -- which, I have to admit, came as a surprise: the Kimpton chain, long viewed as one of the best all-around, fully merged its Karma rewards program into that of its parent company, IHG, just over a year ago. Plenty of Kimpton fans, myself included, worried that this integration would result in a deterioration of the service quality for which Kimpton is renowned. I'm happy to report that no such problems have occurred at the Van Zandt -- in notably stark contrast to IHG's other downtown Austin four-star property, the InterContinental Stephen F. Austin, where I also stayed recently. The only chain of size in the U.S. that tops it is the Four Seasons -- though I should certainly hope so, considering Four Seasons hotels are typically the most expensive in any given market. (Rooms at the Four Seasons Austin are usually more than twice the price of the Van Zandt's.)Kimpton is famous for its bold interior looks -- all of which vary depending on the property and the city in which it's located -- and the Van Zandt is no exception; if anything, Kimpton went much bigger and bolder than usual in crafting the Van Zandt's look. To be fair, this isn't a hotel for fans of traditional interiors: its look is unabashedly modern, embracing a mix of industrial and high-end '60s-era vintage design (along with some surprisingly strong new design elements, including the likes of Roll & Hill light fixtures). Its massive lobby and ground-floor public areas, replete with numerous visitor-friendly seating areas for groups both large and small, brings New York's Ace Hotel to mind (and that's entirely a compliment) -- most notably in its extensive use of black, a color (or, more accurately, a non-color) that's extremely difficult to get right, but also its seeming vastness.Upon arrival for my most recent stay, I was warmly greeted despite having booked a last-minute ""staycation"" via Hotwire at a substantial discount (during Austin's low season). As a former professional hotel critic (and, more recently, a mere unusually frequent traveler), I've seen firsthand how surprisingly frequently certain properties treat guests who've booked their stays on the likes of Hotwire and Hotel Tonight as de facto second-class citizens; that's decidedly not the case here. A new forward-thinking innovation added since my last stay was the ability to reach the hotel's concierge via text: this is one of those ""why hasn't anyone else thought of it?"" ideas that's both savvy and effective. (They also texted me several times during my stay to inquire how it was going and whether I needed assistance with anything, a very welcome gesture.)The Van Zandt's rooms vary somewhat in size, but all of them incorporate design cues such as bronzed fixtures -- which have since become de rigueur in both hotel and contemporary home design -- and ridiculously comfortable beds replete with top-of-the-line pillows and luxury linens. Its larger ones feature Duravit-style standalone bathtubs, many of which offer jaw-dropping views of downtown Austin and Lady Bird Lake. (Speaking of which, I'd strongly recommend getting a lakeview room if possible. Here, too, the Van Zandt is unparalleled in contrast to nearly every other downtown Austin hotel.)I'm also not generally a fan of four-star hotels that don't have some sort of coffeemaker in their guest rooms, but the Van Zandt -- similar to other Kimpton properties -- does one better: it offers a complimentary coffee bar setup in its lobby. And in terms of going the extra mile, it has ample copies of The New York Times available for complimentary guest use as well -- including the Sunday Times, which costs $7 a pop outside the NYC area. This is precisely the type of much-appreciated-but-not-a-necessity amenity that's been largely eliminated by the corporate bean counters at major chains, and the fact that Kimpton continues to offer it -- despite being acquired nearly five years ago by one of the largest hotel holding companies in North America -- speaks volumes about its service caliber all-around.As a native Austinite, I can't help but appreciate the ""local touches"" incorporated into the Van Zandt -- starting with its namesake Townes Van Zandt, one of Austin's most legendary musical icons. Its lobby cafe also features breakfast tacos from Tacodeli, a local mini-chain that makes some of the best in town; the hotel doesn't substantially mark up their prices, either. (Just FYI, the cafe is where to go if you prefer espresso or lattes over the lobby's free drip coffee.) Similarly, during Kimpton's traditional ""wine hour"" each afternoon, the Van Zandt offers Austin's ""unofficial official drink"" -- frozen margaritas -- in addition.Finally, its location is one of the best in town: smack-dab in the middle of Austin's Rainey St area, which features one of its most lively nightlife scenes. It's also within easy walking distance of the convention center, and at least easy scooter distance from Sixth Street and the rest of downtown Austin. As is now typical in most larger American cities, inexpensive dockless scooters from the likes of Bird and Lime are ubiquitous and nearly always available nearby for a $1/hour rental fee -- and if you prefer two-wheeled transportation of the non-motorized variety, the Van Zandt also has complimentary bicycles available for rides along Austin's nearby hike-and-bike trail around Lady Bird (née Town) Lake, one of the city's best natural features.To be fair, the Van Zandt isn't totally perfect, though none of its flaws are even vaguely consequential enough to dissuade one from staying there, in my view. The hotel's east-facing side offers a view of ... well, mainly a high-traffic freeway. It features live bands downstairs many nights, which is great if you're a fan but less so if you're a light sleeper with a room on a lower floor. (The bands' bass reverberates upwards.) Weekend brunches at Geraldine's, the hotel's primary restaurant, are great, but they're also increasingly popular, so even as a hotel guest you may have to wait for a table if you don't have a reservation. (OTOH you can always grab a bite at its informal lobby cafe instead.) While its windows are insulated enough to muffle most of the surrounding area's noise, that's sometimes not the case when a band happens to be playing outdoors at an immediately adjacent bar on Rainey. Also, its insulation between rooms isn't terrible but also not perfect: during my most recent stay I could audibly here an ""amorous"" couple in the room next door. (Though they were admittedly exceptionally loud...) NB: Noise problems at many of the Van Zandt's downtown competitors -- most notably the Driskill, The Line, the Stephen F. and Westin -- are worse by a considerable margin.Like nearly all of downtown's hotels, its parking charges are a steep $40 or so per night. (Unless you're driving into Austin, I'd recommend getting around via Lyft or Uber instead.) The surrounding Rainey St. area's popularity also has its negatives, in particular the aforementioned noise issues as well as trying to merely get there via car on weekends (and event periods such as SXSW are pretty much a hot mess in that regard). Finally, its elevated pool deck is shared with an adjacent condo tower, and while it features a lively bar and excellent downtown & lake views, its chaises are limited in number (if only because the pool deck's inherent size constraints) and fill up quickly on warm-weather days, especially springtime weekends. (Also, its liveliness includes a fair amount of noise, which can be readily heard in rooms on lower floors directly facing the pool deck.) And again, this is not a place for fans of traditional design; if you prefer brightly lit ""cheerful"" looks and primary color palettes, you'd probably be happier at the new Fairmont two blocks north.But still: even given its flaws -- most of which can be avoided by requesting a room on a high floor -- the Van Zandt remains in a league of its own. It's not my favorite Austin hotel -- the Saint Cecilia wins my vote there, but it's considerably smaller and pricier, and thus lacks many of the features seen in larger properties -- but it's nonetheless the best on an all-around basis, in my opinion."
5,"Great service, location, and style","Arrived late morning so room wasn't ready (check in 4 PM) - front desk took my mobile to text me when room was ready (2PM!). Not sure why but got upgraded to corner suite on upper floor. Maybe because it was my wife's birthday? Anyway, we were pleasantly surprised to find a bottle of champagne with 2 flutes and 2 birthday cupcakes in our room. Nice touch. Nicely furnished rooms with bluetooth speaker for your phone. Ample closet and drawer space. Bonus yoga mat and umbrella in closet. Front desk would text daily to check up to see how stay was coming along. Took advantage of the following hotel amenities: 1) in room massage with $30 credit for IHG members, 2) morning coffee/tea service in lobby, 3) social hour (5-6PM) wine/daily cocktail/beer 4) 24 hr fitness center, 5) tasty dinner at their restaurant Geraldine's with free musical performance at 10:30. Didn't get a chance to use the free bicycle or their pool as the weather was suboptimal (highs in the 40s and wintery mix) but we'll be sure to use them next visit when it's warmer - because why would we want to stay anywhere else next time we're in Austin?!"
4,Decent.,"Decent room size. Neat & clean rooms & bathrooms.Amenities are not well explained during the check-in.For the price - they should include free coffee & breakfast.The study table did not have a chair, though there were 2 heavy chairs in the room, would expect a revolving movable chair by the study table,"
1,Terrible experience,"High price for an average experience , rooms are poor quality , the shower does not have a door so you will get everything wet , only one toilet paper for 3 people , no sleepers , insulation is poor so you can hear everything and finally I have to wait for 1 hour for breakfast because you need a reservation ( nobody told me that at front desk when I check in )"
5,"Easy, Pleasant Stay. High Five!","Great reception, beautiful lobby, happy hour drinks, clean, comfortable rooms, quiet hallways, awesome location.The coffee shop connected to the lobby makes AWESOME breakfast tacos.My only complaint was the price of parking. Will definitely stay here next time I'm in town."
5,Best Hotel in Austin,"The Hotel Van Zandt offers everything you need for a great hotel stay. The location is fantastic—literally on the corner of Rainey St. close to lots of restaurants and entertainment. The lobby is so pleasing to the eye—unique decor, clean, and spacious. The rooms are good size, impeccably clean, and I love the full size bath products. We were a group of 4 women and having full size shampoo and body wash made it so much easier than having to worry about how many mini bottles we had. The restaurant Geraldine’s was pricey but had a great vibe, the workout room had the greatest photo mural on the wall (and the equipment was clean and plentiful too), and to top it off there was a nightly happy hour with free wine and margaritas! And coffee and tea bar in the mornings. My friends and I had a wonderful stay here. The staff was friendly and more than willing to store our luggage after checkout so we could explore a little more before our flight home. I love how they texted me when the room was ready at check in. We spent a lot of time in front of the beautiful fireplace sipping our coffee or wine, and the cafe off the lobby had great breakfast tacos and pastries, including gluten free banana bread! I will definitely stay here again when I come back to Austin."
5,Beautiful Hotel and Great Vibe,"I spent two nights at the Van Zandt for a conference and had a great experience! Check in was smooth with a very enthusiastic staffer. My room was decorated very nicely with tons of storage space, a few chairs and space to work. The bath had a spacious shower and separate area for the sink. We enjoyed the complimentary happy hour in the lobby. The buffet lunches during our meeting were very good."
5,Amazing valet,"Will was great! Hurried to open my door from the hotel to my car and immediately grabbed my bag to put into my car.. really appreciated the quality of the service.. I will be back for sure, thank you Will!!"
3,Great location,"The Kimpton is ideally located for restaurants and bars. Don't expect a quiet hotel. Wine hour is always very busy and a great perk! Comfortable room and bed. Bathroom was okay, could be updated. Restaurant for breakfast was good with some interesting options."
3,"Just ""ok""","My partner and I were celebrating our 3-year anniversary, so I decided to take advantage of my annual IHG Rewards free night and booked us at the Kimpton for a nice ""staycation"". Being that we live in Austin, we 100% knew what to expect when it came to the hotel's location, parking arrangements, proximity to everything, noise levels, etc. So this review is not based on any of those things. The hotel itself is nice, although not quite luxury. We stayed in a Spa King room, and the bathroom was beautiful as promised - although it would have been nice if the tub was big enough to fit two people. As for the bed, it was comfortable... but, we have a king sized bed at home - and unless I'm just crazy, this ""king"" was not actually king sized. Even still, I didn't knock off stars for any of that. I only knocked off stars for the negative aspects which were completely within the hotel staff's control and 100% due to human error.- After I made my reservation, I called to ask if I could have a late checkout so we could go have brunch Sunday morning. They said ""no problem"", as this is one of the perks of being an IHG Platinum member, and we arranged for a 1pm checkout. In this same call, I told them we would be celebrating our anniversary, and also that we would be bringing our dog with us - so we would need a dog bed and food/water bowls placed in the room. They said this was all confirmed (hint: it wasn't)- When I received my ""upcoming stay"" email a few days prior to the check in date, it did not indicate the 1pm late checkout. It did give an option to select some ""preferences"" via dropdown boxes, so I went ahead and selected ""Anniversary"" as the special occasion, and (again) indicated that I would be bringing a dog and would need a bed & food/water bowls.-Being that the late checkout wasn't indicated on the email, I called the hotel just to confirm. The person I spoke with said there was no record of a late checkout, or anniversary, or dog notated in my reservation. This was stressful, since I had arranged this twice now, both verbally and online. Thankfully, she was able to get it all changed.-When we arrived at the hotel and checked in, we were not offered a free beer or water. Not sure if they just don't do that anymore, but seems strange being that so many other reviewers have commented on it.-When we got into our room, there was no dog bed or food/water bowls. I had to call the front desk to ask for them... for a 3rd time (4th if you count the online form).-We were also given no information about how to connect to the free WiFi, which is another perk for being IHG Platinum members. We looked all over the room for something listed on a guide or whatever, but there was nothing. So I had to call the front desk again to ask for the WiFi information. I find it in poor service that this information was not given to us upon check in.-We took our dog out for a walk, went back to our room, and realized that the key didn't work (we had previously used the other 1 out of 2 keys to get in). I had to go all the way back down eight floors while my partner waited outside the room with our dog, trying to keep her from eating food off of the room service trays that were littering the hallway. When I got downstairs, the concierge asked for my ID. Of course, my ID was locked in my room. So I had to answer a series of questions instead, for security purposes - which I understand and appreciate, but would never have had to do if our room keys were activated properly to begin with.-Finally, after checkout - I noticed a $177.79 charge on my credit card. My room was free and we had no incidentals, so I had no idea what this was. I called the hotel, and they said it was a pre-authorization for incidentals, and would drop off in 3-5 business days. I'm fine with a pre-auth, but it would have been nice if someone told us explicitly what to expect so I didn't have to wonder and waste my time calling. When I had given the concierge my card upon check-in, I asked ""This is only for incidentals, right?"" ...he confirmed that it was, then swiped it, and had me sign. He never said anything about a pre-auth, though that would have been the obvious time to communicate this.All in all, this was a pleasant stay for a free night. However, I believe the regular price for the room we stayed in is around $450 + taxes and fees. If I had actually paid even half of that, then the service levels here would have left me feeling severely underwhelmed. I was kind of embarrassed that I had talked this hotel up to my partner as being ""one of the best hotels in town"", but then kept having to call to inquire about basic information and amenities.As for some of the positive things:- They sent us a bottle of wine and some fruit after (finally) acknowledging our special occasion / anniversary... so that was a nice touch. Even though the glass bowl the fruit was in had a big chip on the top, making it sharp.- There is a text concierge system that will text you to make sure your room is ok and ask if you need anything. Too bad I didn't get the first text until I had already called for everything I needed.So, yeah... it was ""meh"". Definitely not worth several hundred dollars, but worth it if you have a free rewards night to burn."
5,Wonderful Experience,"My wife and I were in Austin for the gubernatorial inauguration and chose to stay at the Kimpton. We are so glad we did! We were upgraded to a suite with a nice living area and a standalone tub in the bathroom.Soon after arriving, the manager sent us a bottle of wine and cheese spread to welcome us and to help us celebrate the big day. It was a wonderful touch and made for a wonderful evening.We had drinks at the hotel bar and enjoyed it. Work routinely takes me to Austin and I will make an effort to always stay at the Kimpton. It is a great place to stay."
2,Not a luxury hotel,"Not my first time in the hotel - I had previously visited the restaurant and bar. But this was my first and last time to stay overnight. This is maybe the loudest hotel I have ever stayed in anywhere except a Polish hotel over a bar. But even this won. Here are the positives and negatives:The lobby is pretty cool. Very hip and masculine looking. Staff was friendly but could be more conversational. It's dog friendly - we saw four of them in the lobby at once. The hallways upstairs however seemed to be decorated for Halloween - extremely dark and not attractive in my opinion. The location is good if you are going to be at the convention center or just hanging out on Raney Street. If not, it's an average location at the edge of downtown.The rooms are just very average and have some problems. The walls are paper thin and you'll definitely hear your neighbor. The bathroom sink area has no door so the light shines into the room if someone goes in. The toilet and shower area have a sliding pocket door that is very heavy and difficult to close. The shower has no door, just a half glass wall. The shower is not long enough for this feature so the floor in the toilet area gets very wet. Also, the drywall gets splashed and they no doubt have had mold issues because that wall had evidence of being plastered and repainted more than once. And the painters didn't bother to cut in the paint along the door jam so just slopped it over. Bad workmanship in what is supposed to be a luxury hotel.A couple of other little things that are annoying. A small bottle of water on your nightstand has a price on the cap saying $5. The larger bottle is $8. No, this is not some special water, just something that cost them ten cents but they want to gouge me for $5. And wifi is not free.Add all that to the noise issues (dogs barking, bands til late hours) and this is just not a place you'll want to stay if you intend to sleep. Go across the street to the Fairmont or over to the JW. Or if you are hell-bent on staying on Raney Street then go to the Homewood Suites and get a room that is probably nicer.One final tip - if you just have to stay at the Van Zandt then whatever you do get the highest floor possible. Floors 5 - 7 are very loud, especially the ones overlooking the pool or Raney. The band in the hotel bar plays til midnight and if you are on the lower floors you will feel the bass drum in your bed and get to hear the singer."
4,Classic Kimpton Flair and Hospitality!,"This is a fantastic hotel and really epitomizes everything I love about Kimpton Hotels. Centrally located, funky design, wonderful, helpful staff and comfortable rooms. I had a few glitches but all was handled beautifully by Dylan P. An amzing and thoughtful staff member. The lobby is so comfortable, especially during the wine hour and here there were also house-made margaritas! Rooms are clean and well-appointed, WiFi is quick and simple to access, especially if you are an IHG member. My only complaint is the noise, if you are facing Rainey Street.The hotel did move me to quieter room, but ask for one when you check in, those Austin folk know how to make music! I would absolutely stay here again!"
5,Great Stay,"Any arrival when you get offered free local craft beer at reception is going to start me off with a positive experience and it didn’t stop there. A text from reception when entering the room checking your satisfaction was intuitive and showed they care about your happiness, another text the following day reinforced this sentiment. The rooms are very nicely designed,, bathrooms are not overly luxurious in comparison to there rest of the room but the amenities were of excellent quality. The minibar selection is excellent. The main restaurant is worth the visit alone and a serious destination restaurant that must be experienced when in Austin. Loads of interesting street food/food trucks right around the corner is another great option for dining in this great hotel. Comp margaritas at 5pm in the stunning lobby is another great touch that really does build Good will with there guests. Well done Kimpton, cool brand"
1,DO NOT STAY HERE UNLESS YOU WANT YOUR VALUABLES STOLEN OUT OF YOUR ROOM.,"DO NOT STAY HERE UNLESS YOU WANT YOUR VALUABLES STOLEN OUT OF YOUR ROOM.Stayed here one night. Checked in hotel with my wallet and went home without it. Woke up (in room 1101) and went to meeting inside the hotel at restaurant on the 4th floor. Put my wallet in nightstand draw in the morning before leaving the room. After meeting went back to my room and room key didn't work anymore because they checked me out of my room (granted it was 1pm). Went to lobby to get new key and they had the bellboy take me upstairs to let me in. Opened the draw next to the bed where I left my wallet and the wallet was gone along with my Drivers License, ALL my credit cards, and $1200 cash. The ""Director of Loss Prevention"", Phillip Englishbee told me there is nothing he can do because its my word against hers (the lady who cleaned the room). He also patronized me and told me about how he thought I was going to find my wallet in my luggage when I got home, like it miraculously jumped from the draw to my luggage… well I guess what, it didn't. So I checked in hotel with my wallet and had to leave this hotel and Austin without it and the lady who stole it still works there.If employees at this hotel know that is the policy all they have to do is say they didn't do it, its basically a green light to steal anything they want from your room.DO NOT STAY HERE."
5,A lovely stay!,"We loved our stay at the Van Zandt! From the incredibly friendly and helpful staff to the great food at Geraldine's to the rooms themselves, we cannot say enough good things, and will definitely make this our first choice in Austin.As other reviewers have said, it is possible to hear the nightly live music from the hotel restaurant even on higher floors, but it's not something we found bothersome - you really had to be listening to hear it. The comfort of the room more than made up for it, with a generous amount of space, huge closets, and firm yet squashy beds. It's also just around the corner from Rainey Street and an easy walk over to the downtown area, which was a huge plus. If you're looking for a great hotel in a highly walkable neighborhood, I'd definitely recommend the Van Zandt!"
