rating,title,review
5,Trendy and comfy hotel,"Stayed here for a conference down the street at the Fairmont. I am glad I stayed here so I could have some down time from work while the Fairmont is just 3-minute walk away.The hotel is decorated with a music motif and the rooms are decent size despite being a boutique hotel. The property is kept very clean and new.The staff ranging from reception, concierge, bell desk and doormen were all extremely helpful and hospitable. My luggage was delayed and I also had packages arriving for me. Sean and Ray both ensured that they were promptly delivered to my room.I booked my stay through a hotels.com and my booking included breakfast. The hotel gave me a USD50 credit for food and beverage per day. I used it for breakfast or lunch on different days. I appreciated the flexibility.The food was also excellent. The restaurant was on the 4th floor.If I come to Austin again, I would certainly stay here again. There are plenty of restaurant choices about a 15-minute walk away at 6th Street and Congress, or it was a 5-10 minute walk from the convention center."
1,You won’t sleep,"We decided on this hotel as it was away from the rowdy part of town (6th street). We checked in after 20 hours of travelling, went out for a meal and were back in the hotel for an early night before a day of sight seeing the following day. We were on the 5th floor and at 10:30pm music started from the hotel bar below. The hotel provide earplugs in the bedside draw, however the room was vibrating as there was a rock band on and the drums were so loud and intense it made it impossible to sleep. I called and asked if music would be on the following night, and was told it wouldn’t be. This meant there was no need for me to ask to switch rooms. The following night after a day of sightseeing and drinks we were back in the room for 9pm due to a 7am start to get back on the road. At 9:30pm music started again, even though I had been told there would be no live music!!! We missed our alarm as we were so tired so were late leaving the following day. We paid a lot of money to stay at this hotel for 2 nights, expecting a quality experience and good sleep, it was a complete waste. They leave a note in your room to explain you’re in the “music capital of the world”! That might be true, but the noise from Rainey Street was no problem at all. However, if you charge the prices you charge, I suggest investing in sound proofing your bar! Let down for a Kimpton hotel. Would not recommend, you may as well stay closer to 6th street, you’d get a better sleep!One positive....Clarence one of the hotel door staff was absolutely fantastic. So helpful with directions and advice on the area, very interesting man and an asset to the hotel. Every hotel should have a Clarence!"
4,Fantastic stay for F1,"From the second we were warmly greeted at check-in by the fantastic Kara this stay was everything we had hoped and more.The hotel is modern and extremely well situated, right in the heart of bustling and youthful Rainey Street and a short 15 minute walk from the more traditional 6th Street.Internally Geraldine's on the 4th floor is chic, with a decent selection of drinks and excellent food - one night we couldn't decide what to have individually so we simply ordered one of everything and ate a la banquet.There is also live music every night in Geraldine's and I didn't hear a bad act in the 9 nights I stayed there.Happy Hour should last longer than 5-6pm daily is my only criticism, especially when the F1 is on and it's very difficult to get back from the race track in time.Great stay, I'll be backMike ScalesIHG Spire Ambassador Member"
5,Very trendy modern hotel,"This is a fantastic hotel for anyone who is young, trendy and looking to go out on Rainey street.It’s just behind Rainey’s many bars, clubs and restaurants, so if you are planning to party hard but then retreat to a luxurious and modern hotel at the end of the night - the Kimpton will be perfect for you!The lobby is very funky and on check in you can get a free watermelon cider - very hipster.But all staff is very friendly and efficient and our room was even ready early.We had some French champagne and chocolate strawberries waiting for us in our room as we were travelling for our anniversary - lovely touch!We also got upgraded to a river view room - very nice!The room was spacious, very clean and surprisingly quiet despite being just above the pool deck.They must have good sound proofing which is great if you have a room above Rainey street, especially on a weekend. (Live music everywhere!)The pool deck is the place to be, all the hot young people hang out there.Definitely not a place for older people, but we aren’t huge partiers and still really enjoyed it.Would definitely recommend this hotel."
3,"Trendy hotel, but tired room","We had pretty high expectations for such a well reviewed hotel of this class. First impressions of customer service, valet, and lobby were really great. Learned about an upgrade at check-in, which was very welcome, but the upper floor room seemed like it had barely survived a party and being my first Kimpton stay, was not a good representation of its advertised brand (see pics). It was a room with a great view, though!Walls were scuffed, lamp shades dented, stains on the curtains, and less than functional bathroom door. If this hadn’t been a rewards stay, I would have complained more vocally.The mattress was average, which we also found disappointing, for a hotel at this price point. I’ll admit, We’re spoiled at home with a very comfortable mattress so it’s rare to be impressed in this category.They did serve excellent coffee in the ground floor cafe, probably the most flavorful coffee I’ve had of any hotel stay.We also really appreciated the happy hour, where it was quite busy in a vibrant, comfortable atmosphere."
5,Great location,"Lovely, very large boutique hotel with a stellar location. The views from the upper floors are fabulous. The service from top to bottom also fabulous. The happy hour with free margaritas and wine a very nice touch. The cafe on first floor was GREAT. (Though it would have been nice to have free coffee in room.) A little pricey- but that's Austin for ya.The pillows and mattresses (bed comfort) A +."
5,"Location, Boutique & Beauty","Another area we must recommend when visiting Austin, TX is Rainey Street district. A little historic neighborhood with small houses that have been converted into mini bars and restaurants. Right in the heart of all of them is this magnificent hotel with incredible views, a fine bar and restaurant... but, overall a great Austin vibe clearly in the spirit of live music and entertainment. It has a rustic feel, but we assure you everything is modern and clean :)"
5,Wowza!,"My teen daughter and I were in Austin for the first time to see 'Hamilton' and stayed here on points. We arrived a little early and our room was ready, they upgraded us to a suite on a high floor without even asking! I was offered a local beer upon check in. The lobby is fabulous. We opened the door to the room and wow! Our room was facing the Fairmont and a construction site crane but the room itself was the view. One of the nicest rooms I have ever stayed in. We had a soaking tub and didn't have time to use it. The decor was a lovely blend of modern and antique, with leather furniture and even a yoga mat in the closet. Good sleeping, it was quiet. (We were probably the late to get back in noisy guests) If you need a wine opener, look no further than the drawer close to mini fridge. They thought of everything. This was our first Kimpton, hopefully not our last. They also gave us a late check out of 12:00 when we returned late from the show. Restaurant was really neat with friendly employees though food was pricey and not that great for breakfast. It was convenient, though. Doormen were awesome, friendly and funny. Such a great experience. Do this if you can!"
5,Stellar Hotel,"Sorry for the late review. Stayed here in the summer of 2019 and enjoy my first visit to Austin immensely. Kimpton Van Zandt is the perfect hotel and a cool and vibrant city. You’ll forget that you’re in Texas. The staff all around was very friendly and accommodating. Location is good, near a lot of food trucks and hip bars. Downtown Austin, proper, is a good walk or short bike/scooter ride away. I can’t wait to visit again, the pictures say it all!"
5,Unique Property,"Van Zandt has a unique location, close to a row of pop-up restaurants and bars. The hotel is modern and has a great vibe. The pool area is a popular spot and the second floor restaurant has live music, for breakfast too."
5,Anniversary weekend,"Such a wonderful and nice hotel. The staff is helpful, nice and accommodating. The entire hotel has the best decor, colors and tones. Walking distance to bars, restaurants and Austin's downtown. Love the views the comfortable beds and the food is outstanding."
5,Attentive Staff,"Nice hotel! The HVZ staff was very accommodating and attentive. Trish, our poolside server, did an excellent job taking care of our large group of 12 while we occupied the large cabana next to the pool! Alyssa was also very helpful coordinating a late check-out. The bar and restaurant is very nice and had live music over the weekend, which was a nice surprise. We enjoyed our stay!"
5,ACL Festival,Wonderful hotel with excellent service and amenities. On arrival Joe was very helpful in rearranging some rooms for me. The hotel is beautiful next to Rainey Street. Whoever designed the walk-in shower finally got it right by putting the shower head at one end and the shower turner on er or whatever u call it on the other so u don’t freeze or scald ur toolie off when getting in. Had a great stay.
5,Excellent weekend from location to staff to physical spaces,3 of us came on a girls trip in honor of 50th bdays. The hotel greeted us and embraced us - we loved being at the pool. the double queen corner room gave us great space. we loved coffee in the morning and happy hour at 5 all gratis. Location was walking to Rainey street and downtown restaurants also close to so co and the bat bridge. We loved closing out each night at Geraldines The vibe and bands were great better for our age group than the locations on Rainey (mostly)
2,Great location but greatly understaffed,"You defiantly can not be the location and the sunset by the pool is great, my main problem is it is greatly understaffed. I spent 5 nights here in September and while the staff tried there best to help us out they felt overworked cause its understaffed. The check in process was far too long and I ended up getting the wrong room that I booked. I finally got to my room and It was dirty. You pay a premium to stay here and the hallways are very dirty and stink, room service treys are left out for hours. Its also one of those places where it takes to long to get a drink at the pool bar and restaurant bar. I really wanted to like this place but I just won't be back the price and service don't match. Please hire more people"
4,"Hip vibe, great location","We stayed at the Hotel Van Zandt for two nights, with a room on the 13th floor facing the river, looking down at the pool. We enjoyed the experience. Friendly, competent staff, from the classic Austin gentleman greeting people at the front door to the front desk associate who checked us in and went to fetch us free drinks during happy hour. Great first impression! The hotel is well located next to Rainey Street and you can get to many attractions within 10 minutes. Don't rent a car -- use Uber/Lyft, it's cheaper and no stress. We enjoyed dining at Geraldine's twice, once with a large group for dinner (small plates, pretty expensive, adds up before you know it!) and the next morning for brunch with live music. The people staying there on this football weekend were diverse -- a sea of UT Austin T-shirts on people of all ages, plus two weddings. The coffee shop downstairs serves free coffee and decent breakfast tacos/muffins/yogurt (not free). The room was a bit on the small side and the bathroom barn door for the toilet was very heavy, hard to move. You can hear noise in the hallway and even noise in the pool area 13 flights down. So ask for a room on an upper floor, away from Rainey Street. We would go there again."
4,Great location!,"The hotel is located in the best spot for visiting Rainey Street. It is very nicely decorated. The pool, bar and restaurant are good. One big disappointment is NO in room coffee. I would rather have coffee than a mini bar. Parking is $45 plus a night."
5,Perfect Location for this Boutique Hotel,We stayed at the Van Zandt as part of a wedding party. Everyone was so incredibly friendly and helpful! I recommend a higher floor to get away from the noise of Rainey Street.The coffee shop in the lobby and the hotel restaurant (Geraldines) were wonderful! You'll find something to satisfy every taste.We hung out at the pool bar one night - one word of warning - the Verde Mule is VERY spicy! But it is a great vantage point for watching the Congress Avenue Bridge Bats!The bed was very comfortable and the room layout contained lots of drawer and closet space. Great views of downtown Austin from our room.You can walk everywhere and it was easy to get an Uber. We did not rent a car so I can't speak to parking.I would stay here again on another trip to Austin.
4,I’ll be Back,"Situated in a good location in downtown Austin the Dog friendly Kimpton Hotel offers plenty of ambience. The hotel is named after country singer Tommy Van Zandt and the lobby decor has a music theme with the stunning chandeliers shaped like musical horns. There is a turntable they spin LPs on during the happy hour in the lobby. From 5-6 guests are treated to wine, daiquiris and light apps, a Kimpton tradition.The service is excellent and you will periodically receive a text from a staff member inquiring about your stay. It was our anniversary and we received a bottle of sparkling wine along with chocolate covered strawberries...nice touch.The restaurant is good. We enjoyed the Sunday jazz brunch. The bar is nice, servers are both knowledgeable and friendly and the drink menu is creative. Almost forgot, live music most nights.The location is walkable to the action on 6th Street. Rainey Street is just a block over and filled with restaurants, bars, food trucks and live music. Many of the establishments there were previously homes now converted.The one downside to the hotel is noise. One of the bars on Rainey plays loud music which can be heard in some of the rooms. Also there is a building under construction which makes for a lot of noise. Not what I was expecting at 8:00 AM on a Saturday. Won’t be getting a room on the same side next time.Would have awarded 5 stars were it not for the noise."
4,Friendly en classy,This is a very nice Hotel. There's a lot of staff and they're all very friendly. The rooms are spacious and clean. It can be a bit noisy at night because of all the live music in Austin. The pool is beautiful and the overall impression of the hotel is hip and classy
3,Posh Venue; Parking and Traffic Control Awful,"Attended a fund raiser / non-profit event. Beautiful hotel. Modern, fresh design. That’s inside. Outside is a disaster. Long lines to park, long lines for Uber drop off and pick up, 25 minutes or more to get a car from the valet (according g to my wife, who drive and I took an Uber).And, as was true in the past at this event, food very meh; very ordinary tasting, although nice looking presentation.If you like glitz and glamour, you’ll like this place. Once you actually get there and get inside. Otherwise, go elsewhere in my opinion."
5,Awesome experience,"Amazing feel from the moment we checked in until we checked out. Top notch service and staff. Very accommodating. Gave me a quiet room as requested with earplugs. Attended a family wedding at the hotel and loved everything.. the Pool, the gym, the happy hour, everything."
5,An amazing quick weekend getaway,"I don't normally write reviews, actually its my first on trip advisor! I must first thank Pao at the front desk for accommodating us with all our needs as we were traveling with a new born and 5 year old kid! She got us a fridge for babymilk, a crib and upgraded our rooms as we are hyatt platinum card holders! We were welcome with drinks for happy hour which was a surprise, it felt like we were on a resort but it was in Austin! I know some parents complain of noise at night but I didnt hear much noise, I did hear a little music but I think that stop at 2AM. However, that did not disturb me and the family from sleeping. Also, I am from New York so, I am use to Noise! Breakfast was amazing! Must try and piano playing the background. The pool is amazing is as well! The only improvement is lowering the parking fee!"
5,Modern and beautiful hotel,"Great place to stay in Austin. In the heart of the action. The hotel restaurant is a must. Very good. Pool area was crowded, but expected on a hot day. Free margaritas and snacks everyday in the afternoon. Who could ask for more? I recommend this hotel."
4,Birthday weekend getaway,"If you wanna be literally next and close to the best spots in Austin Texas this is the place to be: GREAT location!On a different note tho I went with my boyfriend to celebrate my bday weekend and to also relax and get away from routine... probably not the best place to do so. Room was overall pretty nice, great view; lobby and 4th floor was also very nice, pool area tho: super overrated in my opinion. It is so packed and loud you can hardly enjoy, unless you are in the mood for a handful of bachelorettes that take the whole area. Prices for drinks and food also pretty high compared to all the places close by where you can go and enjoy a drink or a good meal for a much better price.The scooter situation makes it very nice to get around tho.I had a lot of fun!"
5,Awesome vibe and great location,"Loved, loved, loved this hotel! This hotel had such a great vibe. Modern but very comfortable. Service was great at both check in and check out as well as the bar, restaurant and coffee shop. We loved the live music at Geraldine's and the outdoor deck/pool was beautiful! The location is great and just around the corner there are cute restaurants, bars and food trucks. We will definitely be back and hopefully for a longer stay to check out more of Austin."
2,Charges and NickThinks (and Nickel-Dimes) like a Four Seasons but my experience was more Motel 6,"To my fellow TripAdvisor reviewers, I love you, you’ve steered me to so many great places but when it comes to this hotel…What the heck were you thinking?Positives :1. Audrey? at check-in was very friendly and greeted us more than once with a genuine smile. We also got to the hotel 5 hours before check-in and after a short wait were given a room. Very nice. One caveat - they charge your credit card 100.00 dollars per day for incidentals and then refund what you don’t use. That seemed excessive to me.2. Housekeeping was good and consistent. Never came back to an untidy room.Additionally lights on table lamps and bathroom light had dimmers which was nice.3. Evening reception hour with beer and margaritas was good and they do it on the weekends as well.Negatives :They started right away :1. The elevator required a room key to scan before you could select your floor. This system was terrible and more than half the time it didn’t work on the first try. On one occasion I scanned the card (it blinked green) and the elevator stopped 6 floors above my floor. Numerous other guests had issues not just myself.2. Getting off the elevator on floor 6 at noon my wife and I thought we had mistakenly selected “dungeon” on the elevator. It was VERY, VERY dark (Creepy!) with a musty smell.3. Arriving at my room it appeared clean and satisfactory. I like to keep my hotel room cool (69°). Upon entering the thermostat was set to 65°, the room temp read 73° and it felt warmer. I tried to turn it down but 65 was as low as it would go. I called the front desk and asked if someone could check it and their response was we’ll have someone check it but when it gets real hot in the heat of the day it might not be able maintain the desired temperature. What? Come again? After about 2 hours maintenance did show up and replaced the AC filter (which was completely clogged) after this room temp was significantly better but never got as cool as I liked or set the thermostat to.4. This is mostly on me but when I went to connect to the internet I found its 13.00 dollars a day for 3 devices max. I’ve stayed at many upscale hotels and I realize many charge for internet but this place certainly didn’t live up to being in their league.5. Next I was thirsty and wanted a soda. Any vending machines in the entire hotel? No. But they’ll be happy to sell you an 8.5 ounce Diet Coke for 3.50 cents (4 for 14.00 dollars actually) Thats basically 5 bucks for a 12 oz soda. Come on! Too make matters worse they know they’ve got you because there are no convenience stores anywhere near the hotel.6. Don’t expect to relax and float around in the pool. (See picture from our room on a Saturday afternoon)7. Lots of other minor annoyances :a) channel selection on the TV was poor. I’ve had muchbetter at hotels that were half the cost.b) Clock in the room was 25 mins slow.c) Parking is well over 50.00 dollars a day with tax. Again Kimpton thinks it’s a four seasons in the heart of a major metropolis - sorry guys- you aren’t!d) Constant annoying throbbing noise outside our room window both night and day (It didn’t seem like a drumbeat) never could figure out what it was or were it was coming from.So Kimpton Van Zandt thinks (and charges) like it’s an upscale hotel but doesn’t deliver even close to that type of experience. It’s the biggest nickel/dime hotel I’ve ever stayed at. Don’t get the good reviews. Absolutely would never return."
5,Great vibe and service,"We spent 3 nights here and loved it!The hotel has a great vibe and the service was excellent, down to the finer details. The rooms were very spacious and the hotel offer a social drink in the afternoon, which was a fantastic way to meet other guests. The margaritas were also fabulous.The pool was very busy due to the heat but their were always sun beds available.Location was good with a short walk to downtown, Rainey Street which was full of bars / restaurants. Also walkable to Congress Bridge to see the bats and then onto SoCo.Can’t fault and would look for Kimpton hotels in other cities."
4,Great weekend get away,The location and Hotel was a perfect place to hang out the entire weekend. The live music and happy hour was a pleasant surprise. The rooftop pool was also nice. The rooms were spacious and luxurious. Highly recommend! The pay to park was the only downside to staying here.
4,Weekend get away,"The hotel is lovely, the doorman greats very one; it is right next to Rainey Street which is very popular, so you can walk and not have to worry about finding a parking spot or drinking after enjoying an adult beverage or two. The pool was also very nice with an outdoor bar. Will stay here again when in town."
5,Awesome hotel and location,"Austin is such a great city. It’s also pretty expensive. The Van Zandt is no exception. Having said that, it does deliver on a relaxing and more than comfortable experience. The staff is accommodating and appropriately friendly. The rooms are outstanding-fairly good size. This trip I was upgraded to a suite—and that was sweet! The beds are beyond comfortable. The bathrooms are well appointed and they don’t skimp on towels or washcloths. The shower is fabulous! Am in room yoga mat made my inner yogi so happy! The pool area is awesome. They provide generous towels and sunscreen along with full bar and food menu. Also poolside water is easily accessible. The location makes it easy to get almost anywhere. I didn’t have a car, but understand that’s pretty pricey. This is my second time here and I know there will be a third...and more!"
4,"A nice hotel, but not the most family-friendly.","The hotel itself is lovely, new, modern, well-designed. The customer service at the hotel is also great. Unfortunately, we were not prepared for the clientele staying there. Mostly young partying crowd, as it's in a loud neighborhood with lots of bars and music venues. We felt out of place with our five-year-old in tow. The first night, a Saturday, the pool was chock full, playing loud music until very late (heard it from the 12th floor) and we were woken up in the middle of the night with kids partying in our hall. It calmed down a bit after that but by the afternoon each day, the pool was full of young drinking adults and again, not really a place for a young child."
5,SIOUXper Woman!,"I have two clients whose flights were cancelled tonight and I called to see if the Van Zandt can help reinstate there reservations that they checked out of earlier today. Rooms were rather scarce but after speaking with her supervisor, they were able to get rooms for both of my clients.Sioux was very professional and was very helpful with the changes. Thank you Sioux for helping my clients out and the Kimpton Van Zandt is lucky to have you! (Give this hero a raise!)"
